ID,UF,geocode,nome_municipio,data_original,datetime,fonte
1,MG,314870,PEDRA AZUL,16/01/2017,2017-01-16,opendatasus
2,AC,120001,ACRELÂNDIA,30/01/2020,2020-01-30,opendatasus
3,AC,120038,PLÁCIDO DE CASTRO,14/03/2021,2021-03-14,opendatasus
4,AM,130030,AUTAZES,30/03/2017,2017-03-30,opendatasus
5,AM,130130,CODAJÁS,28/02/2019,2019-02-28,opendatasus
6,AM,130170,HUMAITÁ,02/12/2018,2018-12-02,opendatasus
7,AM,130200,ITAPIRANGA,15/07/2016,2016-07-15,opendatasus
8,AM,130250,MANACAPURU,18/05/2016,2016-05-18,opendatasus
9,AM,130280,MARAĂ,14/02/2023,2023-02-14,opendatasus
10,RR,140005,ALTO ALEGRE,17/11/2018,2018-11-17,opendatasus
11,RR,140010,BOA VISTA,06/03/2017,2017-03-06,opendatasus
12,RR,140047,RORAINÓPOLIS,11/02/2017,2017-02-11,opendatasus
13,RR,140047,RORAINÓPOLIS,27/08/2023,2023-08-27,opendatasus
14,RR,140050,SĂO JOĂO DA BALIZA,20/03/2017,2017-03-20,opendatasus
15,PA,150030,AFUÁ,26/07/2015,2015-07-26,opendatasus
16,PA,150030,AFUÁ,06/02/2019,2019-02-06,opendatasus
17,PA,150030,AFUÁ,19/05/2021,2021-05-19,opendatasus
18,PA,150030,AFUÁ,07/07/2021,2021-07-07,opendatasus
19,PA,150030,AFUÁ,23/07/2021,2021-07-23,opendatasus
20,PA,150030,AFUÁ,12/03/2022,2022-03-12,opendatasus
21,PA,150040,ALENQUER,19/02/2017,2017-02-19,opendatasus
22,PA,150040,ALENQUER,07/03/2017,2017-03-07,opendatasus
23,PA,150040,ALENQUER,13/03/2017,2017-03-13,opendatasus
24,PA,150040,ALENQUER,14/03/2017,2017-03-14,opendatasus
25,PA,150040,ALENQUER,20/03/2017,2017-03-20,opendatasus
26,PA,150085,ANAPU,25/03/2019,2019-03-25,opendatasus
27,PA,150140,BELÉM,22/02/2017,2017-02-22,opendatasus
28,PA,150180,BREVES,03/05/2019,2019-05-03,opendatasus
29,PA,150275,CONCÓRDIA DO PARÁ,07/03/2017,2017-03-07,opendatasus
30,PA,150285,CURUÁ,26/03/2017,2017-03-26,opendatasus
31,PA,150310,GURUPÁ,18/02/2015,2015-02-18,opendatasus
32,PA,150360,ITAITUBA,23/01/2017,2017-01-23,opendatasus
33,PA,150390,JURUTI,01/04/2017,2017-04-01,opendatasus
34,PA,150442,MARITUBA,24/02/2017,2017-02-24,opendatasus
35,PA,150480,MONTE ALEGRE,11/05/2014,2014-05-11,opendatasus
36,PA,150480,MONTE ALEGRE,24/02/2017,2017-02-24,opendatasus
37,PA,150480,MONTE ALEGRE,01/03/2017,2017-03-01,opendatasus
38,PA,150480,MONTE ALEGRE,10/03/2017,2017-03-10,opendatasus
39,PA,150480,MONTE ALEGRE,06/04/2017,2017-04-06,opendatasus
40,PA,150506,NOVO REPARTIMENTO,28/03/2017,2017-03-28,opendatasus
41,PA,150510,ÓBIDOS,01/04/2017,2017-04-01,opendatasus
42,PA,150520,OEIRAS DO PARÁ,09/12/2021,2021-12-09,opendatasus
43,PA,150530,ORIXIMINÁ,27/02/2017,2017-02-27,opendatasus
44,PA,150563,PIÇARRA,07/04/2017,2017-04-07,opendatasus
45,PA,150565,PLACAS,18/02/2017,2017-02-18,opendatasus
46,PA,150565,PLACAS,20/03/2017,2017-03-20,opendatasus
47,PA,150619,RURÓPOLIS,15/02/2017,2017-02-15,opendatasus
48,PA,150619,RURÓPOLIS,17/02/2017,2017-02-17,opendatasus
49,PA,150630,SALVATERRA,24/02/2017,2017-02-24,opendatasus
50,PA,150680,SANTARÉM,24/03/2017,2017-03-24,opendatasus
51,PA,150680,SANTARÉM,01/02/2019,2019-02-01,opendatasus
52,PA,150680,SANTARÉM,02/07/2019,2019-07-02,opendatasus
53,PA,150810,TUCURUÍ,24/03/2017,2017-03-24,opendatasus
54,TO,170950,GURUPI,19/03/2022,2022-03-19,opendatasus
55,TO,171575,PALMEIRÓPOLIS,02/05/2022,2022-05-02,opendatasus
56,TO,171820,PORTO NACIONAL,19/01/2015,2015-01-19,opendatasus
57,TO,171820,PORTO NACIONAL,08/04/2015,2015-04-08,opendatasus
58,TO,171820,PORTO NACIONAL,12/06/2015,2015-06-12,opendatasus
59,TO,171820,PORTO NACIONAL,13/08/2015,2015-08-13,opendatasus
60,TO,171820,PORTO NACIONAL,20/10/2015,2015-10-20,opendatasus
61,TO,171820,PORTO NACIONAL,13/01/2017,2017-01-13,opendatasus
62,TO,171820,PORTO NACIONAL,05/05/2017,2017-05-05,opendatasus
63,TO,171820,PORTO NACIONAL,12/09/2017,2017-09-12,opendatasus
64,TO,171820,PORTO NACIONAL,12/01/2018,2018-01-12,opendatasus
65,TO,172025,SĂO SALVADOR DO TOCANTINS,13/03/2022,2022-03-13,opendatasus
66,TO,172090,TAGUATINGA,02/07/2014,2014-07-02,opendatasus
67,TO,172100,PALMAS,25/07/2015,2015-07-25,opendatasus
68,TO,172100,PALMAS,29/09/2017,2017-09-29,opendatasus
69,TO,172100,PALMAS,18/01/2018,2018-01-18,opendatasus
70,TO,172210,XAMBIOÁ,03/01/2017,2017-01-03,opendatasus
71,BA,290070,ALAGOINHAS,30/01/2017,2017-01-30,opendatasus
72,BA,290070,ALAGOINHAS,16/02/2017,2017-02-16,opendatasus
73,BA,290070,ALAGOINHAS,13/03/2017,2017-03-13,opendatasus
74,BA,290327,BARROCAS,16/04/2017,2017-04-16,opendatasus
75,BA,290360,BIRITINGA,22/03/2017,2017-03-22,opendatasus
76,BA,290570,CAMAÇARI,03/02/2017,2017-02-03,opendatasus
77,BA,290570,CAMAÇARI,16/03/2017,2017-03-16,opendatasus
78,BA,290570,CAMAÇARI,19/04/2017,2017-04-19,opendatasus
79,BA,290650,CANDEIAS,06/04/2017,2017-04-06,opendatasus
80,BA,290750,CATU,15/03/2017,2017-03-15,opendatasus
81,BA,290900,CORDEIROS,19/03/2017,2017-03-19,opendatasus
82,BA,291060,ESPLANADA,21/03/2017,2017-03-21,opendatasus
83,BA,291080,FEIRA DE SANTANA,17/03/2017,2017-03-17,opendatasus
84,BA,291080,FEIRA DE SANTANA,07/04/2017,2017-04-07,opendatasus
85,BA,291080,FEIRA DE SANTANA,19/04/2017,2017-04-19,opendatasus
86,BA,291330,ICHU,22/03/2017,2017-03-22,opendatasus
87,BA,291450,IRARÁ,07/05/2017,2017-05-07,opendatasus
88,BA,291610,ITAPARICA,21/03/2017,2017-03-21,opendatasus
89,BA,291730,ITUBERÁ,14/03/2017,2017-03-14,opendatasus
90,BA,291920,LAURO DE FREITAS,04/04/2017,2017-04-04,opendatasus
91,BA,292100,MATA DE SĂO JOĂO,19/04/2017,2017-04-19,opendatasus
92,BA,292300,NOVA VIÇOSA,21/02/2017,2017-02-21,opendatasus
93,BA,292330,OURIÇANGAS,15/03/2017,2017-03-15,opendatasus
94,BA,292400,PAULO AFONSO,05/04/2017,2017-04-05,opendatasus
95,BA,292410,PEDRĂO,15/03/2017,2017-03-15,opendatasus
96,BA,292630,RIACHĂO DO JACUÍPE,06/04/2017,2017-04-06,opendatasus
97,BA,292740,SALVADOR,10/03/2017,2017-03-10,opendatasus
98,BA,292740,SALVADOR,14/03/2017,2017-03-14,opendatasus
99,BA,292740,SALVADOR,15/03/2017,2017-03-15,opendatasus
100,BA,292740,SALVADOR,16/03/2017,2017-03-16,opendatasus
101,BA,292740,SALVADOR,03/04/2017,2017-04-03,opendatasus
102,BA,292740,SALVADOR,05/04/2017,2017-04-05,opendatasus
103,BA,292740,SALVADOR,06/04/2017,2017-04-06,opendatasus
104,BA,292740,SALVADOR,09/04/2017,2017-04-09,opendatasus
105,BA,292840,SANTA RITA DE CÁSSIA,13/03/2017,2017-03-13,opendatasus
106,BA,292910,SĂO FELIPE,10/03/2017,2017-03-10,opendatasus
107,BA,292920,SĂO FRANCISCO DO CONDE,19/04/2017,2017-04-19,opendatasus
108,BA,292930,SĂO GONÇALO DOS CAMPOS,20/03/2017,2017-03-20,opendatasus
109,BA,292930,SĂO GONÇALO DOS CAMPOS,07/04/2017,2017-04-07,opendatasus
110,BA,292940,SĂO MIGUEL DAS MATAS,12/03/2017,2017-03-12,opendatasus
111,BA,292980,SAÚDE,16/03/2017,2017-03-16,opendatasus
112,BA,293320,VERA CRUZ,22/03/2017,2017-03-22,opendatasus
113,BA,293320,VERA CRUZ,27/03/2017,2017-03-27,opendatasus
114,MG,310040,ACAIACA,17/01/2018,2018-01-17,opendatasus
115,MG,310040,ACAIACA,19/01/2018,2018-01-19,opendatasus
116,MG,310040,ACAIACA,20/01/2018,2018-01-20,opendatasus
117,MG,310040,ACAIACA,28/01/2018,2018-01-28,opendatasus
118,MG,310060,ÁGUA BOA,09/01/2017,2017-01-09,opendatasus
119,MG,310060,ÁGUA BOA,10/01/2017,2017-01-10,opendatasus
120,MG,310080,AGUANIL,16/01/2018,2018-01-16,opendatasus
121,MG,310110,AIMORÉS,07/01/2017,2017-01-07,opendatasus
122,MG,310110,AIMORÉS,18/01/2017,2017-01-18,opendatasus
123,MG,310110,AIMORÉS,20/01/2017,2017-01-20,opendatasus
124,MG,310110,AIMORÉS,23/01/2017,2017-01-23,opendatasus
125,MG,310110,AIMORÉS,14/02/2017,2017-02-14,opendatasus
126,MG,310150,ALÉM PARAÍBA,13/07/2017,2017-07-13,opendatasus
127,MG,310150,ALÉM PARAÍBA,17/07/2017,2017-07-17,opendatasus
128,MG,310150,ALÉM PARAÍBA,27/07/2017,2017-07-27,opendatasus
129,MG,310163,ALFREDO VASCONCELOS,03/02/2018,2018-02-03,opendatasus
130,MG,310210,ALTO RIO DOCE,25/02/2018,2018-02-25,opendatasus
131,MG,310220,ALVARENGA,11/01/2017,2017-01-11,opendatasus
132,MG,310220,ALVARENGA,16/01/2017,2017-01-16,opendatasus
133,MG,310230,ALVINÓPOLIS,16/11/2017,2017-11-16,opendatasus
134,MG,310230,ALVINÓPOLIS,17/01/2018,2018-01-17,opendatasus
135,MG,310250,AMPARO DO SERRA,15/01/2018,2018-01-15,opendatasus
136,MG,310260,ANDRADAS,14/03/2018,2018-03-14,opendatasus
137,MG,310285,ANGELÂNDIA,25/01/2017,2017-01-25,opendatasus
138,MG,310290,ANTÔNIO CARLOS,22/01/2018,2018-01-22,opendatasus
139,MG,310290,ANTÔNIO CARLOS,25/01/2018,2018-01-25,opendatasus
140,MG,310290,ANTÔNIO CARLOS,16/02/2018,2018-02-16,opendatasus
141,MG,310290,ANTÔNIO CARLOS,21/02/2018,2018-02-21,opendatasus
142,MG,310290,ANTÔNIO CARLOS,29/04/2018,2018-04-29,opendatasus
143,MG,310300,ANTÔNIO DIAS,09/02/2017,2017-02-09,opendatasus
144,MG,310400,ARAXÁ,14/02/2017,2017-02-14,opendatasus
145,MG,310445,ARICANDUVA,25/01/2017,2017-01-25,opendatasus
146,MG,310450,ARINOS,31/03/2015,2015-03-31,opendatasus
147,MG,310450,ARINOS,02/05/2015,2015-05-02,opendatasus
148,MG,310490,BAEPENDI,23/03/2018,2018-03-23,opendatasus
149,MG,310490,BAEPENDI,02/04/2018,2018-04-02,opendatasus
150,MG,310540,BARĂO DE COCAIS,06/01/2018,2018-01-06,opendatasus
151,MG,310540,BARĂO DE COCAIS,09/01/2018,2018-01-09,opendatasus
152,MG,310540,BARĂO DE COCAIS,12/01/2018,2018-01-12,opendatasus
153,MG,310540,BARĂO DE COCAIS,13/01/2018,2018-01-13,opendatasus
154,MG,310540,BARĂO DE COCAIS,14/01/2018,2018-01-14,opendatasus
155,MG,310540,BARĂO DE COCAIS,16/01/2018,2018-01-16,opendatasus
156,MG,310540,BARĂO DE COCAIS,18/01/2018,2018-01-18,opendatasus
157,MG,310540,BARĂO DE COCAIS,19/01/2018,2018-01-19,opendatasus
158,MG,310540,BARĂO DE COCAIS,24/01/2018,2018-01-24,opendatasus
159,MG,310540,BARĂO DE COCAIS,25/01/2018,2018-01-25,opendatasus
160,MG,310540,BARĂO DE COCAIS,01/02/2018,2018-02-01,opendatasus
161,MG,310540,BARĂO DE COCAIS,02/02/2018,2018-02-02,opendatasus
162,MG,310540,BARĂO DE COCAIS,06/02/2018,2018-02-06,opendatasus
163,MG,310540,BARĂO DE COCAIS,08/02/2018,2018-02-08,opendatasus
164,MG,310540,BARĂO DE COCAIS,09/02/2018,2018-02-09,opendatasus
165,MG,310540,BARĂO DE COCAIS,13/02/2018,2018-02-13,opendatasus
166,MG,310540,BARĂO DE COCAIS,14/02/2018,2018-02-14,opendatasus
167,MG,310540,BARĂO DE COCAIS,25/02/2018,2018-02-25,opendatasus
168,MG,310560,BARBACENA,19/01/2018,2018-01-19,opendatasus
169,MG,310560,BARBACENA,16/02/2018,2018-02-16,opendatasus
170,MG,310570,BARRA LONGA,27/12/2017,2017-12-27,opendatasus
171,MG,310570,BARRA LONGA,15/01/2018,2018-01-15,opendatasus
172,MG,310590,BARROSO,26/02/2018,2018-02-26,opendatasus
173,MG,310600,BELA VISTA DE MINAS,03/01/2018,2018-01-03,opendatasus
174,MG,310610,BELMIRO BRAGA,18/12/2017,2017-12-18,opendatasus
175,MG,310610,BELMIRO BRAGA,03/01/2018,2018-01-03,opendatasus
176,MG,310620,BELO HORIZONTE,24/08/2016,2016-08-24,opendatasus
177,MG,310620,BELO HORIZONTE,21/01/2017,2017-01-21,opendatasus
178,MG,310620,BELO HORIZONTE,19/07/2017,2017-07-19,opendatasus
179,MG,310620,BELO HORIZONTE,27/07/2017,2017-07-27,opendatasus
180,MG,310620,BELO HORIZONTE,27/11/2017,2017-11-27,opendatasus
181,MG,310620,BELO HORIZONTE,29/11/2017,2017-11-29,opendatasus
182,MG,310620,BELO HORIZONTE,30/11/2017,2017-11-30,opendatasus
183,MG,310620,BELO HORIZONTE,17/01/2018,2018-01-17,opendatasus
184,MG,310620,BELO HORIZONTE,03/02/2018,2018-02-03,opendatasus
185,MG,310620,BELO HORIZONTE,12/02/2018,2018-02-12,opendatasus
186,MG,310620,BELO HORIZONTE,15/02/2018,2018-02-15,opendatasus
187,MG,310620,BELO HORIZONTE,05/07/2021,2021-07-05,opendatasus
188,MG,310640,BELO VALE,23/01/2018,2018-01-23,opendatasus
189,MG,310640,BELO VALE,28/01/2018,2018-01-28,opendatasus
190,MG,310640,BELO VALE,01/02/2018,2018-02-01,opendatasus
191,MG,310670,BETIM,24/01/2017,2017-01-24,opendatasus
192,MG,310670,BETIM,31/01/2017,2017-01-31,opendatasus
193,MG,310690,BICAS,13/01/2018,2018-01-13,opendatasus
194,MG,310690,BICAS,01/02/2018,2018-02-01,opendatasus
195,MG,310730,BOCAIÚVA,23/01/2017,2017-01-23,opendatasus
196,MG,310730,BOCAIÚVA,02/02/2017,2017-02-02,opendatasus
197,MG,310750,BOM JARDIM DE MINAS,20/02/2018,2018-02-20,opendatasus
198,MG,310770,BOM JESUS DO AMPARO,24/01/2018,2018-01-24,opendatasus
199,MG,310770,BOM JESUS DO AMPARO,24/02/2018,2018-02-24,opendatasus
200,MG,310780,BOM JESUS DO GALHO,10/01/2017,2017-01-10,opendatasus
201,MG,310780,BOM JESUS DO GALHO,13/01/2017,2017-01-13,opendatasus
202,MG,310780,BOM JESUS DO GALHO,14/01/2017,2017-01-14,opendatasus
203,MG,310780,BOM JESUS DO GALHO,17/01/2017,2017-01-17,opendatasus
204,MG,310780,BOM JESUS DO GALHO,20/01/2017,2017-01-20,opendatasus
205,MG,310780,BOM JESUS DO GALHO,23/01/2017,2017-01-23,opendatasus
206,MG,310810,BONFIM,16/01/2018,2018-01-16,opendatasus
207,MG,310860,BRASÍLIA DE MINAS,20/03/2016,2016-03-20,opendatasus
208,MG,310860,BRASÍLIA DE MINAS,05/10/2021,2021-10-05,opendatasus
209,MG,310860,BRASÍLIA DE MINAS,29/10/2021,2021-10-29,opendatasus
210,MG,310860,BRASÍLIA DE MINAS,17/01/2022,2022-01-17,opendatasus
211,MG,310860,BRASÍLIA DE MINAS,18/01/2022,2022-01-18,opendatasus
212,MG,310860,BRASÍLIA DE MINAS,04/11/2022,2022-11-04,opendatasus
213,MG,310870,BRÁS PIRES,15/04/2018,2018-04-15,opendatasus
214,MG,310890,BRAZÓPOLIS,07/02/2018,2018-02-07,opendatasus
215,MG,310890,BRAZÓPOLIS,08/02/2018,2018-02-08,opendatasus
216,MG,310890,BRAZÓPOLIS,27/02/2018,2018-02-27,opendatasus
217,MG,310890,BRAZÓPOLIS,21/03/2018,2018-03-21,opendatasus
218,MG,310900,BRUMADINHO,24/12/2017,2017-12-24,opendatasus
219,MG,310900,BRUMADINHO,04/01/2018,2018-01-04,opendatasus
220,MG,310900,BRUMADINHO,05/01/2018,2018-01-05,opendatasus
221,MG,310900,BRUMADINHO,08/01/2018,2018-01-08,opendatasus
222,MG,310900,BRUMADINHO,09/01/2018,2018-01-09,opendatasus
223,MG,310900,BRUMADINHO,10/01/2018,2018-01-10,opendatasus
224,MG,310900,BRUMADINHO,12/01/2018,2018-01-12,opendatasus
225,MG,310900,BRUMADINHO,14/01/2018,2018-01-14,opendatasus
226,MG,310900,BRUMADINHO,15/01/2018,2018-01-15,opendatasus
227,MG,310900,BRUMADINHO,16/01/2018,2018-01-16,opendatasus
228,MG,310900,BRUMADINHO,21/01/2018,2018-01-21,opendatasus
229,MG,310900,BRUMADINHO,23/01/2018,2018-01-23,opendatasus
230,MG,310900,BRUMADINHO,24/01/2018,2018-01-24,opendatasus
231,MG,310900,BRUMADINHO,04/02/2018,2018-02-04,opendatasus
232,MG,310900,BRUMADINHO,05/02/2018,2018-02-05,opendatasus
233,MG,310900,BRUMADINHO,07/02/2018,2018-02-07,opendatasus
234,MG,310930,BURITIS,11/05/2015,2015-05-11,opendatasus
235,MG,310970,CACHOEIRA DE MINAS,24/01/2018,2018-01-24,opendatasus
236,MG,311000,CAETÉ,29/10/2017,2017-10-29,opendatasus
237,MG,311000,CAETÉ,21/12/2017,2017-12-21,opendatasus
238,MG,311000,CAETÉ,06/01/2018,2018-01-06,opendatasus
239,MG,311000,CAETÉ,08/01/2018,2018-01-08,opendatasus
240,MG,311000,CAETÉ,09/01/2018,2018-01-09,opendatasus
241,MG,311000,CAETÉ,15/01/2018,2018-01-15,opendatasus
242,MG,311000,CAETÉ,16/01/2018,2018-01-16,opendatasus
243,MG,311000,CAETÉ,17/01/2018,2018-01-17,opendatasus
244,MG,311000,CAETÉ,19/01/2018,2018-01-19,opendatasus
245,MG,311000,CAETÉ,20/01/2018,2018-01-20,opendatasus
246,MG,311000,CAETÉ,25/01/2018,2018-01-25,opendatasus
247,MG,311000,CAETÉ,27/01/2018,2018-01-27,opendatasus
248,MG,311000,CAETÉ,31/01/2018,2018-01-31,opendatasus
249,MG,311000,CAETÉ,04/02/2018,2018-02-04,opendatasus
250,MG,311000,CAETÉ,12/02/2018,2018-02-12,opendatasus
251,MG,311000,CAETÉ,17/02/2018,2018-02-17,opendatasus
252,MG,311000,CAETÉ,20/02/2018,2018-02-20,opendatasus
253,MG,311050,CAMANDUCAIA,24/01/2018,2018-01-24,opendatasus
254,MG,311060,CAMBUÍ,04/03/2018,2018-03-04,opendatasus
255,MG,311070,CAMBUQUIRA,27/02/2018,2018-02-27,opendatasus
256,MG,311170,CANAĂ,11/04/2017,2017-04-11,opendatasus
257,MG,311220,CAPELA NOVA,26/01/2018,2018-01-26,opendatasus
258,MG,311230,CAPELINHA,10/03/2017,2017-03-10,opendatasus
259,MG,311270,CAPITĂO ENÉAS,02/02/2017,2017-02-02,opendatasus
260,MG,311280,CAPITÓLIO,15/01/2017,2017-01-15,opendatasus
261,MG,311280,CAPITÓLIO,31/01/2017,2017-01-31,opendatasus
262,MG,311290,CAPUTIRA,27/01/2017,2017-01-27,opendatasus
263,MG,311290,CAPUTIRA,14/04/2017,2017-04-14,opendatasus
264,MG,311300,CARAÍ,17/01/2017,2017-01-17,opendatasus
265,MG,311310,CARANAÍBA,28/01/2018,2018-01-28,opendatasus
266,MG,311320,CARANDAÍ,26/01/2018,2018-01-26,opendatasus
267,MG,311320,CARANDAÍ,04/02/2018,2018-02-04,opendatasus
268,MG,311330,CARANGOLA,20/02/2017,2017-02-20,opendatasus
269,MG,311330,CARANGOLA,06/03/2017,2017-03-06,opendatasus
270,MG,311340,CARATINGA,25/12/2016,2016-12-25,opendatasus
271,MG,311340,CARATINGA,26/12/2016,2016-12-26,opendatasus
272,MG,311340,CARATINGA,01/01/2017,2017-01-01,opendatasus
273,MG,311340,CARATINGA,02/01/2017,2017-01-02,opendatasus
274,MG,311340,CARATINGA,03/01/2017,2017-01-03,opendatasus
275,MG,311340,CARATINGA,04/01/2017,2017-01-04,opendatasus
276,MG,311340,CARATINGA,05/01/2017,2017-01-05,opendatasus
277,MG,311340,CARATINGA,07/01/2017,2017-01-07,opendatasus
278,MG,311340,CARATINGA,08/01/2017,2017-01-08,opendatasus
279,MG,311340,CARATINGA,09/01/2017,2017-01-09,opendatasus
280,MG,311340,CARATINGA,13/01/2017,2017-01-13,opendatasus
281,MG,311340,CARATINGA,14/01/2017,2017-01-14,opendatasus
282,MG,311340,CARATINGA,15/01/2017,2017-01-15,opendatasus
283,MG,311340,CARATINGA,19/01/2017,2017-01-19,opendatasus
284,MG,311340,CARATINGA,21/01/2017,2017-01-21,opendatasus
285,MG,311340,CARATINGA,22/01/2017,2017-01-22,opendatasus
286,MG,311340,CARATINGA,26/01/2017,2017-01-26,opendatasus
287,MG,311340,CARATINGA,28/01/2017,2017-01-28,opendatasus
288,MG,311340,CARATINGA,02/02/2017,2017-02-02,opendatasus
289,MG,311340,CARATINGA,06/02/2017,2017-02-06,opendatasus
290,MG,311340,CARATINGA,12/02/2017,2017-02-12,opendatasus
291,MG,311360,CAREAÇU,16/02/2018,2018-02-16,opendatasus
292,MG,311390,CARMO DA CACHOEIRA,17/02/2018,2018-02-17,opendatasus
293,MG,311400,CARMO DA MATA,30/12/2017,2017-12-30,opendatasus
294,MG,311400,CARMO DA MATA,23/01/2018,2018-01-23,opendatasus
295,MG,311450,CARMÓPOLIS DE MINAS,21/01/2018,2018-01-21,opendatasus
296,MG,311490,CASA GRANDE,05/11/2017,2017-11-05,opendatasus
297,MG,311490,CASA GRANDE,07/11/2017,2017-11-07,opendatasus
298,MG,311500,CASCALHO RICO,04/02/2017,2017-02-04,opendatasus
299,MG,311535,CATAS ALTAS,29/01/2018,2018-01-29,opendatasus
300,MG,311600,CHALÉ,19/01/2017,2017-01-19,opendatasus
301,MG,311600,CHALÉ,20/01/2017,2017-01-20,opendatasus
302,MG,311615,CHAPADA GAÚCHA,01/02/2017,2017-02-01,opendatasus
303,MG,311630,CIPOTÂNEA,26/01/2018,2018-01-26,opendatasus
304,MG,311630,CIPOTÂNEA,06/02/2018,2018-02-06,opendatasus
305,MG,311680,COLUNA,07/01/2017,2017-01-07,opendatasus
306,MG,311680,COLUNA,12/01/2017,2017-01-12,opendatasus
307,MG,311740,CONCEIÇĂO DE IPANEMA,08/01/2017,2017-01-08,opendatasus
308,MG,311740,CONCEIÇĂO DE IPANEMA,18/01/2017,2017-01-18,opendatasus
309,MG,311740,CONCEIÇĂO DE IPANEMA,02/02/2017,2017-02-02,opendatasus
310,MG,311770,CONCEIÇĂO DO RIO VERDE,11/04/2018,2018-04-11,opendatasus
311,MG,311780,CONCEIÇĂO DOS OUROS,14/01/2018,2018-01-14,opendatasus
312,MG,311780,CONCEIÇĂO DOS OUROS,23/01/2018,2018-01-23,opendatasus
313,MG,311780,CONCEIÇĂO DOS OUROS,25/01/2018,2018-01-25,opendatasus
314,MG,311783,CÔNEGO MARINHO,22/07/2016,2016-07-22,opendatasus
315,MG,311790,CONGONHAL,26/01/2018,2018-01-26,opendatasus
316,MG,311790,CONGONHAL,03/04/2018,2018-04-03,opendatasus
317,MG,311800,CONGONHAS,07/11/2017,2017-11-07,opendatasus
318,MG,311800,CONGONHAS,01/02/2018,2018-02-01,opendatasus
319,MG,311800,CONGONHAS,11/02/2018,2018-02-11,opendatasus
320,MG,311800,CONGONHAS,13/02/2018,2018-02-13,opendatasus
321,MG,311830,CONSELHEIRO LAFAIETE,27/01/2017,2017-01-27,opendatasus
322,MG,311830,CONSELHEIRO LAFAIETE,11/01/2018,2018-01-11,opendatasus
323,MG,311830,CONSELHEIRO LAFAIETE,22/01/2018,2018-01-22,opendatasus
324,MG,311830,CONSELHEIRO LAFAIETE,30/01/2018,2018-01-30,opendatasus
325,MG,311830,CONSELHEIRO LAFAIETE,31/01/2018,2018-01-31,opendatasus
326,MG,311830,CONSELHEIRO LAFAIETE,03/02/2018,2018-02-03,opendatasus
327,MG,311830,CONSELHEIRO LAFAIETE,05/02/2018,2018-02-05,opendatasus
328,MG,311830,CONSELHEIRO LAFAIETE,07/02/2018,2018-02-07,opendatasus
329,MG,311830,CONSELHEIRO LAFAIETE,13/02/2018,2018-02-13,opendatasus
330,MG,311830,CONSELHEIRO LAFAIETE,14/02/2018,2018-02-14,opendatasus
331,MG,311830,CONSELHEIRO LAFAIETE,15/02/2018,2018-02-15,opendatasus
332,MG,311840,CONSELHEIRO PENA,14/02/2017,2017-02-14,opendatasus
333,MG,311850,CONSOLAÇĂO,01/02/2018,2018-02-01,opendatasus
334,MG,311860,CONTAGEM,02/02/2017,2017-02-02,opendatasus
335,MG,311860,CONTAGEM,19/01/2018,2018-01-19,opendatasus
336,MG,311860,CONTAGEM,13/02/2018,2018-02-13,opendatasus
337,MG,311860,CONTAGEM,14/02/2018,2018-02-14,opendatasus
338,MG,311860,CONTAGEM,15/02/2018,2018-02-15,opendatasus
339,MG,311870,COQUEIRAL,23/01/2018,2018-01-23,opendatasus
340,MG,311880,CORAÇĂO DE JESUS,10/03/2016,2016-03-10,opendatasus
341,MG,311880,CORAÇĂO DE JESUS,19/09/2021,2021-09-19,opendatasus
342,MG,311940,CORONEL FABRICIANO,02/04/2017,2017-04-02,opendatasus
343,MG,311950,CORONEL MURTA,13/01/2017,2017-01-13,opendatasus
344,MG,312090,CURVELO,23/01/2017,2017-01-23,opendatasus
345,MG,312090,CURVELO,25/01/2017,2017-01-25,opendatasus
346,MG,312120,DELFINÓPOLIS,21/12/2016,2016-12-21,opendatasus
347,MG,312120,DELFINÓPOLIS,01/01/2017,2017-01-01,opendatasus
348,MG,312120,DELFINÓPOLIS,10/01/2017,2017-01-10,opendatasus
349,MG,312120,DELFINÓPOLIS,13/01/2017,2017-01-13,opendatasus
350,MG,312170,DIOGO DE VASCONCELOS,21/01/2018,2018-01-21,opendatasus
351,MG,312170,DIOGO DE VASCONCELOS,30/01/2018,2018-01-30,opendatasus
352,MG,312200,DIVINO,14/03/2017,2017-03-14,opendatasus
353,MG,312230,DIVINÓPOLIS,18/02/2018,2018-02-18,opendatasus
354,MG,312352,DURANDÉ,25/01/2017,2017-01-25,opendatasus
355,MG,312352,DURANDÉ,14/02/2017,2017-02-14,opendatasus
356,MG,312385,ENTRE FOLHAS,25/12/2016,2016-12-25,opendatasus
357,MG,312385,ENTRE FOLHAS,07/01/2017,2017-01-07,opendatasus
358,MG,312385,ENTRE FOLHAS,23/01/2017,2017-01-23,opendatasus
359,MG,312390,ENTRE RIOS DE MINAS,17/10/2017,2017-10-17,opendatasus
360,MG,312400,ERVÁLIA,14/01/2018,2018-01-14,opendatasus
361,MG,312410,ESMERALDAS,04/02/2017,2017-02-04,opendatasus
362,MG,312410,ESMERALDAS,20/11/2017,2017-11-20,opendatasus
363,MG,312500,EWBANK DA CÂMARA,07/02/2017,2017-02-07,opendatasus
364,MG,312510,EXTREMA,09/11/2017,2017-11-09,opendatasus
365,MG,312540,FELÍCIO DOS SANTOS,19/01/2017,2017-01-19,opendatasus
366,MG,312540,FELÍCIO DOS SANTOS,31/01/2017,2017-01-31,opendatasus
367,MG,312590,FERROS,17/02/2018,2018-02-17,opendatasus
368,MG,312595,FERVEDOURO,18/04/2017,2017-04-18,opendatasus
369,MG,312640,FORTUNA DE MINAS,18/02/2017,2017-02-18,opendatasus
370,MG,312675,FRANCISCÓPOLIS,06/02/2017,2017-02-06,opendatasus
371,MG,312680,FREI GASPAR,23/12/2016,2016-12-23,opendatasus
372,MG,312680,FREI GASPAR,04/01/2017,2017-01-04,opendatasus
373,MG,312680,FREI GASPAR,07/01/2017,2017-01-07,opendatasus
374,MG,312680,FREI GASPAR,08/01/2017,2017-01-08,opendatasus
375,MG,312680,FREI GASPAR,09/01/2017,2017-01-09,opendatasus
376,MG,312680,FREI GASPAR,10/01/2017,2017-01-10,opendatasus
377,MG,312680,FREI GASPAR,12/01/2017,2017-01-12,opendatasus
378,MG,312680,FREI GASPAR,13/01/2017,2017-01-13,opendatasus
379,MG,312680,FREI GASPAR,14/01/2017,2017-01-14,opendatasus
380,MG,312680,FREI GASPAR,15/01/2017,2017-01-15,opendatasus
381,MG,312680,FREI GASPAR,20/01/2017,2017-01-20,opendatasus
382,MG,312738,GOIANÁ,31/12/2017,2017-12-31,opendatasus
383,MG,312740,GONÇALVES,17/08/2017,2017-08-17,opendatasus
384,MG,312770,GOVERNADOR VALADARES,18/01/2017,2017-01-18,opendatasus
385,MG,312770,GOVERNADOR VALADARES,19/01/2017,2017-01-19,opendatasus
386,MG,312820,GUARACIABA,17/01/2018,2018-01-17,opendatasus
387,MG,312820,GUARACIABA,19/01/2018,2018-01-19,opendatasus
388,MG,312820,GUARACIABA,20/01/2018,2018-01-20,opendatasus
389,MG,312820,GUARACIABA,21/01/2018,2018-01-21,opendatasus
390,MG,312820,GUARACIABA,29/01/2018,2018-01-29,opendatasus
391,MG,312820,GUARACIABA,06/02/2018,2018-02-06,opendatasus
392,MG,312840,GUARANI,30/01/2018,2018-01-30,opendatasus
393,MG,312920,HELIODORA,22/02/2018,2018-02-22,opendatasus
394,MG,312950,IBIÁ,19/01/2017,2017-01-19,opendatasus
395,MG,313005,ICARAÍ DE MINAS,23/08/2021,2021-08-23,opendatasus
396,MG,313005,ICARAÍ DE MINAS,13/09/2021,2021-09-13,opendatasus
397,MG,313005,ICARAÍ DE MINAS,21/09/2021,2021-09-21,opendatasus
398,MG,313040,IJACI,15/02/2018,2018-02-15,opendatasus
399,MG,313055,IMBÉ DE MINAS,18/12/2016,2016-12-18,opendatasus
400,MG,313055,IMBÉ DE MINAS,23/12/2016,2016-12-23,opendatasus
401,MG,313055,IMBÉ DE MINAS,24/12/2016,2016-12-24,opendatasus
402,MG,313055,IMBÉ DE MINAS,26/12/2016,2016-12-26,opendatasus
403,MG,313055,IMBÉ DE MINAS,02/01/2017,2017-01-02,opendatasus
404,MG,313055,IMBÉ DE MINAS,05/01/2017,2017-01-05,opendatasus
405,MG,313055,IMBÉ DE MINAS,07/01/2017,2017-01-07,opendatasus
406,MG,313055,IMBÉ DE MINAS,08/01/2017,2017-01-08,opendatasus
407,MG,313055,IMBÉ DE MINAS,17/01/2017,2017-01-17,opendatasus
408,MG,313090,INHAPIM,31/12/2016,2016-12-31,opendatasus
409,MG,313090,INHAPIM,02/01/2017,2017-01-02,opendatasus
410,MG,313090,INHAPIM,04/01/2017,2017-01-04,opendatasus
411,MG,313090,INHAPIM,11/01/2017,2017-01-11,opendatasus
412,MG,313120,IPANEMA,19/12/2016,2016-12-19,opendatasus
413,MG,313120,IPANEMA,31/12/2016,2016-12-31,opendatasus
414,MG,313120,IPANEMA,04/01/2017,2017-01-04,opendatasus
415,MG,313120,IPANEMA,06/01/2017,2017-01-06,opendatasus
416,MG,313120,IPANEMA,09/01/2017,2017-01-09,opendatasus
417,MG,313120,IPANEMA,10/01/2017,2017-01-10,opendatasus
418,MG,313120,IPANEMA,11/01/2017,2017-01-11,opendatasus
419,MG,313120,IPANEMA,14/01/2017,2017-01-14,opendatasus
420,MG,313120,IPANEMA,18/01/2017,2017-01-18,opendatasus
421,MG,313120,IPANEMA,22/01/2017,2017-01-22,opendatasus
422,MG,313120,IPANEMA,23/01/2017,2017-01-23,opendatasus
423,MG,313120,IPANEMA,25/01/2017,2017-01-25,opendatasus
424,MG,313120,IPANEMA,29/01/2017,2017-01-29,opendatasus
425,MG,313130,IPATINGA,12/01/2017,2017-01-12,opendatasus
426,MG,313130,IPATINGA,13/01/2017,2017-01-13,opendatasus
427,MG,313130,IPATINGA,15/01/2017,2017-01-15,opendatasus
428,MG,313130,IPATINGA,19/01/2017,2017-01-19,opendatasus
429,MG,313130,IPATINGA,29/01/2017,2017-01-29,opendatasus
430,MG,313170,ITABIRA,07/02/2017,2017-02-07,opendatasus
431,MG,313170,ITABIRA,14/02/2017,2017-02-14,opendatasus
432,MG,313170,ITABIRA,18/01/2018,2018-01-18,opendatasus
433,MG,313170,ITABIRA,01/02/2018,2018-02-01,opendatasus
434,MG,313170,ITABIRA,04/02/2018,2018-02-04,opendatasus
435,MG,313170,ITABIRA,10/02/2018,2018-02-10,opendatasus
436,MG,313170,ITABIRA,12/02/2018,2018-02-12,opendatasus
437,MG,313170,ITABIRA,13/02/2018,2018-02-13,opendatasus
438,MG,313170,ITABIRA,15/02/2018,2018-02-15,opendatasus
439,MG,313170,ITABIRA,19/02/2018,2018-02-19,opendatasus
440,MG,313190,ITABIRITO,05/01/2018,2018-01-05,opendatasus
441,MG,313190,ITABIRITO,10/01/2018,2018-01-10,opendatasus
442,MG,313190,ITABIRITO,19/01/2018,2018-01-19,opendatasus
443,MG,313190,ITABIRITO,21/01/2018,2018-01-21,opendatasus
444,MG,313190,ITABIRITO,01/02/2018,2018-02-01,opendatasus
445,MG,313190,ITABIRITO,05/02/2018,2018-02-05,opendatasus
446,MG,313190,ITABIRITO,10/02/2018,2018-02-10,opendatasus
447,MG,313190,ITABIRITO,11/02/2018,2018-02-11,opendatasus
448,MG,313190,ITABIRITO,12/02/2018,2018-02-12,opendatasus
449,MG,313190,ITABIRITO,15/02/2018,2018-02-15,opendatasus
450,MG,313190,ITABIRITO,22/02/2018,2018-02-22,opendatasus
451,MG,313190,ITABIRITO,08/03/2018,2018-03-08,opendatasus
452,MG,313190,ITABIRITO,23/03/2018,2018-03-23,opendatasus
453,MG,313220,ITAGUARA,15/01/2018,2018-01-15,opendatasus
454,MG,313230,ITAIPÉ,31/03/2017,2017-03-31,opendatasus
455,MG,313240,ITAJUBÁ,15/04/2018,2018-04-15,opendatasus
456,MG,313270,ITAMBACURI,20/12/2016,2016-12-20,opendatasus
457,MG,313270,ITAMBACURI,26/12/2016,2016-12-26,opendatasus
458,MG,313270,ITAMBACURI,28/12/2016,2016-12-28,opendatasus
459,MG,313270,ITAMBACURI,29/12/2016,2016-12-29,opendatasus
460,MG,313270,ITAMBACURI,01/01/2017,2017-01-01,opendatasus
461,MG,313270,ITAMBACURI,02/01/2017,2017-01-02,opendatasus
462,MG,313270,ITAMBACURI,04/01/2017,2017-01-04,opendatasus
463,MG,313270,ITAMBACURI,08/01/2017,2017-01-08,opendatasus
464,MG,313270,ITAMBACURI,09/01/2017,2017-01-09,opendatasus
465,MG,313270,ITAMBACURI,12/01/2017,2017-01-12,opendatasus
466,MG,313270,ITAMBACURI,15/01/2017,2017-01-15,opendatasus
467,MG,313270,ITAMBACURI,16/01/2017,2017-01-16,opendatasus
468,MG,313270,ITAMBACURI,18/01/2017,2017-01-18,opendatasus
469,MG,313270,ITAMBACURI,19/01/2017,2017-01-19,opendatasus
470,MG,313270,ITAMBACURI,23/01/2017,2017-01-23,opendatasus
471,MG,313320,ITANHOMI,06/01/2017,2017-01-06,opendatasus
472,MG,313320,ITANHOMI,16/01/2017,2017-01-16,opendatasus
473,MG,313340,ITAPAGIPE,05/02/2022,2022-02-05,opendatasus
474,MG,313370,ITATIAIUÇU,08/01/2018,2018-01-08,opendatasus
475,MG,313380,ITAÚNA,15/01/2018,2018-01-15,opendatasus
476,MG,313380,ITAÚNA,20/01/2018,2018-01-20,opendatasus
477,MG,313380,ITAÚNA,23/01/2018,2018-01-23,opendatasus
478,MG,313390,ITAVERAVA,19/01/2018,2018-01-19,opendatasus
479,MG,313390,ITAVERAVA,21/01/2018,2018-01-21,opendatasus
480,MG,313390,ITAVERAVA,04/02/2018,2018-02-04,opendatasus
481,MG,313390,ITAVERAVA,08/02/2018,2018-02-08,opendatasus
482,MG,313410,ITUETA,20/01/2017,2017-01-20,opendatasus
483,MG,313410,ITUETA,21/01/2017,2017-01-21,opendatasus
484,MG,313410,ITUETA,23/01/2017,2017-01-23,opendatasus
485,MG,313420,ITUIUTABA,16/01/2017,2017-01-16,opendatasus
486,MG,313420,ITUIUTABA,02/02/2017,2017-02-02,opendatasus
487,MG,313490,JACUTINGA,21/03/2018,2018-03-21,opendatasus
488,MG,313520,JANUÁRIA,15/07/2016,2016-07-15,opendatasus
489,MG,313520,JANUÁRIA,15/10/2016,2016-10-15,opendatasus
490,MG,313520,JANUÁRIA,06/01/2017,2017-01-06,opendatasus
491,MG,313520,JANUÁRIA,12/01/2017,2017-01-12,opendatasus
492,MG,313530,JAPARAÍBA,25/01/2017,2017-01-25,opendatasus
493,MG,313540,JECEABA,14/01/2018,2018-01-14,opendatasus
494,MG,313580,JEQUITINHONHA,04/03/2017,2017-03-04,opendatasus
495,MG,313620,JOĂO MONLEVADE,01/02/2018,2018-02-01,opendatasus
496,MG,313620,JOĂO MONLEVADE,11/02/2018,2018-02-11,opendatasus
497,MG,313640,JOAQUIM FELÍCIO,31/01/2017,2017-01-31,opendatasus
498,MG,313655,JOSÉ RAYDAN,07/01/2017,2017-01-07,opendatasus
499,MG,313655,JOSÉ RAYDAN,09/01/2017,2017-01-09,opendatasus
500,MG,313655,JOSÉ RAYDAN,11/01/2017,2017-01-11,opendatasus
501,MG,313655,JOSÉ RAYDAN,12/01/2017,2017-01-12,opendatasus
502,MG,313655,JOSÉ RAYDAN,25/01/2017,2017-01-25,opendatasus
503,MG,313655,JOSÉ RAYDAN,31/01/2017,2017-01-31,opendatasus
504,MG,313655,JOSÉ RAYDAN,01/03/2017,2017-03-01,opendatasus
505,MG,313660,NOVA UNIĂO,23/01/2018,2018-01-23,opendatasus
506,MG,313660,NOVA UNIĂO,24/01/2018,2018-01-24,opendatasus
507,MG,313660,NOVA UNIĂO,28/01/2018,2018-01-28,opendatasus
508,MG,313665,JUATUBA,15/02/2017,2017-02-15,opendatasus
509,MG,313670,JUIZ DE FORA,02/02/2017,2017-02-02,opendatasus
510,MG,313670,JUIZ DE FORA,21/03/2017,2017-03-21,opendatasus
511,MG,313670,JUIZ DE FORA,13/12/2017,2017-12-13,opendatasus
512,MG,313670,JUIZ DE FORA,03/01/2018,2018-01-03,opendatasus
513,MG,313670,JUIZ DE FORA,05/01/2018,2018-01-05,opendatasus
514,MG,313670,JUIZ DE FORA,14/01/2018,2018-01-14,opendatasus
515,MG,313670,JUIZ DE FORA,16/01/2018,2018-01-16,opendatasus
516,MG,313670,JUIZ DE FORA,18/01/2018,2018-01-18,opendatasus
517,MG,313670,JUIZ DE FORA,19/01/2018,2018-01-19,opendatasus
518,MG,313670,JUIZ DE FORA,20/01/2018,2018-01-20,opendatasus
519,MG,313670,JUIZ DE FORA,21/01/2018,2018-01-21,opendatasus
520,MG,313670,JUIZ DE FORA,22/01/2018,2018-01-22,opendatasus
521,MG,313670,JUIZ DE FORA,23/01/2018,2018-01-23,opendatasus
522,MG,313670,JUIZ DE FORA,27/01/2018,2018-01-27,opendatasus
523,MG,313670,JUIZ DE FORA,28/01/2018,2018-01-28,opendatasus
524,MG,313670,JUIZ DE FORA,29/01/2018,2018-01-29,opendatasus
525,MG,313670,JUIZ DE FORA,30/01/2018,2018-01-30,opendatasus
526,MG,313670,JUIZ DE FORA,01/02/2018,2018-02-01,opendatasus
527,MG,313670,JUIZ DE FORA,02/02/2018,2018-02-02,opendatasus
528,MG,313670,JUIZ DE FORA,03/02/2018,2018-02-03,opendatasus
529,MG,313670,JUIZ DE FORA,04/02/2018,2018-02-04,opendatasus
530,MG,313670,JUIZ DE FORA,05/02/2018,2018-02-05,opendatasus
531,MG,313670,JUIZ DE FORA,08/02/2018,2018-02-08,opendatasus
532,MG,313670,JUIZ DE FORA,09/02/2018,2018-02-09,opendatasus
533,MG,313670,JUIZ DE FORA,10/02/2018,2018-02-10,opendatasus
534,MG,313670,JUIZ DE FORA,11/02/2018,2018-02-11,opendatasus
535,MG,313670,JUIZ DE FORA,12/02/2018,2018-02-12,opendatasus
536,MG,313670,JUIZ DE FORA,15/02/2018,2018-02-15,opendatasus
537,MG,313670,JUIZ DE FORA,16/02/2018,2018-02-16,opendatasus
538,MG,313670,JUIZ DE FORA,18/02/2018,2018-02-18,opendatasus
539,MG,313670,JUIZ DE FORA,19/02/2018,2018-02-19,opendatasus
540,MG,313670,JUIZ DE FORA,27/02/2018,2018-02-27,opendatasus
541,MG,313670,JUIZ DE FORA,01/03/2018,2018-03-01,opendatasus
542,MG,313670,JUIZ DE FORA,05/03/2018,2018-03-05,opendatasus
543,MG,313670,JUIZ DE FORA,07/03/2018,2018-03-07,opendatasus
544,MG,313670,JUIZ DE FORA,13/03/2018,2018-03-13,opendatasus
545,MG,313670,JUIZ DE FORA,18/04/2018,2018-04-18,opendatasus
546,MG,313680,JURAMENTO,30/01/2017,2017-01-30,opendatasus
547,MG,313680,JURAMENTO,21/09/2020,2020-09-21,opendatasus
548,MG,313700,LADAINHA,22/12/2016,2016-12-22,opendatasus
549,MG,313700,LADAINHA,26/12/2016,2016-12-26,opendatasus
550,MG,313700,LADAINHA,28/12/2016,2016-12-28,opendatasus
551,MG,313700,LADAINHA,30/12/2016,2016-12-30,opendatasus
552,MG,313700,LADAINHA,31/12/2016,2016-12-31,opendatasus
553,MG,313700,LADAINHA,02/01/2017,2017-01-02,opendatasus
554,MG,313700,LADAINHA,03/01/2017,2017-01-03,opendatasus
555,MG,313700,LADAINHA,04/01/2017,2017-01-04,opendatasus
556,MG,313700,LADAINHA,05/01/2017,2017-01-05,opendatasus
557,MG,313700,LADAINHA,06/01/2017,2017-01-06,opendatasus
558,MG,313700,LADAINHA,07/01/2017,2017-01-07,opendatasus
559,MG,313700,LADAINHA,08/01/2017,2017-01-08,opendatasus
560,MG,313700,LADAINHA,09/01/2017,2017-01-09,opendatasus
561,MG,313700,LADAINHA,10/01/2017,2017-01-10,opendatasus
562,MG,313700,LADAINHA,11/01/2017,2017-01-11,opendatasus
563,MG,313700,LADAINHA,12/01/2017,2017-01-12,opendatasus
564,MG,313700,LADAINHA,16/01/2017,2017-01-16,opendatasus
565,MG,313700,LADAINHA,19/01/2017,2017-01-19,opendatasus
566,MG,313700,LADAINHA,21/01/2017,2017-01-21,opendatasus
567,MG,313700,LADAINHA,23/01/2017,2017-01-23,opendatasus
568,MG,313700,LADAINHA,27/01/2017,2017-01-27,opendatasus
569,MG,313700,LADAINHA,11/03/2017,2017-03-11,opendatasus
570,MG,313700,LADAINHA,09/06/2017,2017-06-09,opendatasus
571,MG,313740,LAGOA DOURADA,22/08/2017,2017-08-22,opendatasus
572,MG,313740,LAGOA DOURADA,31/01/2018,2018-01-31,opendatasus
573,MG,313770,LAJINHA,04/01/2017,2017-01-04,opendatasus
574,MG,313770,LAJINHA,13/01/2017,2017-01-13,opendatasus
575,MG,313770,LAJINHA,14/01/2017,2017-01-14,opendatasus
576,MG,313770,LAJINHA,15/01/2017,2017-01-15,opendatasus
577,MG,313770,LAJINHA,18/01/2017,2017-01-18,opendatasus
578,MG,313770,LAJINHA,21/01/2017,2017-01-21,opendatasus
579,MG,313770,LAJINHA,23/01/2017,2017-01-23,opendatasus
580,MG,313770,LAJINHA,31/01/2017,2017-01-31,opendatasus
581,MG,313780,LAMBARI,18/02/2018,2018-02-18,opendatasus
582,MG,313820,LAVRAS,07/02/2017,2017-02-07,opendatasus
583,MG,313840,LEOPOLDINA,30/01/2017,2017-01-30,opendatasus
584,MG,313860,LIMA DUARTE,08/01/2018,2018-01-08,opendatasus
585,MG,313860,LIMA DUARTE,27/01/2018,2018-01-27,opendatasus
586,MG,313860,LIMA DUARTE,31/01/2018,2018-01-31,opendatasus
587,MG,313860,LIMA DUARTE,08/02/2018,2018-02-08,opendatasus
588,MG,313860,LIMA DUARTE,12/02/2018,2018-02-12,opendatasus
589,MG,313860,LIMA DUARTE,17/02/2018,2018-02-17,opendatasus
590,MG,313860,LIMA DUARTE,19/02/2018,2018-02-19,opendatasus
591,MG,313860,LIMA DUARTE,21/02/2018,2018-02-21,opendatasus
592,MG,313867,LUISBURGO,24/01/2017,2017-01-24,opendatasus
593,MG,313900,MACHADO,06/01/2018,2018-01-06,opendatasus
594,MG,313910,MADRE DE DEUS DE MINAS,25/11/2017,2017-11-25,opendatasus
595,MG,313910,MADRE DE DEUS DE MINAS,07/12/2017,2017-12-07,opendatasus
596,MG,313920,MALACACHETA,29/12/2016,2016-12-29,opendatasus
597,MG,313920,MALACACHETA,30/12/2016,2016-12-30,opendatasus
598,MG,313920,MALACACHETA,06/01/2017,2017-01-06,opendatasus
599,MG,313920,MALACACHETA,09/01/2017,2017-01-09,opendatasus
600,MG,313920,MALACACHETA,11/01/2017,2017-01-11,opendatasus
601,MG,313920,MALACACHETA,13/01/2017,2017-01-13,opendatasus
602,MG,313920,MALACACHETA,18/01/2017,2017-01-18,opendatasus
603,MG,313940,MANHUAÇU,07/01/2017,2017-01-07,opendatasus
604,MG,313940,MANHUAÇU,13/01/2017,2017-01-13,opendatasus
605,MG,313940,MANHUAÇU,17/01/2017,2017-01-17,opendatasus
606,MG,313940,MANHUAÇU,20/01/2017,2017-01-20,opendatasus
607,MG,313940,MANHUAÇU,31/01/2017,2017-01-31,opendatasus
608,MG,313940,MANHUAÇU,10/02/2017,2017-02-10,opendatasus
609,MG,313940,MANHUAÇU,12/02/2017,2017-02-12,opendatasus
610,MG,313940,MANHUAÇU,13/02/2017,2017-02-13,opendatasus
611,MG,313940,MANHUAÇU,14/02/2017,2017-02-14,opendatasus
612,MG,313940,MANHUAÇU,19/02/2017,2017-02-19,opendatasus
613,MG,313940,MANHUAÇU,22/02/2017,2017-02-22,opendatasus
614,MG,313940,MANHUAÇU,24/02/2017,2017-02-24,opendatasus
615,MG,313950,MANHUMIRIM,12/01/2017,2017-01-12,opendatasus
616,MG,313950,MANHUMIRIM,09/02/2017,2017-02-09,opendatasus
617,MG,313950,MANHUMIRIM,13/02/2017,2017-02-13,opendatasus
618,MG,313980,MAR DE ESPANHA,08/11/2017,2017-11-08,opendatasus
619,MG,313980,MAR DE ESPANHA,27/12/2017,2017-12-27,opendatasus
620,MG,313980,MAR DE ESPANHA,20/01/2018,2018-01-20,opendatasus
621,MG,314000,MARIANA,06/12/2017,2017-12-06,opendatasus
622,MG,314000,MARIANA,29/12/2017,2017-12-29,opendatasus
623,MG,314000,MARIANA,31/12/2017,2017-12-31,opendatasus
624,MG,314000,MARIANA,03/01/2018,2018-01-03,opendatasus
625,MG,314000,MARIANA,06/01/2018,2018-01-06,opendatasus
626,MG,314000,MARIANA,08/01/2018,2018-01-08,opendatasus
627,MG,314000,MARIANA,10/01/2018,2018-01-10,opendatasus
628,MG,314000,MARIANA,11/01/2018,2018-01-11,opendatasus
629,MG,314000,MARIANA,13/01/2018,2018-01-13,opendatasus
630,MG,314000,MARIANA,14/01/2018,2018-01-14,opendatasus
631,MG,314000,MARIANA,15/01/2018,2018-01-15,opendatasus
632,MG,314000,MARIANA,16/01/2018,2018-01-16,opendatasus
633,MG,314000,MARIANA,17/01/2018,2018-01-17,opendatasus
634,MG,314000,MARIANA,18/01/2018,2018-01-18,opendatasus
635,MG,314000,MARIANA,19/01/2018,2018-01-19,opendatasus
636,MG,314000,MARIANA,20/01/2018,2018-01-20,opendatasus
637,MG,314000,MARIANA,22/01/2018,2018-01-22,opendatasus
638,MG,314000,MARIANA,23/01/2018,2018-01-23,opendatasus
639,MG,314000,MARIANA,24/01/2018,2018-01-24,opendatasus
640,MG,314000,MARIANA,26/01/2018,2018-01-26,opendatasus
641,MG,314000,MARIANA,27/01/2018,2018-01-27,opendatasus
642,MG,314000,MARIANA,28/01/2018,2018-01-28,opendatasus
643,MG,314000,MARIANA,02/02/2018,2018-02-02,opendatasus
644,MG,314000,MARIANA,10/02/2018,2018-02-10,opendatasus
645,MG,314000,MARIANA,11/02/2018,2018-02-11,opendatasus
646,MG,314000,MARIANA,17/02/2018,2018-02-17,opendatasus
647,MG,314000,MARIANA,18/02/2018,2018-02-18,opendatasus
648,MG,314000,MARIANA,26/02/2018,2018-02-26,opendatasus
649,MG,314020,MARIPÁ DE MINAS,14/01/2018,2018-01-14,opendatasus
650,MG,314020,MARIPÁ DE MINAS,16/01/2018,2018-01-16,opendatasus
651,MG,314053,MARTINS SOARES,02/02/2017,2017-02-02,opendatasus
652,MG,314070,MATEUS LEME,08/01/2018,2018-01-08,opendatasus
653,MG,314070,MATEUS LEME,17/01/2018,2018-01-17,opendatasus
654,MG,314070,MATEUS LEME,09/02/2018,2018-02-09,opendatasus
655,MG,314070,MATEUS LEME,19/02/2018,2018-02-19,opendatasus
656,MG,314080,MATIAS BARBOSA,04/12/2017,2017-12-04,opendatasus
657,MG,314080,MATIAS BARBOSA,14/12/2017,2017-12-14,opendatasus
658,MG,314080,MATIAS BARBOSA,19/01/2018,2018-01-19,opendatasus
659,MG,314080,MATIAS BARBOSA,21/01/2018,2018-01-21,opendatasus
660,MG,314080,MATIAS BARBOSA,26/01/2018,2018-01-26,opendatasus
661,MG,314080,MATIAS BARBOSA,01/02/2018,2018-02-01,opendatasus
662,MG,314080,MATIAS BARBOSA,09/02/2018,2018-02-09,opendatasus
663,MG,314080,MATIAS BARBOSA,11/02/2018,2018-02-11,opendatasus
664,MG,314090,MATIPÓ,03/02/2017,2017-02-03,opendatasus
665,MG,314090,MATIPÓ,04/02/2017,2017-02-04,opendatasus
666,MG,314160,MERCĘS,30/01/2018,2018-01-30,opendatasus
667,MG,314160,MERCĘS,15/02/2018,2018-02-15,opendatasus
668,MG,314160,MERCĘS,18/02/2018,2018-02-18,opendatasus
669,MG,314180,MINAS NOVAS,10/01/2017,2017-01-10,opendatasus
670,MG,314180,MINAS NOVAS,12/01/2017,2017-01-12,opendatasus
671,MG,314180,MINAS NOVAS,17/01/2017,2017-01-17,opendatasus
672,MG,314200,MIRABELA,03/03/2016,2016-03-03,opendatasus
673,MG,314230,MOEDA,22/01/2018,2018-01-22,opendatasus
674,MG,314230,MOEDA,23/01/2018,2018-01-23,opendatasus
675,MG,314230,MOEDA,24/01/2018,2018-01-24,opendatasus
676,MG,314330,MONTES CLAROS,19/04/2016,2016-04-19,opendatasus
677,MG,314330,MONTES CLAROS,26/01/2017,2017-01-26,opendatasus
678,MG,314330,MONTES CLAROS,01/02/2017,2017-02-01,opendatasus
679,MG,314330,MONTES CLAROS,02/02/2017,2017-02-02,opendatasus
680,MG,314330,MONTES CLAROS,03/02/2017,2017-02-03,opendatasus
681,MG,314390,MURIAÉ,29/03/2018,2018-03-29,opendatasus
682,MG,314400,MUTUM,13/01/2017,2017-01-13,opendatasus
683,MG,314400,MUTUM,20/01/2017,2017-01-20,opendatasus
684,MG,314400,MUTUM,21/01/2017,2017-01-21,opendatasus
685,MG,314400,MUTUM,24/01/2017,2017-01-24,opendatasus
686,MG,314430,NANUQUE,07/01/2017,2017-01-07,opendatasus
687,MG,314430,NANUQUE,24/01/2017,2017-01-24,opendatasus
688,MG,314437,NATALÂNDIA,25/08/2015,2015-08-25,opendatasus
689,MG,314440,NATÉRCIA,11/01/2018,2018-01-11,opendatasus
690,MG,314450,NAZARENO,26/10/2017,2017-10-26,opendatasus
691,MG,314460,NEPOMUCENO,26/02/2018,2018-02-26,opendatasus
692,MG,314460,NEPOMUCENO,07/03/2018,2018-03-07,opendatasus
693,MG,314480,NOVA LIMA,30/10/2017,2017-10-30,opendatasus
694,MG,314480,NOVA LIMA,23/11/2017,2017-11-23,opendatasus
695,MG,314480,NOVA LIMA,28/12/2017,2017-12-28,opendatasus
696,MG,314480,NOVA LIMA,29/12/2017,2017-12-29,opendatasus
697,MG,314480,NOVA LIMA,30/12/2017,2017-12-30,opendatasus
698,MG,314480,NOVA LIMA,31/12/2017,2017-12-31,opendatasus
699,MG,314480,NOVA LIMA,02/01/2018,2018-01-02,opendatasus
700,MG,314480,NOVA LIMA,04/01/2018,2018-01-04,opendatasus
701,MG,314480,NOVA LIMA,05/01/2018,2018-01-05,opendatasus
702,MG,314480,NOVA LIMA,07/01/2018,2018-01-07,opendatasus
703,MG,314480,NOVA LIMA,09/01/2018,2018-01-09,opendatasus
704,MG,314480,NOVA LIMA,10/01/2018,2018-01-10,opendatasus
705,MG,314480,NOVA LIMA,11/01/2018,2018-01-11,opendatasus
706,MG,314480,NOVA LIMA,13/01/2018,2018-01-13,opendatasus
707,MG,314480,NOVA LIMA,15/01/2018,2018-01-15,opendatasus
708,MG,314480,NOVA LIMA,16/01/2018,2018-01-16,opendatasus
709,MG,314480,NOVA LIMA,17/01/2018,2018-01-17,opendatasus
710,MG,314480,NOVA LIMA,18/01/2018,2018-01-18,opendatasus
711,MG,314480,NOVA LIMA,19/01/2018,2018-01-19,opendatasus
712,MG,314480,NOVA LIMA,20/01/2018,2018-01-20,opendatasus
713,MG,314480,NOVA LIMA,21/01/2018,2018-01-21,opendatasus
714,MG,314480,NOVA LIMA,22/01/2018,2018-01-22,opendatasus
715,MG,314480,NOVA LIMA,26/01/2018,2018-01-26,opendatasus
716,MG,314480,NOVA LIMA,30/01/2018,2018-01-30,opendatasus
717,MG,314480,NOVA LIMA,31/01/2018,2018-01-31,opendatasus
718,MG,314480,NOVA LIMA,03/02/2018,2018-02-03,opendatasus
719,MG,314480,NOVA LIMA,09/02/2018,2018-02-09,opendatasus
720,MG,314480,NOVA LIMA,11/02/2018,2018-02-11,opendatasus
721,MG,314480,NOVA LIMA,13/02/2018,2018-02-13,opendatasus
722,MG,314480,NOVA LIMA,20/02/2018,2018-02-20,opendatasus
723,MG,314530,NOVO CRUZEIRO,23/12/2016,2016-12-23,opendatasus
724,MG,314530,NOVO CRUZEIRO,01/01/2017,2017-01-01,opendatasus
725,MG,314530,NOVO CRUZEIRO,04/01/2017,2017-01-04,opendatasus
726,MG,314530,NOVO CRUZEIRO,05/01/2017,2017-01-05,opendatasus
727,MG,314530,NOVO CRUZEIRO,06/01/2017,2017-01-06,opendatasus
728,MG,314530,NOVO CRUZEIRO,09/01/2017,2017-01-09,opendatasus
729,MG,314530,NOVO CRUZEIRO,10/01/2017,2017-01-10,opendatasus
730,MG,314530,NOVO CRUZEIRO,11/01/2017,2017-01-11,opendatasus
731,MG,314530,NOVO CRUZEIRO,12/01/2017,2017-01-12,opendatasus
732,MG,314530,NOVO CRUZEIRO,13/01/2017,2017-01-13,opendatasus
733,MG,314530,NOVO CRUZEIRO,14/01/2017,2017-01-14,opendatasus
734,MG,314530,NOVO CRUZEIRO,15/01/2017,2017-01-15,opendatasus
735,MG,314530,NOVO CRUZEIRO,16/01/2017,2017-01-16,opendatasus
736,MG,314530,NOVO CRUZEIRO,17/01/2017,2017-01-17,opendatasus
737,MG,314530,NOVO CRUZEIRO,18/01/2017,2017-01-18,opendatasus
738,MG,314530,NOVO CRUZEIRO,19/01/2017,2017-01-19,opendatasus
739,MG,314530,NOVO CRUZEIRO,20/01/2017,2017-01-20,opendatasus
740,MG,314530,NOVO CRUZEIRO,21/01/2017,2017-01-21,opendatasus
741,MG,314530,NOVO CRUZEIRO,22/01/2017,2017-01-22,opendatasus
742,MG,314530,NOVO CRUZEIRO,23/01/2017,2017-01-23,opendatasus
743,MG,314530,NOVO CRUZEIRO,24/01/2017,2017-01-24,opendatasus
744,MG,314530,NOVO CRUZEIRO,25/01/2017,2017-01-25,opendatasus
745,MG,314530,NOVO CRUZEIRO,01/02/2017,2017-02-01,opendatasus
746,MG,314540,OLARIA,27/01/2018,2018-01-27,opendatasus
747,MG,314590,OURO BRANCO,20/01/2018,2018-01-20,opendatasus
748,MG,314590,OURO BRANCO,25/01/2018,2018-01-25,opendatasus
749,MG,314590,OURO BRANCO,28/01/2018,2018-01-28,opendatasus
750,MG,314590,OURO BRANCO,29/01/2018,2018-01-29,opendatasus
751,MG,314590,OURO BRANCO,12/02/2018,2018-02-12,opendatasus
752,MG,314590,OURO BRANCO,14/02/2018,2018-02-14,opendatasus
753,MG,314590,OURO BRANCO,15/02/2018,2018-02-15,opendatasus
754,MG,314590,OURO BRANCO,18/02/2018,2018-02-18,opendatasus
755,MG,314590,OURO BRANCO,21/02/2018,2018-02-21,opendatasus
756,MG,314590,OURO BRANCO,23/02/2018,2018-02-23,opendatasus
757,MG,314590,OURO BRANCO,15/03/2018,2018-03-15,opendatasus
758,MG,314610,OURO PRETO,12/01/2018,2018-01-12,opendatasus
759,MG,314610,OURO PRETO,29/01/2018,2018-01-29,opendatasus
760,MG,314610,OURO PRETO,05/02/2018,2018-02-05,opendatasus
761,MG,314610,OURO PRETO,14/02/2018,2018-02-14,opendatasus
762,MG,314610,OURO PRETO,17/02/2018,2018-02-17,opendatasus
763,MG,314610,OURO PRETO,19/02/2018,2018-02-19,opendatasus
764,MG,314610,OURO PRETO,20/02/2018,2018-02-20,opendatasus
765,MG,314610,OURO PRETO,23/02/2018,2018-02-23,opendatasus
766,MG,314610,OURO PRETO,26/02/2018,2018-02-26,opendatasus
767,MG,314610,OURO PRETO,27/02/2018,2018-02-27,opendatasus
768,MG,314610,OURO PRETO,02/03/2018,2018-03-02,opendatasus
769,MG,314610,OURO PRETO,10/03/2018,2018-03-10,opendatasus
770,MG,314610,OURO PRETO,15/03/2018,2018-03-15,opendatasus
771,MG,314610,OURO PRETO,09/04/2018,2018-04-09,opendatasus
772,MG,314620,OURO VERDE DE MINAS,06/02/2017,2017-02-06,opendatasus
773,MG,314630,PADRE PARAÍSO,31/01/2017,2017-01-31,opendatasus
774,MG,314660,PAIVA,06/02/2018,2018-02-06,opendatasus
775,MG,314730,PARAISÓPOLIS,22/01/2018,2018-01-22,opendatasus
776,MG,314730,PARAISÓPOLIS,22/02/2018,2018-02-22,opendatasus
777,MG,314730,PARAISÓPOLIS,28/02/2018,2018-02-28,opendatasus
778,MG,314730,PARAISÓPOLIS,11/03/2018,2018-03-11,opendatasus
779,MG,314770,PASSA TEMPO,18/01/2018,2018-01-18,opendatasus
780,MG,314770,PASSA TEMPO,10/02/2018,2018-02-10,opendatasus
781,MG,314780,PASSA-VINTE,12/03/2018,2018-03-12,opendatasus
782,MG,314830,PAULA CÂNDIDO,19/01/2018,2018-01-19,opendatasus
783,MG,314830,PAULA CÂNDIDO,23/01/2018,2018-01-23,opendatasus
784,MG,314840,PAULISTAS,28/12/2016,2016-12-28,opendatasus
785,MG,314860,PEÇANHA,23/01/2017,2017-01-23,opendatasus
786,MG,314860,PEÇANHA,02/02/2017,2017-02-02,opendatasus
787,MG,314880,PEDRA DO ANTA,18/01/2018,2018-01-18,opendatasus
788,MG,314880,PEDRA DO ANTA,30/01/2018,2018-01-30,opendatasus
789,MG,314930,PEDRO LEOPOLDO,01/02/2018,2018-02-01,opendatasus
790,MG,314950,PEQUERI,24/01/2018,2018-01-24,opendatasus
791,MG,314950,PEQUERI,06/02/2018,2018-02-06,opendatasus
792,MG,315010,PIAU,21/12/2017,2017-12-21,opendatasus
793,MG,315010,PIAU,15/01/2018,2018-01-15,opendatasus
794,MG,315010,PIAU,22/01/2018,2018-01-22,opendatasus
795,MG,315010,PIAU,27/01/2018,2018-01-27,opendatasus
796,MG,315015,PIEDADE DE CARATINGA,12/12/2016,2016-12-12,opendatasus
797,MG,315015,PIEDADE DE CARATINGA,18/12/2016,2016-12-18,opendatasus
798,MG,315015,PIEDADE DE CARATINGA,26/12/2016,2016-12-26,opendatasus
799,MG,315015,PIEDADE DE CARATINGA,31/12/2016,2016-12-31,opendatasus
800,MG,315015,PIEDADE DE CARATINGA,02/01/2017,2017-01-02,opendatasus
801,MG,315015,PIEDADE DE CARATINGA,08/01/2017,2017-01-08,opendatasus
802,MG,315015,PIEDADE DE CARATINGA,11/01/2017,2017-01-11,opendatasus
803,MG,315015,PIEDADE DE CARATINGA,12/01/2017,2017-01-12,opendatasus
804,MG,315015,PIEDADE DE CARATINGA,19/01/2017,2017-01-19,opendatasus
805,MG,315015,PIEDADE DE CARATINGA,22/01/2017,2017-01-22,opendatasus
806,MG,315053,PINGO-D'ÁGUA,02/02/2017,2017-02-02,opendatasus
807,MG,315080,PIRANGA,08/01/2018,2018-01-08,opendatasus
808,MG,315080,PIRANGA,10/01/2018,2018-01-10,opendatasus
809,MG,315080,PIRANGA,14/01/2018,2018-01-14,opendatasus
810,MG,315080,PIRANGA,15/01/2018,2018-01-15,opendatasus
811,MG,315080,PIRANGA,16/01/2018,2018-01-16,opendatasus
812,MG,315080,PIRANGA,17/01/2018,2018-01-17,opendatasus
813,MG,315080,PIRANGA,18/01/2018,2018-01-18,opendatasus
814,MG,315080,PIRANGA,19/01/2018,2018-01-19,opendatasus
815,MG,315080,PIRANGA,20/01/2018,2018-01-20,opendatasus
816,MG,315080,PIRANGA,21/01/2018,2018-01-21,opendatasus
817,MG,315080,PIRANGA,22/01/2018,2018-01-22,opendatasus
818,MG,315080,PIRANGA,28/01/2018,2018-01-28,opendatasus
819,MG,315080,PIRANGA,05/02/2018,2018-02-05,opendatasus
820,MG,315090,PIRANGUÇU,05/04/2018,2018-04-05,opendatasus
821,MG,315180,POÇOS DE CALDAS,02/02/2017,2017-02-02,opendatasus
822,MG,315190,POCRANE,13/01/2017,2017-01-13,opendatasus
823,MG,315210,PONTE NOVA,27/12/2017,2017-12-27,opendatasus
824,MG,315210,PONTE NOVA,04/01/2018,2018-01-04,opendatasus
825,MG,315210,PONTE NOVA,13/01/2018,2018-01-13,opendatasus
826,MG,315210,PONTE NOVA,15/01/2018,2018-01-15,opendatasus
827,MG,315210,PONTE NOVA,16/01/2018,2018-01-16,opendatasus
828,MG,315210,PONTE NOVA,17/01/2018,2018-01-17,opendatasus
829,MG,315230,PORTO FIRME,06/01/2018,2018-01-06,opendatasus
830,MG,315230,PORTO FIRME,10/01/2018,2018-01-10,opendatasus
831,MG,315230,PORTO FIRME,15/01/2018,2018-01-15,opendatasus
832,MG,315230,PORTO FIRME,17/01/2018,2018-01-17,opendatasus
833,MG,315230,PORTO FIRME,18/01/2018,2018-01-18,opendatasus
834,MG,315230,PORTO FIRME,19/01/2018,2018-01-19,opendatasus
835,MG,315230,PORTO FIRME,20/01/2018,2018-01-20,opendatasus
836,MG,315230,PORTO FIRME,22/01/2018,2018-01-22,opendatasus
837,MG,315230,PORTO FIRME,24/01/2018,2018-01-24,opendatasus
838,MG,315230,PORTO FIRME,29/01/2018,2018-01-29,opendatasus
839,MG,315230,PORTO FIRME,14/02/2018,2018-02-14,opendatasus
840,MG,315240,POTÉ,25/12/2016,2016-12-25,opendatasus
841,MG,315240,POTÉ,31/12/2016,2016-12-31,opendatasus
842,MG,315240,POTÉ,02/01/2017,2017-01-02,opendatasus
843,MG,315240,POTÉ,03/01/2017,2017-01-03,opendatasus
844,MG,315240,POTÉ,08/01/2017,2017-01-08,opendatasus
845,MG,315240,POTÉ,09/01/2017,2017-01-09,opendatasus
846,MG,315240,POTÉ,10/01/2017,2017-01-10,opendatasus
847,MG,315240,POTÉ,12/01/2017,2017-01-12,opendatasus
848,MG,315240,POTÉ,15/01/2017,2017-01-15,opendatasus
849,MG,315240,POTÉ,16/01/2017,2017-01-16,opendatasus
850,MG,315240,POTÉ,17/01/2017,2017-01-17,opendatasus
851,MG,315240,POTÉ,18/01/2017,2017-01-18,opendatasus
852,MG,315240,POTÉ,19/01/2017,2017-01-19,opendatasus
853,MG,315240,POTÉ,22/01/2017,2017-01-22,opendatasus
854,MG,315240,POTÉ,23/01/2017,2017-01-23,opendatasus
855,MG,315240,POTÉ,24/01/2017,2017-01-24,opendatasus
856,MG,315240,POTÉ,27/01/2017,2017-01-27,opendatasus
857,MG,315240,POTÉ,30/01/2017,2017-01-30,opendatasus
858,MG,315240,POTÉ,01/02/2017,2017-02-01,opendatasus
859,MG,315310,PRESIDENTE BERNARDES,09/01/2018,2018-01-09,opendatasus
860,MG,315310,PRESIDENTE BERNARDES,11/01/2018,2018-01-11,opendatasus
861,MG,315310,PRESIDENTE BERNARDES,14/01/2018,2018-01-14,opendatasus
862,MG,315310,PRESIDENTE BERNARDES,16/01/2018,2018-01-16,opendatasus
863,MG,315310,PRESIDENTE BERNARDES,23/01/2018,2018-01-23,opendatasus
864,MG,315310,PRESIDENTE BERNARDES,24/01/2018,2018-01-24,opendatasus
865,MG,315310,PRESIDENTE BERNARDES,25/01/2018,2018-01-25,opendatasus
866,MG,315310,PRESIDENTE BERNARDES,05/02/2018,2018-02-05,opendatasus
867,MG,315310,PRESIDENTE BERNARDES,06/02/2018,2018-02-06,opendatasus
868,MG,315380,QUELUZITO,12/01/2018,2018-01-12,opendatasus
869,MG,315380,QUELUZITO,17/01/2018,2018-01-17,opendatasus
870,MG,315390,RAPOSOS,15/01/2018,2018-01-15,opendatasus
871,MG,315400,RAUL SOARES,01/03/2017,2017-03-01,opendatasus
872,MG,315415,REDUTO,31/01/2017,2017-01-31,opendatasus
873,MG,315420,RESENDE COSTA,24/01/2018,2018-01-24,opendatasus
874,MG,315440,RESSAQUINHA,12/01/2018,2018-01-12,opendatasus
875,MG,315440,RESSAQUINHA,15/01/2018,2018-01-15,opendatasus
876,MG,315440,RESSAQUINHA,17/01/2018,2018-01-17,opendatasus
877,MG,315440,RESSAQUINHA,24/02/2018,2018-02-24,opendatasus
878,MG,315460,RIBEIRĂO DAS NEVES,24/01/2018,2018-01-24,opendatasus
879,MG,315480,RIO ACIMA,06/01/2018,2018-01-06,opendatasus
880,MG,315480,RIO ACIMA,09/01/2018,2018-01-09,opendatasus
881,MG,315480,RIO ACIMA,10/01/2018,2018-01-10,opendatasus
882,MG,315480,RIO ACIMA,11/01/2018,2018-01-11,opendatasus
883,MG,315480,RIO ACIMA,16/01/2018,2018-01-16,opendatasus
884,MG,315480,RIO ACIMA,17/01/2018,2018-01-17,opendatasus
885,MG,315480,RIO ACIMA,21/01/2018,2018-01-21,opendatasus
886,MG,315480,RIO ACIMA,25/01/2018,2018-01-25,opendatasus
887,MG,315480,RIO ACIMA,02/02/2018,2018-02-02,opendatasus
888,MG,315480,RIO ACIMA,10/02/2018,2018-02-10,opendatasus
889,MG,315520,RIO ESPERA,28/01/2018,2018-01-28,opendatasus
890,MG,315530,RIO MANSO,09/01/2018,2018-01-09,opendatasus
891,MG,315530,RIO MANSO,23/01/2018,2018-01-23,opendatasus
892,MG,315530,RIO MANSO,02/02/2018,2018-02-02,opendatasus
893,MG,315540,RIO NOVO,17/01/2018,2018-01-17,opendatasus
894,MG,315570,RIO PIRACICABA,05/01/2018,2018-01-05,opendatasus
895,MG,315580,RIO POMBA,16/01/2018,2018-01-16,opendatasus
896,MG,315590,RIO PRETO,12/01/2018,2018-01-12,opendatasus
897,MG,315590,RIO PRETO,15/01/2018,2018-01-15,opendatasus
898,MG,315590,RIO PRETO,20/01/2018,2018-01-20,opendatasus
899,MG,315590,RIO PRETO,22/01/2018,2018-01-22,opendatasus
900,MG,315590,RIO PRETO,18/02/2018,2018-02-18,opendatasus
901,MG,315670,SABARÁ,30/10/2017,2017-10-30,opendatasus
902,MG,315670,SABARÁ,24/12/2017,2017-12-24,opendatasus
903,MG,315670,SABARÁ,06/01/2018,2018-01-06,opendatasus
904,MG,315670,SABARÁ,12/01/2018,2018-01-12,opendatasus
905,MG,315670,SABARÁ,15/01/2018,2018-01-15,opendatasus
906,MG,315670,SABARÁ,18/01/2018,2018-01-18,opendatasus
907,MG,315670,SABARÁ,19/01/2018,2018-01-19,opendatasus
908,MG,315670,SABARÁ,22/01/2018,2018-01-22,opendatasus
909,MG,315670,SABARÁ,28/01/2018,2018-01-28,opendatasus
910,MG,315670,SABARÁ,30/01/2018,2018-01-30,opendatasus
911,MG,315670,SABARÁ,03/02/2018,2018-02-03,opendatasus
912,MG,315670,SABARÁ,11/02/2018,2018-02-11,opendatasus
913,MG,315670,SABARÁ,15/02/2018,2018-02-15,opendatasus
914,MG,315680,SABINÓPOLIS,18/01/2017,2017-01-18,opendatasus
915,MG,315680,SABINÓPOLIS,24/01/2017,2017-01-24,opendatasus
916,MG,315690,SACRAMENTO,20/01/2017,2017-01-20,opendatasus
917,MG,315690,SACRAMENTO,20/02/2017,2017-02-20,opendatasus
918,MG,315720,SANTA BÁRBARA,03/01/2018,2018-01-03,opendatasus
919,MG,315720,SANTA BÁRBARA,06/01/2018,2018-01-06,opendatasus
920,MG,315720,SANTA BÁRBARA,08/01/2018,2018-01-08,opendatasus
921,MG,315720,SANTA BÁRBARA,10/01/2018,2018-01-10,opendatasus
922,MG,315720,SANTA BÁRBARA,15/01/2018,2018-01-15,opendatasus
923,MG,315720,SANTA BÁRBARA,17/01/2018,2018-01-17,opendatasus
924,MG,315720,SANTA BÁRBARA,23/01/2018,2018-01-23,opendatasus
925,MG,315720,SANTA BÁRBARA,24/01/2018,2018-01-24,opendatasus
926,MG,315720,SANTA BÁRBARA,25/01/2018,2018-01-25,opendatasus
927,MG,315720,SANTA BÁRBARA,27/01/2018,2018-01-27,opendatasus
928,MG,315720,SANTA BÁRBARA,30/01/2018,2018-01-30,opendatasus
929,MG,315720,SANTA BÁRBARA,02/02/2018,2018-02-02,opendatasus
930,MG,315720,SANTA BÁRBARA,11/02/2018,2018-02-11,opendatasus
931,MG,315720,SANTA BÁRBARA,12/02/2018,2018-02-12,opendatasus
932,MG,315720,SANTA BÁRBARA,13/02/2018,2018-02-13,opendatasus
933,MG,315720,SANTA BÁRBARA,19/02/2018,2018-02-19,opendatasus
934,MG,315725,SANTA BÁRBARA DO LESTE,12/01/2017,2017-01-12,opendatasus
935,MG,315725,SANTA BÁRBARA DO LESTE,17/01/2017,2017-01-17,opendatasus
936,MG,315725,SANTA BÁRBARA DO LESTE,18/01/2017,2017-01-18,opendatasus
937,MG,315725,SANTA BÁRBARA DO LESTE,21/01/2017,2017-01-21,opendatasus
938,MG,315725,SANTA BÁRBARA DO LESTE,04/02/2017,2017-02-04,opendatasus
939,MG,315727,SANTA BÁRBARA DO MONTE VERDE,19/02/2018,2018-02-19,opendatasus
940,MG,315780,SANTA LUZIA,10/01/2018,2018-01-10,opendatasus
941,MG,315780,SANTA LUZIA,21/01/2018,2018-01-21,opendatasus
942,MG,315780,SANTA LUZIA,03/02/2018,2018-02-03,opendatasus
943,MG,315820,SANTA MARIA DO SUAÇUÍ,14/01/2017,2017-01-14,opendatasus
944,MG,315820,SANTA MARIA DO SUAÇUÍ,16/01/2017,2017-01-16,opendatasus
945,MG,315820,SANTA MARIA DO SUAÇUÍ,18/01/2017,2017-01-18,opendatasus
946,MG,315820,SANTA MARIA DO SUAÇUÍ,19/01/2017,2017-01-19,opendatasus
947,MG,315820,SANTA MARIA DO SUAÇUÍ,31/01/2017,2017-01-31,opendatasus
948,MG,315820,SANTA MARIA DO SUAÇUÍ,23/02/2017,2017-02-23,opendatasus
949,MG,315860,SANTANA DO DESERTO,25/10/2017,2017-10-25,opendatasus
950,MG,315860,SANTANA DO DESERTO,20/11/2017,2017-11-20,opendatasus
951,MG,315860,SANTANA DO DESERTO,12/01/2018,2018-01-12,opendatasus
952,MG,315890,SANTANA DO MANHUAÇU,02/01/2017,2017-01-02,opendatasus
953,MG,315890,SANTANA DO MANHUAÇU,11/01/2017,2017-01-11,opendatasus
954,MG,315890,SANTANA DO MANHUAÇU,23/02/2017,2017-02-23,opendatasus
955,MG,315895,SANTANA DO PARAÍSO,05/02/2018,2018-02-05,opendatasus
956,MG,315910,SANTANA DOS MONTES,22/01/2018,2018-01-22,opendatasus
957,MG,315930,SANTA RITA DE JACUTINGA,24/01/2018,2018-01-24,opendatasus
958,MG,315930,SANTA RITA DE JACUTINGA,01/02/2018,2018-02-01,opendatasus
959,MG,315930,SANTA RITA DE JACUTINGA,24/02/2018,2018-02-24,opendatasus
960,MG,315935,SANTA RITA DE MINAS,12/01/2017,2017-01-12,opendatasus
961,MG,315935,SANTA RITA DE MINAS,13/01/2017,2017-01-13,opendatasus
962,MG,315950,SANTA RITA DO ITUETO,01/01/2017,2017-01-01,opendatasus
963,MG,315950,SANTA RITA DO ITUETO,11/01/2017,2017-01-11,opendatasus
964,MG,315950,SANTA RITA DO ITUETO,14/01/2017,2017-01-14,opendatasus
965,MG,315950,SANTA RITA DO ITUETO,15/01/2017,2017-01-15,opendatasus
966,MG,315950,SANTA RITA DO ITUETO,17/01/2017,2017-01-17,opendatasus
967,MG,315950,SANTA RITA DO ITUETO,18/01/2017,2017-01-18,opendatasus
968,MG,315950,SANTA RITA DO ITUETO,20/01/2017,2017-01-20,opendatasus
969,MG,315960,SANTA RITA DO SAPUCAÍ,19/02/2018,2018-02-19,opendatasus
970,MG,315960,SANTA RITA DO SAPUCAÍ,11/03/2018,2018-03-11,opendatasus
971,MG,316000,SANTO ANTÔNIO DO AVENTUREIRO,07/12/2017,2017-12-07,opendatasus
972,MG,316000,SANTO ANTÔNIO DO AVENTUREIRO,14/01/2018,2018-01-14,opendatasus
973,MG,316000,SANTO ANTÔNIO DO AVENTUREIRO,27/01/2018,2018-01-27,opendatasus
974,MG,316070,SANTOS DUMONT,22/01/2018,2018-01-22,opendatasus
975,MG,316070,SANTOS DUMONT,03/02/2018,2018-02-03,opendatasus
976,MG,316070,SANTOS DUMONT,12/02/2018,2018-02-12,opendatasus
977,MG,316070,SANTOS DUMONT,25/02/2018,2018-02-25,opendatasus
978,MG,316070,SANTOS DUMONT,07/03/2018,2018-03-07,opendatasus
979,MG,316070,SANTOS DUMONT,28/03/2018,2018-03-28,opendatasus
980,MG,316095,SĂO DOMINGOS DAS DORES,30/01/2017,2017-01-30,opendatasus
981,MG,316100,SĂO DOMINGOS DO PRATA,19/01/2018,2018-01-19,opendatasus
982,MG,316100,SĂO DOMINGOS DO PRATA,25/02/2018,2018-02-25,opendatasus
983,MG,316110,SĂO FRANCISCO,07/08/2016,2016-08-07,opendatasus
984,MG,316190,SĂO GONÇALO DO RIO ABAIXO,07/02/2017,2017-02-07,opendatasus
985,MG,316190,SĂO GONÇALO DO RIO ABAIXO,05/01/2018,2018-01-05,opendatasus
986,MG,316190,SĂO GONÇALO DO RIO ABAIXO,15/01/2018,2018-01-15,opendatasus
987,MG,316200,SĂO GONÇALO DO SAPUCAÍ,28/01/2018,2018-01-28,opendatasus
988,MG,316225,SĂO JOĂO DA LAGOA,07/07/2021,2021-07-07,opendatasus
989,MG,316250,SĂO JOĂO DEL REI,04/07/2017,2017-07-04,opendatasus
990,MG,316255,SĂO JOĂO DO MANHUAÇU,08/02/2017,2017-02-08,opendatasus
991,MG,316280,SĂO JOĂO EVANGELISTA,18/01/2017,2017-01-18,opendatasus
992,MG,316280,SĂO JOĂO EVANGELISTA,28/01/2017,2017-01-28,opendatasus
993,MG,316280,SĂO JOĂO EVANGELISTA,01/02/2017,2017-02-01,opendatasus
994,MG,316350,SĂO JOSÉ DO JACURI,05/01/2017,2017-01-05,opendatasus
995,MG,316350,SĂO JOSÉ DO JACURI,08/02/2017,2017-02-08,opendatasus
996,MG,316360,SĂO JOSÉ DO MANTIMENTO,12/01/2017,2017-01-12,opendatasus
997,MG,316360,SĂO JOSÉ DO MANTIMENTO,29/01/2017,2017-01-29,opendatasus
998,MG,316360,SĂO JOSÉ DO MANTIMENTO,09/02/2017,2017-02-09,opendatasus
999,MG,316380,SĂO MIGUEL DO ANTA,21/01/2018,2018-01-21,opendatasus
1000,MG,316410,SĂO PEDRO DO SUAÇUÍ,20/01/2017,2017-01-20,opendatasus
1001,MG,316430,SĂO ROQUE DE MINAS,18/01/2017,2017-01-18,opendatasus
1002,MG,316430,SĂO ROQUE DE MINAS,19/02/2017,2017-02-19,opendatasus
1003,MG,316440,SĂO SEBASTIĂO DA BELA VISTA,18/01/2018,2018-01-18,opendatasus
1004,MG,316450,SĂO SEBASTIĂO DO MARANHĂO,23/12/2016,2016-12-23,opendatasus
1005,MG,316450,SĂO SEBASTIĂO DO MARANHĂO,24/12/2016,2016-12-24,opendatasus
1006,MG,316450,SĂO SEBASTIĂO DO MARANHĂO,26/12/2016,2016-12-26,opendatasus
1007,MG,316450,SĂO SEBASTIĂO DO MARANHĂO,06/01/2017,2017-01-06,opendatasus
1008,MG,316450,SĂO SEBASTIĂO DO MARANHĂO,07/01/2017,2017-01-07,opendatasus
1009,MG,316450,SĂO SEBASTIĂO DO MARANHĂO,08/01/2017,2017-01-08,opendatasus
1010,MG,316450,SĂO SEBASTIĂO DO MARANHĂO,10/01/2017,2017-01-10,opendatasus
1011,MG,316450,SĂO SEBASTIĂO DO MARANHĂO,13/01/2017,2017-01-13,opendatasus
1012,MG,316450,SĂO SEBASTIĂO DO MARANHĂO,16/01/2017,2017-01-16,opendatasus
1013,MG,316450,SĂO SEBASTIĂO DO MARANHĂO,31/01/2017,2017-01-31,opendatasus
1014,MG,316450,SĂO SEBASTIĂO DO MARANHĂO,07/02/2017,2017-02-07,opendatasus
1015,MG,316450,SĂO SEBASTIĂO DO MARANHĂO,25/02/2017,2017-02-25,opendatasus
1016,MG,316520,SĂO THOMÉ DAS LETRAS,10/01/2018,2018-01-10,opendatasus
1017,MG,316520,SĂO THOMÉ DAS LETRAS,12/01/2018,2018-01-12,opendatasus
1018,MG,316520,SĂO THOMÉ DAS LETRAS,14/01/2018,2018-01-14,opendatasus
1019,MG,316520,SĂO THOMÉ DAS LETRAS,16/01/2018,2018-01-16,opendatasus
1020,MG,316520,SĂO THOMÉ DAS LETRAS,18/01/2018,2018-01-18,opendatasus
1021,MG,316520,SĂO THOMÉ DAS LETRAS,19/01/2018,2018-01-19,opendatasus
1022,MG,316520,SĂO THOMÉ DAS LETRAS,21/01/2018,2018-01-21,opendatasus
1023,MG,316520,SĂO THOMÉ DAS LETRAS,31/01/2018,2018-01-31,opendatasus
1024,MG,316520,SĂO THOMÉ DAS LETRAS,01/02/2018,2018-02-01,opendatasus
1025,MG,316520,SĂO THOMÉ DAS LETRAS,06/02/2018,2018-02-06,opendatasus
1026,MG,316540,SAPUCAÍ-MIRIM,05/02/2018,2018-02-05,opendatasus
1027,MG,316540,SAPUCAÍ-MIRIM,25/02/2018,2018-02-25,opendatasus
1028,MG,316540,SAPUCAÍ-MIRIM,27/02/2018,2018-02-27,opendatasus
1029,MG,316540,SAPUCAÍ-MIRIM,03/03/2018,2018-03-03,opendatasus
1030,MG,316540,SAPUCAÍ-MIRIM,09/03/2018,2018-03-09,opendatasus
1031,MG,316540,SAPUCAÍ-MIRIM,18/03/2018,2018-03-18,opendatasus
1032,MG,316555,SETUBINHA,01/01/2017,2017-01-01,opendatasus
1033,MG,316555,SETUBINHA,03/01/2017,2017-01-03,opendatasus
1034,MG,316555,SETUBINHA,13/01/2017,2017-01-13,opendatasus
1035,MG,316555,SETUBINHA,14/01/2017,2017-01-14,opendatasus
1036,MG,316555,SETUBINHA,15/01/2017,2017-01-15,opendatasus
1037,MG,316555,SETUBINHA,16/01/2017,2017-01-16,opendatasus
1038,MG,316555,SETUBINHA,18/01/2017,2017-01-18,opendatasus
1039,MG,316555,SETUBINHA,22/01/2017,2017-01-22,opendatasus
1040,MG,316555,SETUBINHA,23/01/2017,2017-01-23,opendatasus
1041,MG,316555,SETUBINHA,25/01/2017,2017-01-25,opendatasus
1042,MG,316555,SETUBINHA,26/01/2017,2017-01-26,opendatasus
1043,MG,316555,SETUBINHA,28/01/2017,2017-01-28,opendatasus
1044,MG,316555,SETUBINHA,29/01/2017,2017-01-29,opendatasus
1045,MG,316555,SETUBINHA,02/02/2017,2017-02-02,opendatasus
1046,MG,316556,SEM-PEIXE,21/01/2017,2017-01-21,opendatasus
1047,MG,316570,SENADOR FIRMINO,16/01/2018,2018-01-16,opendatasus
1048,MG,316570,SENADOR FIRMINO,19/01/2018,2018-01-19,opendatasus
1049,MG,316600,SENHORA DE OLIVEIRA,19/01/2018,2018-01-19,opendatasus
1050,MG,316600,SENHORA DE OLIVEIRA,22/01/2018,2018-01-22,opendatasus
1051,MG,316600,SENHORA DE OLIVEIRA,23/01/2018,2018-01-23,opendatasus
1052,MG,316720,SETE LAGOAS,07/02/2018,2018-02-07,opendatasus
1053,MG,316730,SILVEIRÂNIA,24/01/2018,2018-01-24,opendatasus
1054,MG,316750,SIMĂO PEREIRA,04/12/2017,2017-12-04,opendatasus
1055,MG,316750,SIMĂO PEREIRA,10/01/2018,2018-01-10,opendatasus
1056,MG,316750,SIMĂO PEREIRA,17/01/2018,2018-01-17,opendatasus
1057,MG,316760,SIMONÉSIA,12/01/2017,2017-01-12,opendatasus
1058,MG,316760,SIMONÉSIA,15/01/2017,2017-01-15,opendatasus
1059,MG,316760,SIMONÉSIA,18/01/2017,2017-01-18,opendatasus
1060,MG,316760,SIMONÉSIA,20/01/2017,2017-01-20,opendatasus
1061,MG,316760,SIMONÉSIA,22/01/2017,2017-01-22,opendatasus
1062,MG,316760,SIMONÉSIA,24/01/2017,2017-01-24,opendatasus
1063,MG,316760,SIMONÉSIA,25/01/2017,2017-01-25,opendatasus
1064,MG,316760,SIMONÉSIA,01/02/2017,2017-02-01,opendatasus
1065,MG,316850,TEIXEIRAS,21/01/2018,2018-01-21,opendatasus
1066,MG,316850,TEIXEIRAS,01/03/2018,2018-03-01,opendatasus
1067,MG,316860,TEÓFILO OTONI,20/12/2016,2016-12-20,opendatasus
1068,MG,316860,TEÓFILO OTONI,30/12/2016,2016-12-30,opendatasus
1069,MG,316860,TEÓFILO OTONI,01/01/2017,2017-01-01,opendatasus
1070,MG,316860,TEÓFILO OTONI,03/01/2017,2017-01-03,opendatasus
1071,MG,316860,TEÓFILO OTONI,04/01/2017,2017-01-04,opendatasus
1072,MG,316860,TEÓFILO OTONI,07/01/2017,2017-01-07,opendatasus
1073,MG,316860,TEÓFILO OTONI,10/01/2017,2017-01-10,opendatasus
1074,MG,316860,TEÓFILO OTONI,11/01/2017,2017-01-11,opendatasus
1075,MG,316860,TEÓFILO OTONI,12/01/2017,2017-01-12,opendatasus
1076,MG,316860,TEÓFILO OTONI,14/01/2017,2017-01-14,opendatasus
1077,MG,316860,TEÓFILO OTONI,16/01/2017,2017-01-16,opendatasus
1078,MG,316860,TEÓFILO OTONI,17/01/2017,2017-01-17,opendatasus
1079,MG,316860,TEÓFILO OTONI,19/01/2017,2017-01-19,opendatasus
1080,MG,316860,TEÓFILO OTONI,22/01/2017,2017-01-22,opendatasus
1081,MG,316860,TEÓFILO OTONI,24/01/2017,2017-01-24,opendatasus
1082,MG,316860,TEÓFILO OTONI,27/01/2017,2017-01-27,opendatasus
1083,MG,316860,TEÓFILO OTONI,29/01/2017,2017-01-29,opendatasus
1084,MG,316860,TEÓFILO OTONI,01/02/2017,2017-02-01,opendatasus
1085,MG,316870,TIMÓTEO,17/01/2017,2017-01-17,opendatasus
1086,MG,316870,TIMÓTEO,20/01/2017,2017-01-20,opendatasus
1087,MG,316880,TIRADENTES,06/04/2018,2018-04-06,opendatasus
1088,MG,316940,TRĘS PONTAS,01/02/2017,2017-02-01,opendatasus
1089,MG,316990,UBÁ,12/02/2018,2018-02-12,opendatasus
1090,MG,317000,UBAÍ,12/03/2022,2022-03-12,opendatasus
1091,MG,317005,UBAPORANGA,23/12/2016,2016-12-23,opendatasus
1092,MG,317005,UBAPORANGA,25/12/2016,2016-12-25,opendatasus
1093,MG,317005,UBAPORANGA,05/01/2017,2017-01-05,opendatasus
1094,MG,317005,UBAPORANGA,06/01/2017,2017-01-06,opendatasus
1095,MG,317005,UBAPORANGA,10/01/2017,2017-01-10,opendatasus
1096,MG,317010,UBERABA,04/02/2017,2017-02-04,opendatasus
1097,MG,317020,UBERLÂNDIA,02/02/2017,2017-02-02,opendatasus
1098,MG,317040,UNAÍ,23/09/2020,2020-09-23,opendatasus
1099,MG,317060,VARGEM BONITA,10/01/2017,2017-01-10,opendatasus
1100,MG,317065,VARGEM GRANDE DO RIO PARDO,18/01/2017,2017-01-18,opendatasus
1101,MG,317070,VARGINHA,05/02/2017,2017-02-05,opendatasus
1102,MG,317070,VARGINHA,25/05/2018,2018-05-25,opendatasus
1103,MG,317070,VARGINHA,05/10/2018,2018-10-05,opendatasus
1104,MG,317120,VESPASIANO,21/02/2018,2018-02-21,opendatasus
1105,MG,317130,VIÇOSA,08/01/2018,2018-01-08,opendatasus
1106,MG,317130,VIÇOSA,03/02/2018,2018-02-03,opendatasus
1107,MG,317130,VIÇOSA,05/02/2018,2018-02-05,opendatasus
1108,MG,317130,VIÇOSA,10/02/2018,2018-02-10,opendatasus
1109,MG,317130,VIÇOSA,13/02/2018,2018-02-13,opendatasus
1110,MG,317130,VIÇOSA,17/02/2018,2018-02-17,opendatasus
1111,MG,317130,VIÇOSA,26/02/2018,2018-02-26,opendatasus
1112,MG,317130,VIÇOSA,17/03/2018,2018-03-17,opendatasus
1113,MG,317130,VIÇOSA,03/04/2018,2018-04-03,opendatasus
1114,MG,317160,VIRGEM DA LAPA,18/01/2017,2017-01-18,opendatasus
1115,MG,317160,VIRGEM DA LAPA,19/01/2017,2017-01-19,opendatasus
1116,MG,317160,VIRGEM DA LAPA,23/01/2017,2017-01-23,opendatasus
1117,ES,320010,AFONSO CLÁUDIO,10/01/2017,2017-01-10,opendatasus
1118,ES,320010,AFONSO CLÁUDIO,18/01/2017,2017-01-18,opendatasus
1119,ES,320010,AFONSO CLÁUDIO,19/01/2017,2017-01-19,opendatasus
1120,ES,320010,AFONSO CLÁUDIO,27/01/2017,2017-01-27,opendatasus
1121,ES,320010,AFONSO CLÁUDIO,29/01/2017,2017-01-29,opendatasus
1122,ES,320010,AFONSO CLÁUDIO,10/02/2017,2017-02-10,opendatasus
1123,ES,320010,AFONSO CLÁUDIO,13/02/2017,2017-02-13,opendatasus
1124,ES,320010,AFONSO CLÁUDIO,14/02/2017,2017-02-14,opendatasus
1125,ES,320010,AFONSO CLÁUDIO,22/02/2017,2017-02-22,opendatasus
1126,ES,320010,AFONSO CLÁUDIO,19/03/2017,2017-03-19,opendatasus
1127,ES,320010,AFONSO CLÁUDIO,25/03/2017,2017-03-25,opendatasus
1128,ES,320010,AFONSO CLÁUDIO,10/05/2017,2017-05-10,opendatasus
1129,ES,320030,ALFREDO CHAVES,13/02/2017,2017-02-13,opendatasus
1130,ES,320030,ALFREDO CHAVES,03/03/2017,2017-03-03,opendatasus
1131,ES,320030,ALFREDO CHAVES,13/03/2017,2017-03-13,opendatasus
1132,ES,320030,ALFREDO CHAVES,20/03/2017,2017-03-20,opendatasus
1133,ES,320030,ALFREDO CHAVES,22/03/2017,2017-03-22,opendatasus
1134,ES,320030,ALFREDO CHAVES,12/04/2017,2017-04-12,opendatasus
1135,ES,320030,ALFREDO CHAVES,21/04/2017,2017-04-21,opendatasus
1136,ES,320030,ALFREDO CHAVES,12/05/2017,2017-05-12,opendatasus
1137,ES,320030,ALFREDO CHAVES,08/12/2017,2017-12-08,opendatasus
1138,ES,320030,ALFREDO CHAVES,15/01/2018,2018-01-15,opendatasus
1139,ES,320035,ALTO RIO NOVO,06/02/2017,2017-02-06,opendatasus
1140,ES,320040,ANCHIETA,13/03/2017,2017-03-13,opendatasus
1141,ES,320060,ARACRUZ,05/02/2017,2017-02-05,opendatasus
1142,ES,320060,ARACRUZ,03/03/2017,2017-03-03,opendatasus
1143,ES,320080,BAIXO GUANDU,15/01/2017,2017-01-15,opendatasus
1144,ES,320080,BAIXO GUANDU,23/01/2017,2017-01-23,opendatasus
1145,ES,320080,BAIXO GUANDU,24/01/2017,2017-01-24,opendatasus
1146,ES,320080,BAIXO GUANDU,17/02/2017,2017-02-17,opendatasus
1147,ES,320115,BREJETUBA,17/01/2017,2017-01-17,opendatasus
1148,ES,320115,BREJETUBA,25/01/2017,2017-01-25,opendatasus
1149,ES,320115,BREJETUBA,26/01/2017,2017-01-26,opendatasus
1150,ES,320115,BREJETUBA,05/02/2017,2017-02-05,opendatasus
1151,ES,320115,BREJETUBA,07/02/2017,2017-02-07,opendatasus
1152,ES,320115,BREJETUBA,14/02/2017,2017-02-14,opendatasus
1153,ES,320115,BREJETUBA,20/02/2017,2017-02-20,opendatasus
1154,ES,320115,BREJETUBA,28/02/2017,2017-02-28,opendatasus
1155,ES,320120,CACHOEIRO DE ITAPEMIRIM,10/02/2017,2017-02-10,opendatasus
1156,ES,320130,CARIACICA,03/02/2017,2017-02-03,opendatasus
1157,ES,320130,CARIACICA,13/02/2017,2017-02-13,opendatasus
1158,ES,320130,CARIACICA,16/02/2017,2017-02-16,opendatasus
1159,ES,320130,CARIACICA,21/02/2017,2017-02-21,opendatasus
1160,ES,320130,CARIACICA,07/03/2017,2017-03-07,opendatasus
1161,ES,320130,CARIACICA,08/03/2017,2017-03-08,opendatasus
1162,ES,320130,CARIACICA,09/03/2017,2017-03-09,opendatasus
1163,ES,320130,CARIACICA,13/03/2017,2017-03-13,opendatasus
1164,ES,320130,CARIACICA,31/03/2017,2017-03-31,opendatasus
1165,ES,320130,CARIACICA,09/04/2017,2017-04-09,opendatasus
1166,ES,320130,CARIACICA,15/04/2017,2017-04-15,opendatasus
1167,ES,320130,CARIACICA,25/01/2018,2018-01-25,opendatasus
1168,ES,320140,CASTELO,17/01/2017,2017-01-17,opendatasus
1169,ES,320140,CASTELO,22/01/2017,2017-01-22,opendatasus
1170,ES,320140,CASTELO,24/01/2017,2017-01-24,opendatasus
1171,ES,320140,CASTELO,28/01/2017,2017-01-28,opendatasus
1172,ES,320140,CASTELO,30/01/2017,2017-01-30,opendatasus
1173,ES,320140,CASTELO,11/02/2017,2017-02-11,opendatasus
1174,ES,320150,COLATINA,06/01/2017,2017-01-06,opendatasus
1175,ES,320150,COLATINA,09/01/2017,2017-01-09,opendatasus
1176,ES,320150,COLATINA,11/01/2017,2017-01-11,opendatasus
1177,ES,320150,COLATINA,17/01/2017,2017-01-17,opendatasus
1178,ES,320150,COLATINA,18/01/2017,2017-01-18,opendatasus
1179,ES,320150,COLATINA,20/01/2017,2017-01-20,opendatasus
1180,ES,320150,COLATINA,21/01/2017,2017-01-21,opendatasus
1181,ES,320150,COLATINA,22/01/2017,2017-01-22,opendatasus
1182,ES,320150,COLATINA,23/01/2017,2017-01-23,opendatasus
1183,ES,320150,COLATINA,24/01/2017,2017-01-24,opendatasus
1184,ES,320150,COLATINA,25/01/2017,2017-01-25,opendatasus
1185,ES,320150,COLATINA,26/01/2017,2017-01-26,opendatasus
1186,ES,320150,COLATINA,27/01/2017,2017-01-27,opendatasus
1187,ES,320150,COLATINA,28/01/2017,2017-01-28,opendatasus
1188,ES,320150,COLATINA,29/01/2017,2017-01-29,opendatasus
1189,ES,320150,COLATINA,30/01/2017,2017-01-30,opendatasus
1190,ES,320150,COLATINA,05/02/2017,2017-02-05,opendatasus
1191,ES,320150,COLATINA,15/02/2017,2017-02-15,opendatasus
1192,ES,320150,COLATINA,20/02/2017,2017-02-20,opendatasus
1193,ES,320160,CONCEIÇĂO DA BARRA,16/02/2017,2017-02-16,opendatasus
1194,ES,320170,CONCEIÇĂO DO CASTELO,13/01/2017,2017-01-13,opendatasus
1195,ES,320170,CONCEIÇĂO DO CASTELO,14/01/2017,2017-01-14,opendatasus
1196,ES,320170,CONCEIÇĂO DO CASTELO,06/02/2017,2017-02-06,opendatasus
1197,ES,320170,CONCEIÇĂO DO CASTELO,10/02/2017,2017-02-10,opendatasus
1198,ES,320170,CONCEIÇĂO DO CASTELO,11/02/2017,2017-02-11,opendatasus
1199,ES,320170,CONCEIÇĂO DO CASTELO,12/02/2017,2017-02-12,opendatasus
1200,ES,320170,CONCEIÇĂO DO CASTELO,19/02/2017,2017-02-19,opendatasus
1201,ES,320170,CONCEIÇĂO DO CASTELO,24/02/2017,2017-02-24,opendatasus
1202,ES,320190,DOMINGOS MARTINS,23/01/2017,2017-01-23,opendatasus
1203,ES,320190,DOMINGOS MARTINS,25/01/2017,2017-01-25,opendatasus
1204,ES,320190,DOMINGOS MARTINS,30/01/2017,2017-01-30,opendatasus
1205,ES,320190,DOMINGOS MARTINS,31/01/2017,2017-01-31,opendatasus
1206,ES,320190,DOMINGOS MARTINS,01/02/2017,2017-02-01,opendatasus
1207,ES,320190,DOMINGOS MARTINS,02/02/2017,2017-02-02,opendatasus
1208,ES,320190,DOMINGOS MARTINS,15/02/2017,2017-02-15,opendatasus
1209,ES,320190,DOMINGOS MARTINS,22/02/2017,2017-02-22,opendatasus
1210,ES,320190,DOMINGOS MARTINS,04/03/2017,2017-03-04,opendatasus
1211,ES,320190,DOMINGOS MARTINS,06/03/2017,2017-03-06,opendatasus
1212,ES,320190,DOMINGOS MARTINS,08/03/2017,2017-03-08,opendatasus
1213,ES,320190,DOMINGOS MARTINS,14/03/2017,2017-03-14,opendatasus
1214,ES,320190,DOMINGOS MARTINS,17/03/2017,2017-03-17,opendatasus
1215,ES,320190,DOMINGOS MARTINS,24/03/2017,2017-03-24,opendatasus
1216,ES,320190,DOMINGOS MARTINS,28/03/2017,2017-03-28,opendatasus
1217,ES,320190,DOMINGOS MARTINS,29/03/2017,2017-03-29,opendatasus
1218,ES,320190,DOMINGOS MARTINS,31/03/2017,2017-03-31,opendatasus
1219,ES,320190,DOMINGOS MARTINS,02/04/2017,2017-04-02,opendatasus
1220,ES,320190,DOMINGOS MARTINS,04/04/2017,2017-04-04,opendatasus
1221,ES,320190,DOMINGOS MARTINS,09/04/2017,2017-04-09,opendatasus
1222,ES,320190,DOMINGOS MARTINS,11/04/2017,2017-04-11,opendatasus
1223,ES,320190,DOMINGOS MARTINS,12/04/2017,2017-04-12,opendatasus
1224,ES,320190,DOMINGOS MARTINS,21/04/2017,2017-04-21,opendatasus
1225,ES,320190,DOMINGOS MARTINS,26/04/2017,2017-04-26,opendatasus
1226,ES,320190,DOMINGOS MARTINS,29/04/2017,2017-04-29,opendatasus
1227,ES,320240,GUARAPARI,25/01/2017,2017-01-25,opendatasus
1228,ES,320240,GUARAPARI,15/02/2017,2017-02-15,opendatasus
1229,ES,320240,GUARAPARI,21/03/2017,2017-03-21,opendatasus
1230,ES,320245,IBATIBA,04/01/2017,2017-01-04,opendatasus
1231,ES,320245,IBATIBA,06/01/2017,2017-01-06,opendatasus
1232,ES,320245,IBATIBA,11/01/2017,2017-01-11,opendatasus
1233,ES,320245,IBATIBA,13/01/2017,2017-01-13,opendatasus
1234,ES,320245,IBATIBA,14/01/2017,2017-01-14,opendatasus
1235,ES,320245,IBATIBA,15/01/2017,2017-01-15,opendatasus
1236,ES,320245,IBATIBA,16/01/2017,2017-01-16,opendatasus
1237,ES,320245,IBATIBA,19/01/2017,2017-01-19,opendatasus
1238,ES,320245,IBATIBA,20/01/2017,2017-01-20,opendatasus
1239,ES,320245,IBATIBA,22/01/2017,2017-01-22,opendatasus
1240,ES,320245,IBATIBA,24/01/2017,2017-01-24,opendatasus
1241,ES,320245,IBATIBA,26/01/2017,2017-01-26,opendatasus
1242,ES,320245,IBATIBA,30/01/2017,2017-01-30,opendatasus
1243,ES,320245,IBATIBA,15/02/2017,2017-02-15,opendatasus
1244,ES,320255,IBITIRAMA,02/02/2017,2017-02-02,opendatasus
1245,ES,320265,IRUPI,12/01/2017,2017-01-12,opendatasus
1246,ES,320265,IRUPI,22/01/2017,2017-01-22,opendatasus
1247,ES,320265,IRUPI,27/01/2017,2017-01-27,opendatasus
1248,ES,320265,IRUPI,30/01/2017,2017-01-30,opendatasus
1249,ES,320265,IRUPI,18/02/2017,2017-02-18,opendatasus
1250,ES,320270,ITAGUAÇU,16/01/2017,2017-01-16,opendatasus
1251,ES,320270,ITAGUAÇU,20/01/2017,2017-01-20,opendatasus
1252,ES,320270,ITAGUAÇU,02/02/2017,2017-02-02,opendatasus
1253,ES,320270,ITAGUAÇU,09/02/2017,2017-02-09,opendatasus
1254,ES,320290,ITARANA,18/01/2017,2017-01-18,opendatasus
1255,ES,320290,ITARANA,19/01/2017,2017-01-19,opendatasus
1256,ES,320290,ITARANA,25/01/2017,2017-01-25,opendatasus
1257,ES,320290,ITARANA,26/01/2017,2017-01-26,opendatasus
1258,ES,320290,ITARANA,27/01/2017,2017-01-27,opendatasus
1259,ES,320290,ITARANA,13/02/2017,2017-02-13,opendatasus
1260,ES,320290,ITARANA,07/04/2017,2017-04-07,opendatasus
1261,ES,320300,IÚNA,10/01/2017,2017-01-10,opendatasus
1262,ES,320300,IÚNA,12/01/2017,2017-01-12,opendatasus
1263,ES,320316,LARANJA DA TERRA,16/01/2017,2017-01-16,opendatasus
1264,ES,320316,LARANJA DA TERRA,17/01/2017,2017-01-17,opendatasus
1265,ES,320316,LARANJA DA TERRA,18/01/2017,2017-01-18,opendatasus
1266,ES,320316,LARANJA DA TERRA,22/01/2017,2017-01-22,opendatasus
1267,ES,320316,LARANJA DA TERRA,25/01/2017,2017-01-25,opendatasus
1268,ES,320316,LARANJA DA TERRA,26/01/2017,2017-01-26,opendatasus
1269,ES,320316,LARANJA DA TERRA,25/02/2017,2017-02-25,opendatasus
1270,ES,320320,LINHARES,27/02/2017,2017-02-27,opendatasus
1271,ES,320334,MARECHAL FLORIANO,17/02/2017,2017-02-17,opendatasus
1272,ES,320334,MARECHAL FLORIANO,09/03/2017,2017-03-09,opendatasus
1273,ES,320334,MARECHAL FLORIANO,10/03/2017,2017-03-10,opendatasus
1274,ES,320334,MARECHAL FLORIANO,14/03/2017,2017-03-14,opendatasus
1275,ES,320334,MARECHAL FLORIANO,30/03/2017,2017-03-30,opendatasus
1276,ES,320334,MARECHAL FLORIANO,07/04/2017,2017-04-07,opendatasus
1277,ES,320334,MARECHAL FLORIANO,09/04/2017,2017-04-09,opendatasus
1278,ES,320334,MARECHAL FLORIANO,11/04/2017,2017-04-11,opendatasus
1279,ES,320334,MARECHAL FLORIANO,15/04/2017,2017-04-15,opendatasus
1280,ES,320334,MARECHAL FLORIANO,17/04/2017,2017-04-17,opendatasus
1281,ES,320334,MARECHAL FLORIANO,18/04/2017,2017-04-18,opendatasus
1282,ES,320334,MARECHAL FLORIANO,19/04/2017,2017-04-19,opendatasus
1283,ES,320334,MARECHAL FLORIANO,26/04/2017,2017-04-26,opendatasus
1284,ES,320335,MARILÂNDIA,26/01/2017,2017-01-26,opendatasus
1285,ES,320370,MUNIZ FREIRE,30/01/2017,2017-01-30,opendatasus
1286,ES,320370,MUNIZ FREIRE,01/02/2017,2017-02-01,opendatasus
1287,ES,320370,MUNIZ FREIRE,08/02/2017,2017-02-08,opendatasus
1288,ES,320370,MUNIZ FREIRE,18/02/2017,2017-02-18,opendatasus
1289,ES,320380,MUQUI,02/03/2017,2017-03-02,opendatasus
1290,ES,320400,PANCAS,13/01/2017,2017-01-13,opendatasus
1291,ES,320400,PANCAS,14/01/2017,2017-01-14,opendatasus
1292,ES,320400,PANCAS,16/01/2017,2017-01-16,opendatasus
1293,ES,320400,PANCAS,18/01/2017,2017-01-18,opendatasus
1294,ES,320400,PANCAS,21/01/2017,2017-01-21,opendatasus
1295,ES,320400,PANCAS,22/01/2017,2017-01-22,opendatasus
1296,ES,320400,PANCAS,25/01/2017,2017-01-25,opendatasus
1297,ES,320400,PANCAS,14/02/2017,2017-02-14,opendatasus
1298,ES,320440,RIO NOVO DO SUL,07/12/2017,2017-12-07,opendatasus
1299,ES,320450,SANTA LEOPOLDINA,12/01/2017,2017-01-12,opendatasus
1300,ES,320450,SANTA LEOPOLDINA,03/03/2017,2017-03-03,opendatasus
1301,ES,320450,SANTA LEOPOLDINA,10/03/2017,2017-03-10,opendatasus
1302,ES,320450,SANTA LEOPOLDINA,20/03/2017,2017-03-20,opendatasus
1303,ES,320450,SANTA LEOPOLDINA,23/03/2017,2017-03-23,opendatasus
1304,ES,320450,SANTA LEOPOLDINA,24/03/2017,2017-03-24,opendatasus
1305,ES,320450,SANTA LEOPOLDINA,25/03/2017,2017-03-25,opendatasus
1306,ES,320450,SANTA LEOPOLDINA,26/03/2017,2017-03-26,opendatasus
1307,ES,320450,SANTA LEOPOLDINA,27/03/2017,2017-03-27,opendatasus
1308,ES,320450,SANTA LEOPOLDINA,28/03/2017,2017-03-28,opendatasus
1309,ES,320450,SANTA LEOPOLDINA,29/03/2017,2017-03-29,opendatasus
1310,ES,320450,SANTA LEOPOLDINA,30/03/2017,2017-03-30,opendatasus
1311,ES,320450,SANTA LEOPOLDINA,31/03/2017,2017-03-31,opendatasus
1312,ES,320450,SANTA LEOPOLDINA,01/04/2017,2017-04-01,opendatasus
1313,ES,320450,SANTA LEOPOLDINA,03/04/2017,2017-04-03,opendatasus
1314,ES,320450,SANTA LEOPOLDINA,04/04/2017,2017-04-04,opendatasus
1315,ES,320450,SANTA LEOPOLDINA,05/04/2017,2017-04-05,opendatasus
1316,ES,320450,SANTA LEOPOLDINA,07/04/2017,2017-04-07,opendatasus
1317,ES,320450,SANTA LEOPOLDINA,10/04/2017,2017-04-10,opendatasus
1318,ES,320450,SANTA LEOPOLDINA,14/04/2017,2017-04-14,opendatasus
1319,ES,320450,SANTA LEOPOLDINA,16/04/2017,2017-04-16,opendatasus
1320,ES,320450,SANTA LEOPOLDINA,17/04/2017,2017-04-17,opendatasus
1321,ES,320450,SANTA LEOPOLDINA,18/04/2017,2017-04-18,opendatasus
1322,ES,320450,SANTA LEOPOLDINA,24/04/2017,2017-04-24,opendatasus
1323,ES,320450,SANTA LEOPOLDINA,26/04/2017,2017-04-26,opendatasus
1324,ES,320450,SANTA LEOPOLDINA,05/01/2018,2018-01-05,opendatasus
1325,ES,320455,SANTA MARIA DE JETIBÁ,17/01/2017,2017-01-17,opendatasus
1326,ES,320455,SANTA MARIA DE JETIBÁ,22/01/2017,2017-01-22,opendatasus
1327,ES,320455,SANTA MARIA DE JETIBÁ,26/01/2017,2017-01-26,opendatasus
1328,ES,320455,SANTA MARIA DE JETIBÁ,13/02/2017,2017-02-13,opendatasus
1329,ES,320455,SANTA MARIA DE JETIBÁ,16/02/2017,2017-02-16,opendatasus
1330,ES,320455,SANTA MARIA DE JETIBÁ,19/03/2017,2017-03-19,opendatasus
1331,ES,320455,SANTA MARIA DE JETIBÁ,23/03/2017,2017-03-23,opendatasus
1332,ES,320455,SANTA MARIA DE JETIBÁ,26/03/2017,2017-03-26,opendatasus
1333,ES,320455,SANTA MARIA DE JETIBÁ,02/04/2017,2017-04-02,opendatasus
1334,ES,320455,SANTA MARIA DE JETIBÁ,10/04/2017,2017-04-10,opendatasus
1335,ES,320455,SANTA MARIA DE JETIBÁ,11/04/2017,2017-04-11,opendatasus
1336,ES,320455,SANTA MARIA DE JETIBÁ,12/04/2017,2017-04-12,opendatasus
1337,ES,320455,SANTA MARIA DE JETIBÁ,17/04/2017,2017-04-17,opendatasus
1338,ES,320455,SANTA MARIA DE JETIBÁ,21/04/2017,2017-04-21,opendatasus
1339,ES,320455,SANTA MARIA DE JETIBÁ,22/04/2017,2017-04-22,opendatasus
1340,ES,320455,SANTA MARIA DE JETIBÁ,24/04/2017,2017-04-24,opendatasus
1341,ES,320460,SANTA TERESA,19/01/2017,2017-01-19,opendatasus
1342,ES,320460,SANTA TERESA,20/01/2017,2017-01-20,opendatasus
1343,ES,320460,SANTA TERESA,24/01/2017,2017-01-24,opendatasus
1344,ES,320460,SANTA TERESA,27/01/2017,2017-01-27,opendatasus
1345,ES,320460,SANTA TERESA,26/02/2017,2017-02-26,opendatasus
1346,ES,320460,SANTA TERESA,02/03/2017,2017-03-02,opendatasus
1347,ES,320460,SANTA TERESA,03/03/2017,2017-03-03,opendatasus
1348,ES,320460,SANTA TERESA,18/03/2017,2017-03-18,opendatasus
1349,ES,320460,SANTA TERESA,23/03/2017,2017-03-23,opendatasus
1350,ES,320460,SANTA TERESA,28/03/2017,2017-03-28,opendatasus
1351,ES,320460,SANTA TERESA,24/04/2017,2017-04-24,opendatasus
1352,ES,320460,SANTA TERESA,26/04/2017,2017-04-26,opendatasus
1353,ES,320460,SANTA TERESA,27/04/2017,2017-04-27,opendatasus
1354,ES,320490,SĂO MATEUS,24/01/2017,2017-01-24,opendatasus
1355,ES,320490,SĂO MATEUS,03/04/2017,2017-04-03,opendatasus
1356,ES,320495,SĂO ROQUE DO CANAĂ,04/01/2017,2017-01-04,opendatasus
1357,ES,320495,SĂO ROQUE DO CANAĂ,14/01/2017,2017-01-14,opendatasus
1358,ES,320495,SĂO ROQUE DO CANAĂ,23/01/2017,2017-01-23,opendatasus
1359,ES,320495,SĂO ROQUE DO CANAĂ,03/02/2017,2017-02-03,opendatasus
1360,ES,320495,SĂO ROQUE DO CANAĂ,11/02/2017,2017-02-11,opendatasus
1361,ES,320500,SERRA,27/01/2017,2017-01-27,opendatasus
1362,ES,320500,SERRA,03/02/2017,2017-02-03,opendatasus
1363,ES,320500,SERRA,13/02/2017,2017-02-13,opendatasus
1364,ES,320500,SERRA,25/02/2017,2017-02-25,opendatasus
1365,ES,320500,SERRA,27/02/2017,2017-02-27,opendatasus
1366,ES,320500,SERRA,28/02/2017,2017-02-28,opendatasus
1367,ES,320500,SERRA,01/03/2017,2017-03-01,opendatasus
1368,ES,320500,SERRA,02/03/2017,2017-03-02,opendatasus
1369,ES,320500,SERRA,06/03/2017,2017-03-06,opendatasus
1370,ES,320500,SERRA,15/03/2017,2017-03-15,opendatasus
1371,ES,320500,SERRA,17/03/2017,2017-03-17,opendatasus
1372,ES,320500,SERRA,19/03/2017,2017-03-19,opendatasus
1373,ES,320500,SERRA,27/03/2017,2017-03-27,opendatasus
1374,ES,320500,SERRA,05/04/2017,2017-04-05,opendatasus
1375,ES,320500,SERRA,16/06/2017,2017-06-16,opendatasus
1376,ES,320500,SERRA,08/07/2017,2017-07-08,opendatasus
1377,ES,320500,SERRA,29/08/2017,2017-08-29,opendatasus
1378,ES,320500,SERRA,10/01/2018,2018-01-10,opendatasus
1379,ES,320503,VARGEM ALTA,12/02/2017,2017-02-12,opendatasus
1380,ES,320503,VARGEM ALTA,02/03/2017,2017-03-02,opendatasus
1381,ES,320503,VARGEM ALTA,25/03/2017,2017-03-25,opendatasus
1382,ES,320506,VENDA NOVA DO IMIGRANTE,17/01/2017,2017-01-17,opendatasus
1383,ES,320506,VENDA NOVA DO IMIGRANTE,18/01/2017,2017-01-18,opendatasus
1384,ES,320506,VENDA NOVA DO IMIGRANTE,22/01/2017,2017-01-22,opendatasus
1385,ES,320506,VENDA NOVA DO IMIGRANTE,15/02/2017,2017-02-15,opendatasus
1386,ES,320506,VENDA NOVA DO IMIGRANTE,17/03/2017,2017-03-17,opendatasus
1387,ES,320506,VENDA NOVA DO IMIGRANTE,19/03/2017,2017-03-19,opendatasus
1388,ES,320510,VIANA,25/01/2017,2017-01-25,opendatasus
1389,ES,320510,VIANA,01/02/2017,2017-02-01,opendatasus
1390,ES,320510,VIANA,13/02/2017,2017-02-13,opendatasus
1391,ES,320510,VIANA,14/02/2017,2017-02-14,opendatasus
1392,ES,320510,VIANA,19/02/2017,2017-02-19,opendatasus
1393,ES,320510,VIANA,24/02/2017,2017-02-24,opendatasus
1394,ES,320510,VIANA,11/03/2017,2017-03-11,opendatasus
1395,ES,320510,VIANA,03/04/2017,2017-04-03,opendatasus
1396,ES,320520,VILA VELHA,03/03/2017,2017-03-03,opendatasus
1397,ES,320520,VILA VELHA,06/03/2017,2017-03-06,opendatasus
1398,ES,320520,VILA VELHA,09/03/2017,2017-03-09,opendatasus
1399,ES,320520,VILA VELHA,07/04/2017,2017-04-07,opendatasus
1400,ES,320530,VITÓRIA,17/01/2017,2017-01-17,opendatasus
1401,ES,320530,VITÓRIA,11/03/2017,2017-03-11,opendatasus
1402,ES,320530,VITÓRIA,19/03/2017,2017-03-19,opendatasus
1403,RJ,330010,ANGRA DOS REIS,05/01/2018,2018-01-05,opendatasus
1404,RJ,330010,ANGRA DOS REIS,17/01/2018,2018-01-17,opendatasus
1405,RJ,330010,ANGRA DOS REIS,18/01/2018,2018-01-18,opendatasus
1406,RJ,330010,ANGRA DOS REIS,20/01/2018,2018-01-20,opendatasus
1407,RJ,330010,ANGRA DOS REIS,21/01/2018,2018-01-21,opendatasus
1408,RJ,330010,ANGRA DOS REIS,22/01/2018,2018-01-22,opendatasus
1409,RJ,330010,ANGRA DOS REIS,27/01/2018,2018-01-27,opendatasus
1410,RJ,330010,ANGRA DOS REIS,29/01/2018,2018-01-29,opendatasus
1411,RJ,330010,ANGRA DOS REIS,01/02/2018,2018-02-01,opendatasus
1412,RJ,330010,ANGRA DOS REIS,03/02/2018,2018-02-03,opendatasus
1413,RJ,330010,ANGRA DOS REIS,04/02/2018,2018-02-04,opendatasus
1414,RJ,330010,ANGRA DOS REIS,05/02/2018,2018-02-05,opendatasus
1415,RJ,330010,ANGRA DOS REIS,06/02/2018,2018-02-06,opendatasus
1416,RJ,330010,ANGRA DOS REIS,07/02/2018,2018-02-07,opendatasus
1417,RJ,330010,ANGRA DOS REIS,08/02/2018,2018-02-08,opendatasus
1418,RJ,330010,ANGRA DOS REIS,09/02/2018,2018-02-09,opendatasus
1419,RJ,330010,ANGRA DOS REIS,10/02/2018,2018-02-10,opendatasus
1420,RJ,330010,ANGRA DOS REIS,11/02/2018,2018-02-11,opendatasus
1421,RJ,330010,ANGRA DOS REIS,12/02/2018,2018-02-12,opendatasus
1422,RJ,330010,ANGRA DOS REIS,14/02/2018,2018-02-14,opendatasus
1423,RJ,330010,ANGRA DOS REIS,15/02/2018,2018-02-15,opendatasus
1424,RJ,330010,ANGRA DOS REIS,16/02/2018,2018-02-16,opendatasus
1425,RJ,330010,ANGRA DOS REIS,17/02/2018,2018-02-17,opendatasus
1426,RJ,330010,ANGRA DOS REIS,18/02/2018,2018-02-18,opendatasus
1427,RJ,330010,ANGRA DOS REIS,19/02/2018,2018-02-19,opendatasus
1428,RJ,330010,ANGRA DOS REIS,20/02/2018,2018-02-20,opendatasus
1429,RJ,330010,ANGRA DOS REIS,21/02/2018,2018-02-21,opendatasus
1430,RJ,330010,ANGRA DOS REIS,22/02/2018,2018-02-22,opendatasus
1431,RJ,330010,ANGRA DOS REIS,26/02/2018,2018-02-26,opendatasus
1432,RJ,330010,ANGRA DOS REIS,27/02/2018,2018-02-27,opendatasus
1433,RJ,330010,ANGRA DOS REIS,28/02/2018,2018-02-28,opendatasus
1434,RJ,330010,ANGRA DOS REIS,02/03/2018,2018-03-02,opendatasus
1435,RJ,330010,ANGRA DOS REIS,08/03/2018,2018-03-08,opendatasus
1436,RJ,330010,ANGRA DOS REIS,13/03/2018,2018-03-13,opendatasus
1437,RJ,330010,ANGRA DOS REIS,16/03/2018,2018-03-16,opendatasus
1438,RJ,330010,ANGRA DOS REIS,19/03/2018,2018-03-19,opendatasus
1439,RJ,330010,ANGRA DOS REIS,25/03/2018,2018-03-25,opendatasus
1440,RJ,330010,ANGRA DOS REIS,14/04/2018,2018-04-14,opendatasus
1441,RJ,330020,ARARUAMA,05/02/2018,2018-02-05,opendatasus
1442,RJ,330030,BARRA DO PIRAÍ,28/02/2018,2018-02-28,opendatasus
1443,RJ,330030,BARRA DO PIRAÍ,05/03/2018,2018-03-05,opendatasus
1444,RJ,330030,BARRA DO PIRAÍ,07/03/2018,2018-03-07,opendatasus
1445,RJ,330030,BARRA DO PIRAÍ,10/03/2018,2018-03-10,opendatasus
1446,RJ,330030,BARRA DO PIRAÍ,15/03/2018,2018-03-15,opendatasus
1447,RJ,330030,BARRA DO PIRAÍ,22/03/2018,2018-03-22,opendatasus
1448,RJ,330030,BARRA DO PIRAÍ,30/03/2018,2018-03-30,opendatasus
1449,RJ,330030,BARRA DO PIRAÍ,22/04/2018,2018-04-22,opendatasus
1450,RJ,330030,BARRA DO PIRAÍ,25/04/2018,2018-04-25,opendatasus
1451,RJ,330030,BARRA DO PIRAÍ,02/05/2018,2018-05-02,opendatasus
1452,RJ,330030,BARRA DO PIRAÍ,17/07/2018,2018-07-17,opendatasus
1453,RJ,330040,BARRA MANSA,18/01/2018,2018-01-18,opendatasus
1454,RJ,330040,BARRA MANSA,17/07/2018,2018-07-17,opendatasus
1455,RJ,330050,BOM JARDIM,14/02/2018,2018-02-14,opendatasus
1456,RJ,330060,BOM JESUS DO ITABAPOANA,26/03/2017,2017-03-26,opendatasus
1457,RJ,330060,BOM JESUS DO ITABAPOANA,22/05/2017,2017-05-22,opendatasus
1458,RJ,330080,CACHOEIRAS DE MACACU,10/05/2017,2017-05-10,opendatasus
1459,RJ,330080,CACHOEIRAS DE MACACU,16/02/2018,2018-02-16,opendatasus
1460,RJ,330080,CACHOEIRAS DE MACACU,22/02/2018,2018-02-22,opendatasus
1461,RJ,330080,CACHOEIRAS DE MACACU,25/02/2018,2018-02-25,opendatasus
1462,RJ,330080,CACHOEIRAS DE MACACU,02/04/2018,2018-04-02,opendatasus
1463,RJ,330080,CACHOEIRAS DE MACACU,17/04/2018,2018-04-17,opendatasus
1464,RJ,330080,CACHOEIRAS DE MACACU,17/07/2018,2018-07-17,opendatasus
1465,RJ,330100,CAMPOS DOS GOYTACAZES,28/02/2017,2017-02-28,opendatasus
1466,RJ,330110,CANTAGALO,09/01/2018,2018-01-09,opendatasus
1467,RJ,330110,CANTAGALO,19/01/2018,2018-01-19,opendatasus
1468,RJ,330110,CANTAGALO,22/01/2018,2018-01-22,opendatasus
1469,RJ,330110,CANTAGALO,31/01/2018,2018-01-31,opendatasus
1470,RJ,330110,CANTAGALO,02/02/2018,2018-02-02,opendatasus
1471,RJ,330110,CANTAGALO,05/02/2018,2018-02-05,opendatasus
1472,RJ,330110,CANTAGALO,16/02/2018,2018-02-16,opendatasus
1473,RJ,330120,CARMO,17/04/2017,2017-04-17,opendatasus
1474,RJ,330120,CARMO,20/04/2017,2017-04-20,opendatasus
1475,RJ,330120,CARMO,14/01/2018,2018-01-14,opendatasus
1476,RJ,330120,CARMO,21/01/2018,2018-01-21,opendatasus
1477,RJ,330130,CASIMIRO DE ABREU,01/03/2017,2017-03-01,opendatasus
1478,RJ,330130,CASIMIRO DE ABREU,06/03/2017,2017-03-06,opendatasus
1479,RJ,330130,CASIMIRO DE ABREU,12/03/2017,2017-03-12,opendatasus
1480,RJ,330130,CASIMIRO DE ABREU,13/03/2017,2017-03-13,opendatasus
1481,RJ,330130,CASIMIRO DE ABREU,14/03/2017,2017-03-14,opendatasus
1482,RJ,330130,CASIMIRO DE ABREU,15/03/2017,2017-03-15,opendatasus
1483,RJ,330130,CASIMIRO DE ABREU,16/03/2017,2017-03-16,opendatasus
1484,RJ,330130,CASIMIRO DE ABREU,11/01/2019,2019-01-11,opendatasus
1485,RJ,330160,DUAS BARRAS,21/12/2017,2017-12-21,opendatasus
1486,RJ,330160,DUAS BARRAS,05/01/2018,2018-01-05,opendatasus
1487,RJ,330160,DUAS BARRAS,19/01/2018,2018-01-19,opendatasus
1488,RJ,330160,DUAS BARRAS,25/01/2018,2018-01-25,opendatasus
1489,RJ,330160,DUAS BARRAS,26/01/2018,2018-01-26,opendatasus
1490,RJ,330160,DUAS BARRAS,27/01/2018,2018-01-27,opendatasus
1491,RJ,330160,DUAS BARRAS,02/02/2018,2018-02-02,opendatasus
1492,RJ,330160,DUAS BARRAS,03/02/2018,2018-02-03,opendatasus
1493,RJ,330160,DUAS BARRAS,06/02/2018,2018-02-06,opendatasus
1494,RJ,330160,DUAS BARRAS,08/02/2018,2018-02-08,opendatasus
1495,RJ,330160,DUAS BARRAS,11/02/2018,2018-02-11,opendatasus
1496,RJ,330160,DUAS BARRAS,13/02/2018,2018-02-13,opendatasus
1497,RJ,330160,DUAS BARRAS,16/02/2018,2018-02-16,opendatasus
1498,RJ,330160,DUAS BARRAS,27/02/2018,2018-02-27,opendatasus
1499,RJ,330180,ENGENHEIRO PAULO DE FRONTIN,23/01/2018,2018-01-23,opendatasus
1500,RJ,330180,ENGENHEIRO PAULO DE FRONTIN,05/02/2018,2018-02-05,opendatasus
1501,RJ,330180,ENGENHEIRO PAULO DE FRONTIN,10/02/2018,2018-02-10,opendatasus
1502,RJ,330180,ENGENHEIRO PAULO DE FRONTIN,05/03/2018,2018-03-05,opendatasus
1503,RJ,330180,ENGENHEIRO PAULO DE FRONTIN,12/03/2018,2018-03-12,opendatasus
1504,RJ,330180,ENGENHEIRO PAULO DE FRONTIN,14/04/2018,2018-04-14,opendatasus
1505,RJ,330185,GUAPIMIRIM,06/06/2017,2017-06-06,opendatasus
1506,RJ,330185,GUAPIMIRIM,09/07/2017,2017-07-09,opendatasus
1507,RJ,330185,GUAPIMIRIM,11/01/2018,2018-01-11,opendatasus
1508,RJ,330190,ITABORAÍ,29/01/2018,2018-01-29,opendatasus
1509,RJ,330205,ITALVA,10/02/2018,2018-02-10,opendatasus
1510,RJ,330225,ITATIAIA,08/02/2018,2018-02-08,opendatasus
1511,RJ,330225,ITATIAIA,26/03/2018,2018-03-26,opendatasus
1512,RJ,330225,ITATIAIA,05/04/2018,2018-04-05,opendatasus
1513,RJ,330225,ITATIAIA,12/04/2018,2018-04-12,opendatasus
1514,RJ,330225,ITATIAIA,13/04/2018,2018-04-13,opendatasus
1515,RJ,330225,ITATIAIA,03/05/2018,2018-05-03,opendatasus
1516,RJ,330240,MACAÉ,04/04/2017,2017-04-04,opendatasus
1517,RJ,330240,MACAÉ,07/04/2017,2017-04-07,opendatasus
1518,RJ,330240,MACAÉ,30/04/2017,2017-04-30,opendatasus
1519,RJ,330240,MACAÉ,10/05/2017,2017-05-10,opendatasus
1520,RJ,330240,MACAÉ,26/05/2017,2017-05-26,opendatasus
1521,RJ,330240,MACAÉ,01/06/2017,2017-06-01,opendatasus
1522,RJ,330245,MACUCO,19/05/2017,2017-05-19,opendatasus
1523,RJ,330260,MANGARATIBA,28/01/2018,2018-01-28,opendatasus
1524,RJ,330260,MANGARATIBA,02/04/2018,2018-04-02,opendatasus
1525,RJ,330260,MANGARATIBA,13/04/2018,2018-04-13,opendatasus
1526,RJ,330260,MANGARATIBA,24/04/2018,2018-04-24,opendatasus
1527,RJ,330270,MARICÁ,11/04/2017,2017-04-11,opendatasus
1528,RJ,330270,MARICÁ,17/04/2017,2017-04-17,opendatasus
1529,RJ,330270,MARICÁ,20/04/2017,2017-04-20,opendatasus
1530,RJ,330270,MARICÁ,02/01/2018,2018-01-02,opendatasus
1531,RJ,330270,MARICÁ,21/01/2018,2018-01-21,opendatasus
1532,RJ,330290,MIGUEL PEREIRA,23/10/2017,2017-10-23,opendatasus
1533,RJ,330290,MIGUEL PEREIRA,04/01/2018,2018-01-04,opendatasus
1534,RJ,330290,MIGUEL PEREIRA,16/01/2018,2018-01-16,opendatasus
1535,RJ,330290,MIGUEL PEREIRA,23/01/2018,2018-01-23,opendatasus
1536,RJ,330290,MIGUEL PEREIRA,08/02/2018,2018-02-08,opendatasus
1537,RJ,330290,MIGUEL PEREIRA,18/02/2018,2018-02-18,opendatasus
1538,RJ,330290,MIGUEL PEREIRA,16/03/2018,2018-03-16,opendatasus
1539,RJ,330290,MIGUEL PEREIRA,10/04/2018,2018-04-10,opendatasus
1540,RJ,330330,NITERÓI,20/04/2017,2017-04-20,opendatasus
1541,RJ,330330,NITERÓI,29/11/2017,2017-11-29,opendatasus
1542,RJ,330330,NITERÓI,23/01/2018,2018-01-23,opendatasus
1543,RJ,330340,NOVA FRIBURGO,05/01/2018,2018-01-05,opendatasus
1544,RJ,330340,NOVA FRIBURGO,12/01/2018,2018-01-12,opendatasus
1545,RJ,330340,NOVA FRIBURGO,14/01/2018,2018-01-14,opendatasus
1546,RJ,330340,NOVA FRIBURGO,15/01/2018,2018-01-15,opendatasus
1547,RJ,330340,NOVA FRIBURGO,16/01/2018,2018-01-16,opendatasus
1548,RJ,330340,NOVA FRIBURGO,20/01/2018,2018-01-20,opendatasus
1549,RJ,330340,NOVA FRIBURGO,22/01/2018,2018-01-22,opendatasus
1550,RJ,330340,NOVA FRIBURGO,24/01/2018,2018-01-24,opendatasus
1551,RJ,330340,NOVA FRIBURGO,01/02/2018,2018-02-01,opendatasus
1552,RJ,330340,NOVA FRIBURGO,07/02/2018,2018-02-07,opendatasus
1553,RJ,330340,NOVA FRIBURGO,09/02/2018,2018-02-09,opendatasus
1554,RJ,330340,NOVA FRIBURGO,13/02/2018,2018-02-13,opendatasus
1555,RJ,330340,NOVA FRIBURGO,14/02/2018,2018-02-14,opendatasus
1556,RJ,330340,NOVA FRIBURGO,17/02/2018,2018-02-17,opendatasus
1557,RJ,330340,NOVA FRIBURGO,21/02/2018,2018-02-21,opendatasus
1558,RJ,330340,NOVA FRIBURGO,14/03/2018,2018-03-14,opendatasus
1559,RJ,330340,NOVA FRIBURGO,28/03/2018,2018-03-28,opendatasus
1560,RJ,330350,NOVA IGUAÇU,28/11/2017,2017-11-28,opendatasus
1561,RJ,330350,NOVA IGUAÇU,23/01/2018,2018-01-23,opendatasus
1562,RJ,330370,PARAÍBA DO SUL,13/01/2018,2018-01-13,opendatasus
1563,RJ,330380,PARATY,26/01/2018,2018-01-26,opendatasus
1564,RJ,330380,PARATY,15/03/2018,2018-03-15,opendatasus
1565,RJ,330380,PARATY,20/03/2018,2018-03-20,opendatasus
1566,RJ,330380,PARATY,26/03/2018,2018-03-26,opendatasus
1567,RJ,330380,PARATY,01/04/2018,2018-04-01,opendatasus
1568,RJ,330380,PARATY,02/04/2018,2018-04-02,opendatasus
1569,RJ,330380,PARATY,03/04/2018,2018-04-03,opendatasus
1570,RJ,330380,PARATY,11/04/2018,2018-04-11,opendatasus
1571,RJ,330380,PARATY,12/04/2018,2018-04-12,opendatasus
1572,RJ,330380,PARATY,19/04/2018,2018-04-19,opendatasus
1573,RJ,330380,PARATY,24/04/2018,2018-04-24,opendatasus
1574,RJ,330380,PARATY,17/07/2018,2018-07-17,opendatasus
1575,RJ,330385,PATY DO ALFERES,14/01/2018,2018-01-14,opendatasus
1576,RJ,330385,PATY DO ALFERES,10/02/2018,2018-02-10,opendatasus
1577,RJ,330385,PATY DO ALFERES,15/02/2018,2018-02-15,opendatasus
1578,RJ,330385,PATY DO ALFERES,07/03/2018,2018-03-07,opendatasus
1579,RJ,330390,PETRÓPOLIS,20/04/2017,2017-04-20,opendatasus
1580,RJ,330390,PETRÓPOLIS,05/01/2018,2018-01-05,opendatasus
1581,RJ,330390,PETRÓPOLIS,10/01/2018,2018-01-10,opendatasus
1582,RJ,330390,PETRÓPOLIS,08/02/2018,2018-02-08,opendatasus
1583,RJ,330390,PETRÓPOLIS,23/02/2018,2018-02-23,opendatasus
1584,RJ,330390,PETRÓPOLIS,06/06/2018,2018-06-06,opendatasus
1585,RJ,330395,PINHEIRAL,16/03/2018,2018-03-16,opendatasus
1586,RJ,330400,PIRAÍ,13/02/2018,2018-02-13,opendatasus
1587,RJ,330400,PIRAÍ,14/02/2018,2018-02-14,opendatasus
1588,RJ,330400,PIRAÍ,28/02/2018,2018-02-28,opendatasus
1589,RJ,330400,PIRAÍ,22/03/2018,2018-03-22,opendatasus
1590,RJ,330410,PORCIÚNCULA,20/02/2017,2017-02-20,opendatasus
1591,RJ,330410,PORCIÚNCULA,09/05/2017,2017-05-09,opendatasus
1592,RJ,330420,RESENDE,07/04/2018,2018-04-07,opendatasus
1593,RJ,330420,RESENDE,13/04/2018,2018-04-13,opendatasus
1594,RJ,330420,RESENDE,24/04/2018,2018-04-24,opendatasus
1595,RJ,330420,RESENDE,30/04/2018,2018-04-30,opendatasus
1596,RJ,330430,RIO BONITO,24/04/2018,2018-04-24,opendatasus
1597,RJ,330430,RIO BONITO,28/04/2018,2018-04-28,opendatasus
1598,RJ,330440,RIO CLARO,21/01/2018,2018-01-21,opendatasus
1599,RJ,330440,RIO CLARO,27/01/2018,2018-01-27,opendatasus
1600,RJ,330440,RIO CLARO,28/01/2018,2018-01-28,opendatasus
1601,RJ,330440,RIO CLARO,02/02/2018,2018-02-02,opendatasus
1602,RJ,330440,RIO CLARO,16/02/2018,2018-02-16,opendatasus
1603,RJ,330440,RIO CLARO,30/04/2018,2018-04-30,opendatasus
1604,RJ,330450,RIO DAS FLORES,20/03/2017,2017-03-20,opendatasus
1605,RJ,330450,RIO DAS FLORES,14/01/2018,2018-01-14,opendatasus
1606,RJ,330450,RIO DAS FLORES,16/01/2018,2018-01-16,opendatasus
1607,RJ,330450,RIO DAS FLORES,30/01/2018,2018-01-30,opendatasus
1608,RJ,330450,RIO DAS FLORES,10/02/2018,2018-02-10,opendatasus
1609,RJ,330450,RIO DAS FLORES,26/02/2018,2018-02-26,opendatasus
1610,RJ,330455,RIO DE JANEIRO,18/01/2018,2018-01-18,opendatasus
1611,RJ,330455,RIO DE JANEIRO,22/01/2018,2018-01-22,opendatasus
1612,RJ,330455,RIO DE JANEIRO,23/01/2018,2018-01-23,opendatasus
1613,RJ,330455,RIO DE JANEIRO,25/01/2018,2018-01-25,opendatasus
1614,RJ,330455,RIO DE JANEIRO,26/01/2018,2018-01-26,opendatasus
1615,RJ,330455,RIO DE JANEIRO,05/02/2018,2018-02-05,opendatasus
1616,RJ,330455,RIO DE JANEIRO,19/02/2018,2018-02-19,opendatasus
1617,RJ,330455,RIO DE JANEIRO,12/03/2018,2018-03-12,opendatasus
1618,RJ,330455,RIO DE JANEIRO,13/03/2018,2018-03-13,opendatasus
1619,RJ,330455,RIO DE JANEIRO,20/03/2018,2018-03-20,opendatasus
1620,RJ,330455,RIO DE JANEIRO,02/04/2018,2018-04-02,opendatasus
1621,RJ,330455,RIO DE JANEIRO,03/04/2018,2018-04-03,opendatasus
1622,RJ,330455,RIO DE JANEIRO,09/04/2018,2018-04-09,opendatasus
1623,RJ,330455,RIO DE JANEIRO,16/04/2018,2018-04-16,opendatasus
1624,RJ,330455,RIO DE JANEIRO,02/05/2018,2018-05-02,opendatasus
1625,RJ,330455,RIO DE JANEIRO,18/07/2018,2018-07-18,opendatasus
1626,RJ,330455,RIO DE JANEIRO,20/07/2018,2018-07-20,opendatasus
1627,RJ,330460,SANTA MARIA MADALENA,18/04/2017,2017-04-18,opendatasus
1628,RJ,330460,SANTA MARIA MADALENA,04/05/2017,2017-05-04,opendatasus
1629,RJ,330480,SĂO FIDÉLIS,15/03/2017,2017-03-15,opendatasus
1630,RJ,330490,SĂO GONÇALO,21/01/2018,2018-01-21,opendatasus
1631,RJ,330515,SĂO JOSÉ DO VALE DO RIO PRETO,05/03/2018,2018-03-05,opendatasus
1632,RJ,330515,SĂO JOSÉ DO VALE DO RIO PRETO,02/04/2018,2018-04-02,opendatasus
1633,RJ,330520,SĂO PEDRO DA ALDEIA,16/04/2018,2018-04-16,opendatasus
1634,RJ,330530,SĂO SEBASTIĂO DO ALTO,09/03/2017,2017-03-09,opendatasus
1635,RJ,330540,SAPUCAIA,05/03/2018,2018-03-05,opendatasus
1636,RJ,330555,SEROPÉDICA,23/01/2018,2018-01-23,opendatasus
1637,RJ,330560,SILVA JARDIM,17/04/2017,2017-04-17,opendatasus
1638,RJ,330560,SILVA JARDIM,01/01/2018,2018-01-01,opendatasus
1639,RJ,330560,SILVA JARDIM,13/02/2018,2018-02-13,opendatasus
1640,RJ,330560,SILVA JARDIM,15/02/2018,2018-02-15,opendatasus
1641,RJ,330560,SILVA JARDIM,24/02/2018,2018-02-24,opendatasus
1642,RJ,330560,SILVA JARDIM,18/03/2018,2018-03-18,opendatasus
1643,RJ,330560,SILVA JARDIM,24/04/2018,2018-04-24,opendatasus
1644,RJ,330570,SUMIDOURO,15/12/2017,2017-12-15,opendatasus
1645,RJ,330570,SUMIDOURO,22/12/2017,2017-12-22,opendatasus
1646,RJ,330570,SUMIDOURO,04/01/2018,2018-01-04,opendatasus
1647,RJ,330570,SUMIDOURO,11/01/2018,2018-01-11,opendatasus
1648,RJ,330570,SUMIDOURO,16/01/2018,2018-01-16,opendatasus
1649,RJ,330570,SUMIDOURO,19/01/2018,2018-01-19,opendatasus
1650,RJ,330570,SUMIDOURO,20/01/2018,2018-01-20,opendatasus
1651,RJ,330570,SUMIDOURO,23/01/2018,2018-01-23,opendatasus
1652,RJ,330570,SUMIDOURO,29/01/2018,2018-01-29,opendatasus
1653,RJ,330570,SUMIDOURO,02/02/2018,2018-02-02,opendatasus
1654,RJ,330570,SUMIDOURO,08/02/2018,2018-02-08,opendatasus
1655,RJ,330570,SUMIDOURO,11/02/2018,2018-02-11,opendatasus
1656,RJ,330570,SUMIDOURO,25/02/2018,2018-02-25,opendatasus
1657,RJ,330570,SUMIDOURO,29/03/2018,2018-03-29,opendatasus
1658,RJ,330575,TANGUÁ,24/10/2017,2017-10-24,opendatasus
1659,RJ,330575,TANGUÁ,13/04/2018,2018-04-13,opendatasus
1660,RJ,330580,TERESÓPOLIS,04/01/2018,2018-01-04,opendatasus
1661,RJ,330580,TERESÓPOLIS,05/01/2018,2018-01-05,opendatasus
1662,RJ,330580,TERESÓPOLIS,09/01/2018,2018-01-09,opendatasus
1663,RJ,330580,TERESÓPOLIS,12/01/2018,2018-01-12,opendatasus
1664,RJ,330580,TERESÓPOLIS,18/01/2018,2018-01-18,opendatasus
1665,RJ,330580,TERESÓPOLIS,23/01/2018,2018-01-23,opendatasus
1666,RJ,330580,TERESÓPOLIS,24/01/2018,2018-01-24,opendatasus
1667,RJ,330580,TERESÓPOLIS,25/01/2018,2018-01-25,opendatasus
1668,RJ,330580,TERESÓPOLIS,26/01/2018,2018-01-26,opendatasus
1669,RJ,330580,TERESÓPOLIS,30/01/2018,2018-01-30,opendatasus
1670,RJ,330580,TERESÓPOLIS,03/02/2018,2018-02-03,opendatasus
1671,RJ,330580,TERESÓPOLIS,04/02/2018,2018-02-04,opendatasus
1672,RJ,330580,TERESÓPOLIS,11/02/2018,2018-02-11,opendatasus
1673,RJ,330580,TERESÓPOLIS,13/02/2018,2018-02-13,opendatasus
1674,RJ,330580,TERESÓPOLIS,16/02/2018,2018-02-16,opendatasus
1675,RJ,330580,TERESÓPOLIS,18/02/2018,2018-02-18,opendatasus
1676,RJ,330580,TERESÓPOLIS,20/02/2018,2018-02-20,opendatasus
1677,RJ,330580,TERESÓPOLIS,21/02/2018,2018-02-21,opendatasus
1678,RJ,330590,TRAJANO DE MORAES,15/02/2018,2018-02-15,opendatasus
1679,RJ,330590,TRAJANO DE MORAES,16/02/2018,2018-02-16,opendatasus
1680,RJ,330590,TRAJANO DE MORAES,23/02/2018,2018-02-23,opendatasus
1681,RJ,330590,TRAJANO DE MORAES,25/02/2018,2018-02-25,opendatasus
1682,RJ,330600,TRĘS RIOS,22/01/2018,2018-01-22,opendatasus
1683,RJ,330610,VALENÇA,23/03/2017,2017-03-23,opendatasus
1684,RJ,330610,VALENÇA,29/12/2017,2017-12-29,opendatasus
1685,RJ,330610,VALENÇA,02/01/2018,2018-01-02,opendatasus
1686,RJ,330610,VALENÇA,05/01/2018,2018-01-05,opendatasus
1687,RJ,330610,VALENÇA,06/01/2018,2018-01-06,opendatasus
1688,RJ,330610,VALENÇA,11/01/2018,2018-01-11,opendatasus
1689,RJ,330610,VALENÇA,12/01/2018,2018-01-12,opendatasus
1690,RJ,330610,VALENÇA,13/01/2018,2018-01-13,opendatasus
1691,RJ,330610,VALENÇA,14/01/2018,2018-01-14,opendatasus
1692,RJ,330610,VALENÇA,16/01/2018,2018-01-16,opendatasus
1693,RJ,330610,VALENÇA,17/01/2018,2018-01-17,opendatasus
1694,RJ,330610,VALENÇA,18/01/2018,2018-01-18,opendatasus
1695,RJ,330610,VALENÇA,19/01/2018,2018-01-19,opendatasus
1696,RJ,330610,VALENÇA,22/01/2018,2018-01-22,opendatasus
1697,RJ,330610,VALENÇA,24/01/2018,2018-01-24,opendatasus
1698,RJ,330610,VALENÇA,25/01/2018,2018-01-25,opendatasus
1699,RJ,330610,VALENÇA,26/01/2018,2018-01-26,opendatasus
1700,RJ,330610,VALENÇA,28/01/2018,2018-01-28,opendatasus
1701,RJ,330610,VALENÇA,01/02/2018,2018-02-01,opendatasus
1702,RJ,330610,VALENÇA,04/02/2018,2018-02-04,opendatasus
1703,RJ,330610,VALENÇA,11/02/2018,2018-02-11,opendatasus
1704,RJ,330610,VALENÇA,23/02/2018,2018-02-23,opendatasus
1705,RJ,330610,VALENÇA,13/03/2018,2018-03-13,opendatasus
1706,RJ,330610,VALENÇA,04/04/2018,2018-04-04,opendatasus
1707,RJ,330620,VASSOURAS,14/01/2018,2018-01-14,opendatasus
1708,RJ,330620,VASSOURAS,09/02/2018,2018-02-09,opendatasus
1709,RJ,330620,VASSOURAS,10/02/2018,2018-02-10,opendatasus
1710,RJ,330620,VASSOURAS,15/03/2018,2018-03-15,opendatasus
1711,RJ,330620,VASSOURAS,19/03/2018,2018-03-19,opendatasus
1712,RJ,330630,VOLTA REDONDA,18/01/2018,2018-01-18,opendatasus
1713,RJ,330630,VOLTA REDONDA,05/02/2018,2018-02-05,opendatasus
1714,RJ,330630,VOLTA REDONDA,20/03/2018,2018-03-20,opendatasus
1715,RJ,330630,VOLTA REDONDA,13/04/2018,2018-04-13,opendatasus
1716,SP,350020,ADOLFO,03/11/2016,2016-11-03,opendatasus
1717,SP,350030,AGUAÍ,11/02/2018,2018-02-11,opendatasus
1718,SP,350040,ÁGUAS DA PRATA,22/02/2017,2017-02-22,opendatasus
1719,SP,350040,ÁGUAS DA PRATA,27/02/2017,2017-02-27,opendatasus
1720,SP,350040,ÁGUAS DA PRATA,02/03/2017,2017-03-02,opendatasus
1721,SP,350040,ÁGUAS DA PRATA,19/04/2017,2017-04-19,opendatasus
1722,SP,350040,ÁGUAS DA PRATA,24/02/2023,2023-02-24,opendatasus
1723,SP,350050,ÁGUAS DE LINDÓIA,10/11/2018,2018-11-10,opendatasus
1724,SP,350170,AMÉRICO BRASILIENSE,01/03/2017,2017-03-01,opendatasus
1725,SP,350170,AMÉRICO BRASILIENSE,19/03/2017,2017-03-19,opendatasus
1726,SP,350180,AMÉRICO DE CAMPOS,24/01/2017,2017-01-24,opendatasus
1727,SP,350190,AMPARO,03/03/2017,2017-03-03,opendatasus
1728,SP,350190,AMPARO,11/03/2017,2017-03-11,opendatasus
1729,SP,350190,AMPARO,13/03/2017,2017-03-13,opendatasus
1730,SP,350190,AMPARO,20/03/2017,2017-03-20,opendatasus
1731,SP,350190,AMPARO,21/03/2017,2017-03-21,opendatasus
1732,SP,350190,AMPARO,22/03/2017,2017-03-22,opendatasus
1733,SP,350190,AMPARO,27/03/2017,2017-03-27,opendatasus
1734,SP,350190,AMPARO,31/03/2017,2017-03-31,opendatasus
1735,SP,350190,AMPARO,11/04/2017,2017-04-11,opendatasus
1736,SP,350190,AMPARO,05/05/2017,2017-05-05,opendatasus
1737,SP,350270,APIAÍ,04/03/2019,2019-03-04,opendatasus
1738,SP,350390,ARUJÁ,15/01/2018,2018-01-15,opendatasus
1739,SP,350390,ARUJÁ,18/01/2018,2018-01-18,opendatasus
1740,SP,350390,ARUJÁ,01/02/2018,2018-02-01,opendatasus
1741,SP,350390,ARUJÁ,05/02/2018,2018-02-05,opendatasus
1742,SP,350390,ARUJÁ,14/02/2018,2018-02-14,opendatasus
1743,SP,350390,ARUJÁ,23/02/2018,2018-02-23,opendatasus
1744,SP,350390,ARUJÁ,25/02/2018,2018-02-25,opendatasus
1745,SP,350390,ARUJÁ,03/03/2018,2018-03-03,opendatasus
1746,SP,350390,ARUJÁ,04/03/2018,2018-03-04,opendatasus
1747,SP,350390,ARUJÁ,08/03/2018,2018-03-08,opendatasus
1748,SP,350410,ATIBAIA,28/09/2017,2017-09-28,opendatasus
1749,SP,350410,ATIBAIA,06/10/2017,2017-10-06,opendatasus
1750,SP,350410,ATIBAIA,07/10/2017,2017-10-07,opendatasus
1751,SP,350410,ATIBAIA,10/10/2017,2017-10-10,opendatasus
1752,SP,350410,ATIBAIA,13/10/2017,2017-10-13,opendatasus
1753,SP,350410,ATIBAIA,18/10/2017,2017-10-18,opendatasus
1754,SP,350410,ATIBAIA,19/10/2017,2017-10-19,opendatasus
1755,SP,350410,ATIBAIA,21/10/2017,2017-10-21,opendatasus
1756,SP,350410,ATIBAIA,23/10/2017,2017-10-23,opendatasus
1757,SP,350410,ATIBAIA,24/10/2017,2017-10-24,opendatasus
1758,SP,350410,ATIBAIA,25/10/2017,2017-10-25,opendatasus
1759,SP,350410,ATIBAIA,27/10/2017,2017-10-27,opendatasus
1760,SP,350410,ATIBAIA,30/10/2017,2017-10-30,opendatasus
1761,SP,350410,ATIBAIA,31/10/2017,2017-10-31,opendatasus
1762,SP,350410,ATIBAIA,01/11/2017,2017-11-01,opendatasus
1763,SP,350410,ATIBAIA,04/11/2017,2017-11-04,opendatasus
1764,SP,350410,ATIBAIA,06/11/2017,2017-11-06,opendatasus
1765,SP,350410,ATIBAIA,09/11/2017,2017-11-09,opendatasus
1766,SP,350410,ATIBAIA,10/11/2017,2017-11-10,opendatasus
1767,SP,350410,ATIBAIA,11/11/2017,2017-11-11,opendatasus
1768,SP,350410,ATIBAIA,15/11/2017,2017-11-15,opendatasus
1769,SP,350410,ATIBAIA,16/11/2017,2017-11-16,opendatasus
1770,SP,350410,ATIBAIA,17/11/2017,2017-11-17,opendatasus
1771,SP,350410,ATIBAIA,18/11/2017,2017-11-18,opendatasus
1772,SP,350410,ATIBAIA,23/11/2017,2017-11-23,opendatasus
1773,SP,350410,ATIBAIA,15/12/2017,2017-12-15,opendatasus
1774,SP,350410,ATIBAIA,17/12/2017,2017-12-17,opendatasus
1775,SP,350410,ATIBAIA,19/12/2017,2017-12-19,opendatasus
1776,SP,350410,ATIBAIA,20/12/2017,2017-12-20,opendatasus
1777,SP,350410,ATIBAIA,22/12/2017,2017-12-22,opendatasus
1778,SP,350410,ATIBAIA,25/12/2017,2017-12-25,opendatasus
1779,SP,350410,ATIBAIA,26/12/2017,2017-12-26,opendatasus
1780,SP,350410,ATIBAIA,27/12/2017,2017-12-27,opendatasus
1781,SP,350410,ATIBAIA,31/12/2017,2017-12-31,opendatasus
1782,SP,350410,ATIBAIA,02/01/2018,2018-01-02,opendatasus
1783,SP,350410,ATIBAIA,04/01/2018,2018-01-04,opendatasus
1784,SP,350410,ATIBAIA,05/01/2018,2018-01-05,opendatasus
1785,SP,350410,ATIBAIA,06/01/2018,2018-01-06,opendatasus
1786,SP,350410,ATIBAIA,07/01/2018,2018-01-07,opendatasus
1787,SP,350410,ATIBAIA,08/01/2018,2018-01-08,opendatasus
1788,SP,350410,ATIBAIA,09/01/2018,2018-01-09,opendatasus
1789,SP,350410,ATIBAIA,11/01/2018,2018-01-11,opendatasus
1790,SP,350410,ATIBAIA,12/01/2018,2018-01-12,opendatasus
1791,SP,350410,ATIBAIA,13/01/2018,2018-01-13,opendatasus
1792,SP,350410,ATIBAIA,14/01/2018,2018-01-14,opendatasus
1793,SP,350410,ATIBAIA,15/01/2018,2018-01-15,opendatasus
1794,SP,350410,ATIBAIA,16/01/2018,2018-01-16,opendatasus
1795,SP,350410,ATIBAIA,17/01/2018,2018-01-17,opendatasus
1796,SP,350410,ATIBAIA,18/01/2018,2018-01-18,opendatasus
1797,SP,350410,ATIBAIA,19/01/2018,2018-01-19,opendatasus
1798,SP,350410,ATIBAIA,20/01/2018,2018-01-20,opendatasus
1799,SP,350410,ATIBAIA,22/01/2018,2018-01-22,opendatasus
1800,SP,350410,ATIBAIA,23/01/2018,2018-01-23,opendatasus
1801,SP,350410,ATIBAIA,24/01/2018,2018-01-24,opendatasus
1802,SP,350410,ATIBAIA,28/01/2018,2018-01-28,opendatasus
1803,SP,350410,ATIBAIA,30/01/2018,2018-01-30,opendatasus
1804,SP,350410,ATIBAIA,31/01/2018,2018-01-31,opendatasus
1805,SP,350410,ATIBAIA,01/02/2018,2018-02-01,opendatasus
1806,SP,350410,ATIBAIA,23/09/2019,2019-09-23,opendatasus
1807,SP,350460,BADY BASSITT,21/03/2016,2016-03-21,opendatasus
1808,SP,350490,BANANAL,10/03/2018,2018-03-10,opendatasus
1809,SP,350535,BARRA DO CHAPÉU,25/01/2019,2019-01-25,opendatasus
1810,SP,350535,BARRA DO CHAPÉU,30/01/2019,2019-01-30,opendatasus
1811,SP,350535,BARRA DO CHAPÉU,31/01/2019,2019-01-31,opendatasus
1812,SP,350535,BARRA DO CHAPÉU,01/02/2019,2019-02-01,opendatasus
1813,SP,350535,BARRA DO CHAPÉU,19/02/2019,2019-02-19,opendatasus
1814,SP,350540,BARRA DO TURVO,28/01/2019,2019-01-28,opendatasus
1815,SP,350540,BARRA DO TURVO,29/01/2019,2019-01-29,opendatasus
1816,SP,350540,BARRA DO TURVO,03/02/2019,2019-02-03,opendatasus
1817,SP,350540,BARRA DO TURVO,18/02/2019,2019-02-18,opendatasus
1818,SP,350540,BARRA DO TURVO,19/02/2019,2019-02-19,opendatasus
1819,SP,350540,BARRA DO TURVO,20/02/2019,2019-02-20,opendatasus
1820,SP,350540,BARRA DO TURVO,04/03/2019,2019-03-04,opendatasus
1821,SP,350540,BARRA DO TURVO,07/03/2019,2019-03-07,opendatasus
1822,SP,350540,BARRA DO TURVO,10/03/2019,2019-03-10,opendatasus
1823,SP,350570,BARUERI,10/03/2020,2020-03-10,opendatasus
1824,SP,350590,BATATAIS,05/01/2017,2017-01-05,opendatasus
1825,SP,350710,BOM JESUS DOS PERDŐES,06/11/2017,2017-11-06,opendatasus
1826,SP,350710,BOM JESUS DOS PERDŐES,06/02/2018,2018-02-06,opendatasus
1827,SP,350710,BOM JESUS DOS PERDŐES,10/02/2018,2018-02-10,opendatasus
1828,SP,350710,BOM JESUS DOS PERDŐES,12/02/2018,2018-02-12,opendatasus
1829,SP,350760,BRAGANÇA PAULISTA,17/03/2017,2017-03-17,opendatasus
1830,SP,350760,BRAGANÇA PAULISTA,17/04/2017,2017-04-17,opendatasus
1831,SP,350760,BRAGANÇA PAULISTA,20/04/2017,2017-04-20,opendatasus
1832,SP,350760,BRAGANÇA PAULISTA,24/04/2017,2017-04-24,opendatasus
1833,SP,350760,BRAGANÇA PAULISTA,25/04/2017,2017-04-25,opendatasus
1834,SP,350760,BRAGANÇA PAULISTA,27/04/2017,2017-04-27,opendatasus
1835,SP,350760,BRAGANÇA PAULISTA,03/05/2017,2017-05-03,opendatasus
1836,SP,350760,BRAGANÇA PAULISTA,11/05/2017,2017-05-11,opendatasus
1837,SP,350760,BRAGANÇA PAULISTA,15/05/2017,2017-05-15,opendatasus
1838,SP,350760,BRAGANÇA PAULISTA,01/06/2017,2017-06-01,opendatasus
1839,SP,350760,BRAGANÇA PAULISTA,14/06/2017,2017-06-14,opendatasus
1840,SP,350760,BRAGANÇA PAULISTA,22/06/2017,2017-06-22,opendatasus
1841,SP,350760,BRAGANÇA PAULISTA,23/06/2017,2017-06-23,opendatasus
1842,SP,350760,BRAGANÇA PAULISTA,26/06/2017,2017-06-26,opendatasus
1843,SP,350760,BRAGANÇA PAULISTA,18/07/2017,2017-07-18,opendatasus
1844,SP,350760,BRAGANÇA PAULISTA,03/08/2017,2017-08-03,opendatasus
1845,SP,350760,BRAGANÇA PAULISTA,06/09/2017,2017-09-06,opendatasus
1846,SP,350760,BRAGANÇA PAULISTA,12/09/2017,2017-09-12,opendatasus
1847,SP,350760,BRAGANÇA PAULISTA,21/09/2017,2017-09-21,opendatasus
1848,SP,350760,BRAGANÇA PAULISTA,03/10/2017,2017-10-03,opendatasus
1849,SP,350760,BRAGANÇA PAULISTA,10/10/2017,2017-10-10,opendatasus
1850,SP,350760,BRAGANÇA PAULISTA,11/10/2017,2017-10-11,opendatasus
1851,SP,350760,BRAGANÇA PAULISTA,18/10/2017,2017-10-18,opendatasus
1852,SP,350760,BRAGANÇA PAULISTA,19/10/2017,2017-10-19,opendatasus
1853,SP,350760,BRAGANÇA PAULISTA,24/10/2017,2017-10-24,opendatasus
1854,SP,350760,BRAGANÇA PAULISTA,25/10/2017,2017-10-25,opendatasus
1855,SP,350760,BRAGANÇA PAULISTA,01/11/2017,2017-11-01,opendatasus
1856,SP,350760,BRAGANÇA PAULISTA,05/12/2017,2017-12-05,opendatasus
1857,SP,350760,BRAGANÇA PAULISTA,19/01/2018,2018-01-19,opendatasus
1858,SP,350760,BRAGANÇA PAULISTA,25/02/2018,2018-02-25,opendatasus
1859,SP,350850,CAÇAPAVA,14/03/2018,2018-03-14,opendatasus
1860,SP,350850,CAÇAPAVA,16/03/2018,2018-03-16,opendatasus
1861,SP,350860,CACHOEIRA PAULISTA,07/05/2018,2018-05-07,opendatasus
1862,SP,350860,CACHOEIRA PAULISTA,27/04/2019,2019-04-27,opendatasus
1863,SP,350900,CAIEIRAS,31/10/2017,2017-10-31,opendatasus
1864,SP,350900,CAIEIRAS,04/11/2017,2017-11-04,opendatasus
1865,SP,350900,CAIEIRAS,05/11/2017,2017-11-05,opendatasus
1866,SP,350900,CAIEIRAS,07/11/2017,2017-11-07,opendatasus
1867,SP,350900,CAIEIRAS,08/11/2017,2017-11-08,opendatasus
1868,SP,350900,CAIEIRAS,09/11/2017,2017-11-09,opendatasus
1869,SP,350900,CAIEIRAS,13/11/2017,2017-11-13,opendatasus
1870,SP,350900,CAIEIRAS,15/11/2017,2017-11-15,opendatasus
1871,SP,350900,CAIEIRAS,22/11/2017,2017-11-22,opendatasus
1872,SP,350900,CAIEIRAS,29/11/2017,2017-11-29,opendatasus
1873,SP,350900,CAIEIRAS,27/12/2017,2017-12-27,opendatasus
1874,SP,350900,CAIEIRAS,29/12/2017,2017-12-29,opendatasus
1875,SP,350900,CAIEIRAS,06/01/2018,2018-01-06,opendatasus
1876,SP,350920,CAJAMAR,20/10/2017,2017-10-20,opendatasus
1877,SP,350925,CAJATI,08/01/2019,2019-01-08,opendatasus
1878,SP,350925,CAJATI,14/01/2019,2019-01-14,opendatasus
1879,SP,350925,CAJATI,21/01/2019,2019-01-21,opendatasus
1880,SP,350925,CAJATI,01/02/2019,2019-02-01,opendatasus
1881,SP,350925,CAJATI,10/02/2019,2019-02-10,opendatasus
1882,SP,350930,CAJOBI,16/10/2016,2016-10-16,opendatasus
1883,SP,350950,CAMPINAS,21/03/2017,2017-03-21,opendatasus
1884,SP,350950,CAMPINAS,28/03/2017,2017-03-28,opendatasus
1885,SP,350950,CAMPINAS,31/03/2017,2017-03-31,opendatasus
1886,SP,350950,CAMPINAS,02/04/2017,2017-04-02,opendatasus
1887,SP,350950,CAMPINAS,27/08/2017,2017-08-27,opendatasus
1888,SP,350950,CAMPINAS,31/08/2017,2017-08-31,opendatasus
1889,SP,350950,CAMPINAS,12/09/2017,2017-09-12,opendatasus
1890,SP,350950,CAMPINAS,20/03/2019,2019-03-20,opendatasus
1891,SP,350960,CAMPO LIMPO PAULISTA,18/09/2017,2017-09-18,opendatasus
1892,SP,350960,CAMPO LIMPO PAULISTA,11/10/2017,2017-10-11,opendatasus
1893,SP,350960,CAMPO LIMPO PAULISTA,18/10/2017,2017-10-18,opendatasus
1894,SP,350960,CAMPO LIMPO PAULISTA,19/10/2017,2017-10-19,opendatasus
1895,SP,350960,CAMPO LIMPO PAULISTA,20/10/2017,2017-10-20,opendatasus
1896,SP,350960,CAMPO LIMPO PAULISTA,23/10/2017,2017-10-23,opendatasus
1897,SP,350960,CAMPO LIMPO PAULISTA,25/10/2017,2017-10-25,opendatasus
1898,SP,350960,CAMPO LIMPO PAULISTA,30/10/2017,2017-10-30,opendatasus
1899,SP,350960,CAMPO LIMPO PAULISTA,31/10/2017,2017-10-31,opendatasus
1900,SP,350960,CAMPO LIMPO PAULISTA,14/01/2018,2018-01-14,opendatasus
1901,SP,350960,CAMPO LIMPO PAULISTA,18/01/2018,2018-01-18,opendatasus
1902,SP,350960,CAMPO LIMPO PAULISTA,24/01/2018,2018-01-24,opendatasus
1903,SP,350960,CAMPO LIMPO PAULISTA,26/01/2018,2018-01-26,opendatasus
1904,SP,350960,CAMPO LIMPO PAULISTA,02/03/2018,2018-03-02,opendatasus
1905,SP,350970,CAMPOS DO JORDĂO,15/03/2018,2018-03-15,opendatasus
1906,SP,350990,CANANÉIA,01/01/2019,2019-01-01,opendatasus
1907,SP,350990,CANANÉIA,15/01/2019,2019-01-15,opendatasus
1908,SP,350990,CANANÉIA,16/01/2019,2019-01-16,opendatasus
1909,SP,350990,CANANÉIA,18/01/2019,2019-01-18,opendatasus
1910,SP,351030,CAPELA DO ALTO,07/02/2018,2018-02-07,opendatasus
1911,SP,351050,CARAGUATATUBA,15/06/2018,2018-06-15,opendatasus
1912,SP,351050,CARAGUATATUBA,20/07/2018,2018-07-20,opendatasus
1913,SP,351050,CARAGUATATUBA,10/08/2018,2018-08-10,opendatasus
1914,SP,351050,CARAGUATATUBA,15/08/2018,2018-08-15,opendatasus
1915,SP,351050,CARAGUATATUBA,20/10/2018,2018-10-20,opendatasus
1916,SP,351110,CATANDUVA,11/11/2016,2016-11-11,opendatasus
1917,SP,351110,CATANDUVA,14/11/2016,2016-11-14,opendatasus
1918,SP,351120,CATIGUÁ,11/11/2016,2016-11-11,opendatasus
1919,SP,351120,CATIGUÁ,05/12/2016,2016-12-05,opendatasus
1920,SP,351120,CATIGUÁ,12/12/2016,2016-12-12,opendatasus
1921,SP,351300,COTIA,21/12/2017,2017-12-21,opendatasus
1922,SP,351300,COTIA,05/01/2018,2018-01-05,opendatasus
1923,SP,351300,COTIA,07/01/2018,2018-01-07,opendatasus
1924,SP,351300,COTIA,13/01/2018,2018-01-13,opendatasus
1925,SP,351300,COTIA,15/01/2018,2018-01-15,opendatasus
1926,SP,351300,COTIA,26/01/2018,2018-01-26,opendatasus
1927,SP,351300,COTIA,02/02/2018,2018-02-02,opendatasus
1928,SP,351300,COTIA,12/02/2018,2018-02-12,opendatasus
1929,SP,351300,COTIA,25/02/2018,2018-02-25,opendatasus
1930,SP,351300,COTIA,01/03/2018,2018-03-01,opendatasus
1931,SP,351300,COTIA,09/03/2018,2018-03-09,opendatasus
1932,SP,351300,COTIA,02/05/2018,2018-05-02,opendatasus
1933,SP,351480,ELDORADO,11/12/2018,2018-12-11,opendatasus
1934,SP,351480,ELDORADO,26/12/2018,2018-12-26,opendatasus
1935,SP,351480,ELDORADO,04/01/2019,2019-01-04,opendatasus
1936,SP,351480,ELDORADO,06/01/2019,2019-01-06,opendatasus
1937,SP,351480,ELDORADO,07/01/2019,2019-01-07,opendatasus
1938,SP,351480,ELDORADO,08/01/2019,2019-01-08,opendatasus
1939,SP,351480,ELDORADO,10/01/2019,2019-01-10,opendatasus
1940,SP,351480,ELDORADO,12/01/2019,2019-01-12,opendatasus
1941,SP,351480,ELDORADO,13/01/2019,2019-01-13,opendatasus
1942,SP,351480,ELDORADO,14/01/2019,2019-01-14,opendatasus
1943,SP,351480,ELDORADO,15/01/2019,2019-01-15,opendatasus
1944,SP,351480,ELDORADO,21/01/2019,2019-01-21,opendatasus
1945,SP,351480,ELDORADO,23/01/2019,2019-01-23,opendatasus
1946,SP,351480,ELDORADO,31/01/2019,2019-01-31,opendatasus
1947,SP,351500,EMBU DAS ARTES,26/01/2018,2018-01-26,opendatasus
1948,SP,351500,EMBU DAS ARTES,01/03/2018,2018-03-01,opendatasus
1949,SP,351510,EMBU-GUAÇU,04/01/2018,2018-01-04,opendatasus
1950,SP,351510,EMBU-GUAÇU,18/01/2018,2018-01-18,opendatasus
1951,SP,351510,EMBU-GUAÇU,22/01/2018,2018-01-22,opendatasus
1952,SP,351510,EMBU-GUAÇU,26/01/2018,2018-01-26,opendatasus
1953,SP,351510,EMBU-GUAÇU,27/01/2018,2018-01-27,opendatasus
1954,SP,351510,EMBU-GUAÇU,02/02/2018,2018-02-02,opendatasus
1955,SP,351510,EMBU-GUAÇU,23/02/2018,2018-02-23,opendatasus
1956,SP,351510,EMBU-GUAÇU,26/02/2018,2018-02-26,opendatasus
1957,SP,351510,EMBU-GUAÇU,01/03/2018,2018-03-01,opendatasus
1958,SP,351510,EMBU-GUAÇU,02/03/2018,2018-03-02,opendatasus
1959,SP,351510,EMBU-GUAÇU,06/03/2018,2018-03-06,opendatasus
1960,SP,351510,EMBU-GUAÇU,10/03/2018,2018-03-10,opendatasus
1961,SP,351510,EMBU-GUAÇU,11/03/2018,2018-03-11,opendatasus
1962,SP,351510,EMBU-GUAÇU,14/03/2018,2018-03-14,opendatasus
1963,SP,351510,EMBU-GUAÇU,15/03/2018,2018-03-15,opendatasus
1964,SP,351510,EMBU-GUAÇU,19/03/2018,2018-03-19,opendatasus
1965,SP,351510,EMBU-GUAÇU,18/05/2018,2018-05-18,opendatasus
1966,SP,351518,ESPÍRITO SANTO DO PINHAL,10/04/2017,2017-04-10,opendatasus
1967,SP,351518,ESPÍRITO SANTO DO PINHAL,19/01/2018,2018-01-19,opendatasus
1968,SP,351518,ESPÍRITO SANTO DO PINHAL,20/01/2018,2018-01-20,opendatasus
1969,SP,351518,ESPÍRITO SANTO DO PINHAL,09/02/2018,2018-02-09,opendatasus
1970,SP,351550,FERNANDÓPOLIS,08/12/2016,2016-12-08,opendatasus
1971,SP,351550,FERNANDÓPOLIS,13/03/2017,2017-03-13,opendatasus
1972,SP,351630,FRANCISCO MORATO,12/01/2018,2018-01-12,opendatasus
1973,SP,351630,FRANCISCO MORATO,14/01/2018,2018-01-14,opendatasus
1974,SP,351630,FRANCISCO MORATO,01/02/2018,2018-02-01,opendatasus
1975,SP,351640,FRANCO DA ROCHA,10/11/2017,2017-11-10,opendatasus
1976,SP,351640,FRANCO DA ROCHA,28/12/2017,2017-12-28,opendatasus
1977,SP,351640,FRANCO DA ROCHA,07/01/2018,2018-01-07,opendatasus
1978,SP,351640,FRANCO DA ROCHA,10/01/2018,2018-01-10,opendatasus
1979,SP,351640,FRANCO DA ROCHA,20/01/2018,2018-01-20,opendatasus
1980,SP,351640,FRANCO DA ROCHA,31/01/2018,2018-01-31,opendatasus
1981,SP,351640,FRANCO DA ROCHA,25/02/2018,2018-02-25,opendatasus
1982,SP,351640,FRANCO DA ROCHA,28/03/2018,2018-03-28,opendatasus
1983,SP,351640,FRANCO DA ROCHA,15/04/2018,2018-04-15,opendatasus
1984,SP,351870,GUARUJÁ,25/03/2018,2018-03-25,opendatasus
1985,SP,351880,GUARULHOS,28/11/2017,2017-11-28,opendatasus
1986,SP,351880,GUARULHOS,11/12/2017,2017-12-11,opendatasus
1987,SP,351880,GUARULHOS,19/12/2017,2017-12-19,opendatasus
1988,SP,351880,GUARULHOS,05/01/2018,2018-01-05,opendatasus
1989,SP,351880,GUARULHOS,10/01/2018,2018-01-10,opendatasus
1990,SP,351880,GUARULHOS,17/01/2018,2018-01-17,opendatasus
1991,SP,351880,GUARULHOS,18/01/2018,2018-01-18,opendatasus
1992,SP,351880,GUARULHOS,21/01/2018,2018-01-21,opendatasus
1993,SP,351880,GUARULHOS,28/01/2018,2018-01-28,opendatasus
1994,SP,351880,GUARULHOS,29/01/2018,2018-01-29,opendatasus
1995,SP,351880,GUARULHOS,30/01/2018,2018-01-30,opendatasus
1996,SP,351880,GUARULHOS,31/01/2018,2018-01-31,opendatasus
1997,SP,351880,GUARULHOS,01/02/2018,2018-02-01,opendatasus
1998,SP,351880,GUARULHOS,06/02/2018,2018-02-06,opendatasus
1999,SP,351880,GUARULHOS,13/02/2018,2018-02-13,opendatasus
2000,SP,351880,GUARULHOS,15/02/2018,2018-02-15,opendatasus
2001,SP,351880,GUARULHOS,17/02/2018,2018-02-17,opendatasus
2002,SP,351880,GUARULHOS,19/02/2018,2018-02-19,opendatasus
2003,SP,351880,GUARULHOS,23/02/2018,2018-02-23,opendatasus
2004,SP,351880,GUARULHOS,25/02/2018,2018-02-25,opendatasus
2005,SP,351880,GUARULHOS,26/02/2018,2018-02-26,opendatasus
2006,SP,351880,GUARULHOS,28/02/2018,2018-02-28,opendatasus
2007,SP,351880,GUARULHOS,02/03/2018,2018-03-02,opendatasus
2008,SP,351880,GUARULHOS,04/03/2018,2018-03-04,opendatasus
2009,SP,351880,GUARULHOS,07/03/2018,2018-03-07,opendatasus
2010,SP,351880,GUARULHOS,09/03/2018,2018-03-09,opendatasus
2011,SP,351880,GUARULHOS,22/03/2018,2018-03-22,opendatasus
2012,SP,351940,IBIRÁ,10/10/2016,2016-10-10,opendatasus
2013,SP,351970,IBIÚNA,15/12/2017,2017-12-15,opendatasus
2014,SP,351970,IBIÚNA,04/01/2018,2018-01-04,opendatasus
2015,SP,351970,IBIÚNA,06/01/2018,2018-01-06,opendatasus
2016,SP,351970,IBIÚNA,08/01/2018,2018-01-08,opendatasus
2017,SP,351970,IBIÚNA,10/01/2018,2018-01-10,opendatasus
2018,SP,351970,IBIÚNA,12/01/2018,2018-01-12,opendatasus
2019,SP,351970,IBIÚNA,14/01/2018,2018-01-14,opendatasus
2020,SP,351970,IBIÚNA,15/01/2018,2018-01-15,opendatasus
2021,SP,351970,IBIÚNA,17/01/2018,2018-01-17,opendatasus
2022,SP,351970,IBIÚNA,21/01/2018,2018-01-21,opendatasus
2023,SP,351970,IBIÚNA,26/01/2018,2018-01-26,opendatasus
2024,SP,351970,IBIÚNA,31/01/2018,2018-01-31,opendatasus
2025,SP,351970,IBIÚNA,01/02/2018,2018-02-01,opendatasus
2026,SP,351970,IBIÚNA,07/02/2018,2018-02-07,opendatasus
2027,SP,351970,IBIÚNA,08/02/2018,2018-02-08,opendatasus
2028,SP,351970,IBIÚNA,09/02/2018,2018-02-09,opendatasus
2029,SP,351970,IBIÚNA,15/02/2018,2018-02-15,opendatasus
2030,SP,351970,IBIÚNA,16/02/2018,2018-02-16,opendatasus
2031,SP,351970,IBIÚNA,28/02/2018,2018-02-28,opendatasus
2032,SP,351970,IBIÚNA,01/03/2018,2018-03-01,opendatasus
2033,SP,351970,IBIÚNA,06/03/2018,2018-03-06,opendatasus
2034,SP,351970,IBIÚNA,10/03/2018,2018-03-10,opendatasus
2035,SP,351970,IBIÚNA,11/03/2018,2018-03-11,opendatasus
2036,SP,351970,IBIÚNA,19/03/2018,2018-03-19,opendatasus
2037,SP,351970,IBIÚNA,24/03/2018,2018-03-24,opendatasus
2038,SP,352020,IGARATÁ,13/12/2017,2017-12-13,opendatasus
2039,SP,352020,IGARATÁ,09/01/2018,2018-01-09,opendatasus
2040,SP,352020,IGARATÁ,28/01/2018,2018-01-28,opendatasus
2041,SP,352020,IGARATÁ,14/02/2018,2018-02-14,opendatasus
2042,SP,352020,IGARATÁ,19/03/2018,2018-03-19,opendatasus
2043,SP,352030,IGUAPE,03/03/2018,2018-03-03,opendatasus
2044,SP,352030,IGUAPE,10/03/2018,2018-03-10,opendatasus
2045,SP,352030,IGUAPE,11/03/2018,2018-03-11,opendatasus
2046,SP,352030,IGUAPE,04/04/2018,2018-04-04,opendatasus
2047,SP,352030,IGUAPE,17/04/2018,2018-04-17,opendatasus
2048,SP,352050,INDAIATUBA,28/12/2017,2017-12-28,opendatasus
2049,SP,352120,IPORANGA,31/12/2018,2018-12-31,opendatasus
2050,SP,352120,IPORANGA,03/01/2019,2019-01-03,opendatasus
2051,SP,352120,IPORANGA,06/01/2019,2019-01-06,opendatasus
2052,SP,352120,IPORANGA,14/01/2019,2019-01-14,opendatasus
2053,SP,352120,IPORANGA,15/01/2019,2019-01-15,opendatasus
2054,SP,352120,IPORANGA,16/01/2019,2019-01-16,opendatasus
2055,SP,352120,IPORANGA,18/01/2019,2019-01-18,opendatasus
2056,SP,352120,IPORANGA,27/01/2019,2019-01-27,opendatasus
2057,SP,352120,IPORANGA,05/02/2019,2019-02-05,opendatasus
2058,SP,352120,IPORANGA,13/02/2019,2019-02-13,opendatasus
2059,SP,352120,IPORANGA,25/02/2019,2019-02-25,opendatasus
2060,SP,352120,IPORANGA,06/03/2019,2019-03-06,opendatasus
2061,SP,352120,IPORANGA,12/03/2019,2019-03-12,opendatasus
2062,SP,352210,ITANHAÉM,21/01/2018,2018-01-21,opendatasus
2063,SP,352210,ITANHAÉM,21/03/2018,2018-03-21,opendatasus
2064,SP,352215,ITAÓCA,22/02/2019,2019-02-22,opendatasus
2065,SP,352220,ITAPECERICA DA SERRA,24/11/2017,2017-11-24,opendatasus
2066,SP,352220,ITAPECERICA DA SERRA,29/11/2017,2017-11-29,opendatasus
2067,SP,352220,ITAPECERICA DA SERRA,30/11/2017,2017-11-30,opendatasus
2068,SP,352220,ITAPECERICA DA SERRA,04/12/2017,2017-12-04,opendatasus
2069,SP,352220,ITAPECERICA DA SERRA,05/12/2017,2017-12-05,opendatasus
2070,SP,352220,ITAPECERICA DA SERRA,06/12/2017,2017-12-06,opendatasus
2071,SP,352220,ITAPECERICA DA SERRA,11/12/2017,2017-12-11,opendatasus
2072,SP,352220,ITAPECERICA DA SERRA,15/12/2017,2017-12-15,opendatasus
2073,SP,352220,ITAPECERICA DA SERRA,16/12/2017,2017-12-16,opendatasus
2074,SP,352220,ITAPECERICA DA SERRA,18/12/2017,2017-12-18,opendatasus
2075,SP,352220,ITAPECERICA DA SERRA,19/12/2017,2017-12-19,opendatasus
2076,SP,352220,ITAPECERICA DA SERRA,20/12/2017,2017-12-20,opendatasus
2077,SP,352220,ITAPECERICA DA SERRA,21/12/2017,2017-12-21,opendatasus
2078,SP,352220,ITAPECERICA DA SERRA,26/12/2017,2017-12-26,opendatasus
2079,SP,352220,ITAPECERICA DA SERRA,27/12/2017,2017-12-27,opendatasus
2080,SP,352220,ITAPECERICA DA SERRA,02/01/2018,2018-01-02,opendatasus
2081,SP,352220,ITAPECERICA DA SERRA,03/01/2018,2018-01-03,opendatasus
2082,SP,352220,ITAPECERICA DA SERRA,04/01/2018,2018-01-04,opendatasus
2083,SP,352220,ITAPECERICA DA SERRA,06/01/2018,2018-01-06,opendatasus
2084,SP,352220,ITAPECERICA DA SERRA,07/01/2018,2018-01-07,opendatasus
2085,SP,352220,ITAPECERICA DA SERRA,08/01/2018,2018-01-08,opendatasus
2086,SP,352220,ITAPECERICA DA SERRA,10/01/2018,2018-01-10,opendatasus
2087,SP,352220,ITAPECERICA DA SERRA,11/01/2018,2018-01-11,opendatasus
2088,SP,352220,ITAPECERICA DA SERRA,12/01/2018,2018-01-12,opendatasus
2089,SP,352220,ITAPECERICA DA SERRA,16/01/2018,2018-01-16,opendatasus
2090,SP,352220,ITAPECERICA DA SERRA,17/01/2018,2018-01-17,opendatasus
2091,SP,352220,ITAPECERICA DA SERRA,21/01/2018,2018-01-21,opendatasus
2092,SP,352220,ITAPECERICA DA SERRA,22/01/2018,2018-01-22,opendatasus
2093,SP,352220,ITAPECERICA DA SERRA,26/01/2018,2018-01-26,opendatasus
2094,SP,352220,ITAPECERICA DA SERRA,01/02/2018,2018-02-01,opendatasus
2095,SP,352220,ITAPECERICA DA SERRA,06/02/2018,2018-02-06,opendatasus
2096,SP,352230,ITAPETININGA,20/03/2018,2018-03-20,opendatasus
2097,SP,352230,ITAPETININGA,27/04/2018,2018-04-27,opendatasus
2098,SP,352230,ITAPETININGA,11/04/2019,2019-04-11,opendatasus
2099,SP,352230,ITAPETININGA,24/05/2019,2019-05-24,opendatasus
2100,SP,352240,ITAPEVA,15/01/2019,2019-01-15,opendatasus
2101,SP,352260,ITAPIRA,24/03/2018,2018-03-24,opendatasus
2102,SP,352330,ITARIRI,12/02/2018,2018-02-12,opendatasus
2103,SP,352330,ITARIRI,24/02/2018,2018-02-24,opendatasus
2104,SP,352330,ITARIRI,02/03/2018,2018-03-02,opendatasus
2105,SP,352330,ITARIRI,04/03/2018,2018-03-04,opendatasus
2106,SP,352330,ITARIRI,13/03/2018,2018-03-13,opendatasus
2107,SP,352330,ITARIRI,19/03/2018,2018-03-19,opendatasus
2108,SP,352330,ITARIRI,20/03/2018,2018-03-20,opendatasus
2109,SP,352330,ITARIRI,25/03/2018,2018-03-25,opendatasus
2110,SP,352340,ITATIBA,30/08/2017,2017-08-30,opendatasus
2111,SP,352340,ITATIBA,14/09/2017,2017-09-14,opendatasus
2112,SP,352340,ITATIBA,18/09/2017,2017-09-18,opendatasus
2113,SP,352340,ITATIBA,19/09/2017,2017-09-19,opendatasus
2114,SP,352340,ITATIBA,20/09/2017,2017-09-20,opendatasus
2115,SP,352340,ITATIBA,21/09/2017,2017-09-21,opendatasus
2116,SP,352340,ITATIBA,22/09/2017,2017-09-22,opendatasus
2117,SP,352340,ITATIBA,23/09/2017,2017-09-23,opendatasus
2118,SP,352340,ITATIBA,26/09/2017,2017-09-26,opendatasus
2119,SP,352340,ITATIBA,27/09/2017,2017-09-27,opendatasus
2120,SP,352340,ITATIBA,02/10/2017,2017-10-02,opendatasus
2121,SP,352340,ITATIBA,19/10/2017,2017-10-19,opendatasus
2122,SP,352340,ITATIBA,25/10/2017,2017-10-25,opendatasus
2123,SP,352340,ITATIBA,27/10/2017,2017-10-27,opendatasus
2124,SP,352340,ITATIBA,24/01/2018,2018-01-24,opendatasus
2125,SP,352340,ITATIBA,25/01/2018,2018-01-25,opendatasus
2126,SP,352340,LONDRINA,01/04/2018,2018-04-01,opendatasus
2127,SP,352340,NATAL,07/04/2018,2018-04-07,opendatasus
2128,SP,352390,ITU,31/01/2018,2018-01-31,opendatasus
2129,SP,352400,ITUPEVA,18/02/2018,2018-02-18,opendatasus
2130,SP,352400,ITUPEVA,05/09/2019,2019-09-05,opendatasus
2131,SP,352430,JABOTICABAL,26/10/2016,2016-10-26,opendatasus
2132,SP,352430,JABOTICABAL,07/12/2016,2016-12-07,opendatasus
2133,SP,352430,JABOTICABAL,11/12/2016,2016-12-11,opendatasus
2134,SP,352440,JACAREÍ,14/01/2018,2018-01-14,opendatasus
2135,SP,352460,JACUPIRANGA,21/12/2018,2018-12-21,opendatasus
2136,SP,352460,JACUPIRANGA,26/01/2019,2019-01-26,opendatasus
2137,SP,352460,JACUPIRANGA,02/02/2019,2019-02-02,opendatasus
2138,SP,352460,JACUPIRANGA,13/02/2019,2019-02-13,opendatasus
2139,SP,352460,JACUPIRANGA,14/02/2019,2019-02-14,opendatasus
2140,SP,352510,JARDINÓPOLIS,13/12/2016,2016-12-13,opendatasus
2141,SP,352520,JARINU,09/10/2017,2017-10-09,opendatasus
2142,SP,352520,JARINU,18/10/2017,2017-10-18,opendatasus
2143,SP,352520,JARINU,19/10/2017,2017-10-19,opendatasus
2144,SP,352520,JARINU,20/10/2017,2017-10-20,opendatasus
2145,SP,352520,JARINU,23/10/2017,2017-10-23,opendatasus
2146,SP,352520,JARINU,25/10/2017,2017-10-25,opendatasus
2147,SP,352520,JARINU,26/10/2017,2017-10-26,opendatasus
2148,SP,352520,JARINU,29/10/2017,2017-10-29,opendatasus
2149,SP,352520,JARINU,30/10/2017,2017-10-30,opendatasus
2150,SP,352520,JARINU,31/10/2017,2017-10-31,opendatasus
2151,SP,352520,JARINU,01/11/2017,2017-11-01,opendatasus
2152,SP,352520,JARINU,05/11/2017,2017-11-05,opendatasus
2153,SP,352520,JARINU,06/11/2017,2017-11-06,opendatasus
2154,SP,352520,JARINU,24/12/2017,2017-12-24,opendatasus
2155,SP,352520,JARINU,03/01/2018,2018-01-03,opendatasus
2156,SP,352520,JARINU,05/01/2018,2018-01-05,opendatasus
2157,SP,352520,JARINU,07/01/2018,2018-01-07,opendatasus
2158,SP,352520,JARINU,15/01/2018,2018-01-15,opendatasus
2159,SP,352520,JARINU,20/01/2018,2018-01-20,opendatasus
2160,SP,352520,JARINU,25/01/2018,2018-01-25,opendatasus
2161,SP,352520,JARINU,26/01/2018,2018-01-26,opendatasus
2162,SP,352520,JARINU,31/01/2018,2018-01-31,opendatasus
2163,SP,352520,JARINU,09/03/2018,2018-03-09,opendatasus
2164,SP,352520,JARINU,13/03/2018,2018-03-13,opendatasus
2165,SP,352550,JOANÓPOLIS,19/03/2018,2018-03-19,opendatasus
2166,SP,352550,JOANÓPOLIS,27/03/2018,2018-03-27,opendatasus
2167,SP,352590,JUNDIAÍ,27/07/2017,2017-07-27,opendatasus
2168,SP,352590,JUNDIAÍ,11/09/2017,2017-09-11,opendatasus
2169,SP,352590,JUNDIAÍ,12/09/2017,2017-09-12,opendatasus
2170,SP,352590,JUNDIAÍ,14/09/2017,2017-09-14,opendatasus
2171,SP,352590,JUNDIAÍ,15/09/2017,2017-09-15,opendatasus
2172,SP,352590,JUNDIAÍ,18/09/2017,2017-09-18,opendatasus
2173,SP,352590,JUNDIAÍ,20/09/2017,2017-09-20,opendatasus
2174,SP,352590,JUNDIAÍ,21/09/2017,2017-09-21,opendatasus
2175,SP,352590,JUNDIAÍ,22/09/2017,2017-09-22,opendatasus
2176,SP,352590,JUNDIAÍ,23/09/2017,2017-09-23,opendatasus
2177,SP,352590,JUNDIAÍ,25/09/2017,2017-09-25,opendatasus
2178,SP,352590,JUNDIAÍ,26/09/2017,2017-09-26,opendatasus
2179,SP,352590,JUNDIAÍ,27/09/2017,2017-09-27,opendatasus
2180,SP,352590,JUNDIAÍ,28/09/2017,2017-09-28,opendatasus
2181,SP,352590,JUNDIAÍ,29/09/2017,2017-09-29,opendatasus
2182,SP,352590,JUNDIAÍ,02/10/2017,2017-10-02,opendatasus
2183,SP,352590,JUNDIAÍ,04/10/2017,2017-10-04,opendatasus
2184,SP,352590,JUNDIAÍ,05/10/2017,2017-10-05,opendatasus
2185,SP,352590,JUNDIAÍ,06/10/2017,2017-10-06,opendatasus
2186,SP,352590,JUNDIAÍ,09/10/2017,2017-10-09,opendatasus
2187,SP,352590,JUNDIAÍ,10/10/2017,2017-10-10,opendatasus
2188,SP,352590,JUNDIAÍ,11/10/2017,2017-10-11,opendatasus
2189,SP,352590,JUNDIAÍ,13/10/2017,2017-10-13,opendatasus
2190,SP,352590,JUNDIAÍ,16/10/2017,2017-10-16,opendatasus
2191,SP,352590,JUNDIAÍ,17/10/2017,2017-10-17,opendatasus
2192,SP,352590,JUNDIAÍ,18/10/2017,2017-10-18,opendatasus
2193,SP,352590,JUNDIAÍ,19/10/2017,2017-10-19,opendatasus
2194,SP,352590,JUNDIAÍ,21/10/2017,2017-10-21,opendatasus
2195,SP,352590,JUNDIAÍ,24/10/2017,2017-10-24,opendatasus
2196,SP,352590,JUNDIAÍ,06/11/2017,2017-11-06,opendatasus
2197,SP,352590,JUNDIAÍ,07/11/2017,2017-11-07,opendatasus
2198,SP,352590,JUNDIAÍ,08/11/2017,2017-11-08,opendatasus
2199,SP,352590,JUNDIAÍ,23/11/2017,2017-11-23,opendatasus
2200,SP,352590,JUNDIAÍ,19/01/2018,2018-01-19,opendatasus
2201,SP,352590,JUNDIAÍ,21/03/2018,2018-03-21,opendatasus
2202,SP,352610,JUQUIÁ,27/02/2018,2018-02-27,opendatasus
2203,SP,352610,JUQUIÁ,28/02/2018,2018-02-28,opendatasus
2204,SP,352610,JUQUIÁ,30/01/2019,2019-01-30,opendatasus
2205,SP,352620,JUQUITIBA,20/02/2018,2018-02-20,opendatasus
2206,SP,352620,JUQUITIBA,03/03/2018,2018-03-03,opendatasus
2207,SP,352620,JUQUITIBA,08/03/2018,2018-03-08,opendatasus
2208,SP,352730,LOUVEIRA,04/06/2017,2017-06-04,opendatasus
2209,SP,352730,LOUVEIRA,23/06/2017,2017-06-23,opendatasus
2210,SP,352730,LOUVEIRA,03/07/2017,2017-07-03,opendatasus
2211,SP,352730,LOUVEIRA,07/07/2017,2017-07-07,opendatasus
2212,SP,352730,LOUVEIRA,17/07/2017,2017-07-17,opendatasus
2213,SP,352730,LOUVEIRA,20/07/2017,2017-07-20,opendatasus
2214,SP,352730,LOUVEIRA,24/07/2017,2017-07-24,opendatasus
2215,SP,352730,LOUVEIRA,01/08/2017,2017-08-01,opendatasus
2216,SP,352730,LOUVEIRA,17/08/2017,2017-08-17,opendatasus
2217,SP,352730,LOUVEIRA,30/08/2017,2017-08-30,opendatasus
2218,SP,352730,LOUVEIRA,01/09/2017,2017-09-01,opendatasus
2219,SP,352730,LOUVEIRA,03/09/2017,2017-09-03,opendatasus
2220,SP,352730,LOUVEIRA,04/09/2017,2017-09-04,opendatasus
2221,SP,352730,LOUVEIRA,05/09/2017,2017-09-05,opendatasus
2222,SP,352730,LOUVEIRA,11/09/2017,2017-09-11,opendatasus
2223,SP,352730,LOUVEIRA,25/09/2017,2017-09-25,opendatasus
2224,SP,352840,MAIRINQUE,23/11/2017,2017-11-23,opendatasus
2225,SP,352840,MAIRINQUE,24/11/2017,2017-11-24,opendatasus
2226,SP,352840,MAIRINQUE,11/12/2017,2017-12-11,opendatasus
2227,SP,352850,MAIRIPORĂ,21/10/2017,2017-10-21,opendatasus
2228,SP,352850,MAIRIPORĂ,23/10/2017,2017-10-23,opendatasus
2229,SP,352850,MAIRIPORĂ,25/10/2017,2017-10-25,opendatasus
2230,SP,352850,MAIRIPORĂ,26/10/2017,2017-10-26,opendatasus
2231,SP,352850,MAIRIPORĂ,27/10/2017,2017-10-27,opendatasus
2232,SP,352850,MAIRIPORĂ,29/10/2017,2017-10-29,opendatasus
2233,SP,352850,MAIRIPORĂ,31/10/2017,2017-10-31,opendatasus
2234,SP,352850,MAIRIPORĂ,03/11/2017,2017-11-03,opendatasus
2235,SP,352850,MAIRIPORĂ,04/11/2017,2017-11-04,opendatasus
2236,SP,352850,MAIRIPORĂ,08/11/2017,2017-11-08,opendatasus
2237,SP,352850,MAIRIPORĂ,09/11/2017,2017-11-09,opendatasus
2238,SP,352850,MAIRIPORĂ,10/11/2017,2017-11-10,opendatasus
2239,SP,352850,MAIRIPORĂ,11/11/2017,2017-11-11,opendatasus
2240,SP,352850,MAIRIPORĂ,14/11/2017,2017-11-14,opendatasus
2241,SP,352850,MAIRIPORĂ,15/11/2017,2017-11-15,opendatasus
2242,SP,352850,MAIRIPORĂ,16/11/2017,2017-11-16,opendatasus
2243,SP,352850,MAIRIPORĂ,17/11/2017,2017-11-17,opendatasus
2244,SP,352850,MAIRIPORĂ,19/11/2017,2017-11-19,opendatasus
2245,SP,352850,MAIRIPORĂ,20/11/2017,2017-11-20,opendatasus
2246,SP,352850,MAIRIPORĂ,21/11/2017,2017-11-21,opendatasus
2247,SP,352850,MAIRIPORĂ,22/11/2017,2017-11-22,opendatasus
2248,SP,352850,MAIRIPORĂ,23/11/2017,2017-11-23,opendatasus
2249,SP,352850,MAIRIPORĂ,24/11/2017,2017-11-24,opendatasus
2250,SP,352850,MAIRIPORĂ,25/11/2017,2017-11-25,opendatasus
2251,SP,352850,MAIRIPORĂ,26/11/2017,2017-11-26,opendatasus
2252,SP,352850,MAIRIPORĂ,27/11/2017,2017-11-27,opendatasus
2253,SP,352850,MAIRIPORĂ,28/11/2017,2017-11-28,opendatasus
2254,SP,352850,MAIRIPORĂ,29/11/2017,2017-11-29,opendatasus
2255,SP,352850,MAIRIPORĂ,30/11/2017,2017-11-30,opendatasus
2256,SP,352850,MAIRIPORĂ,01/12/2017,2017-12-01,opendatasus
2257,SP,352850,MAIRIPORĂ,02/12/2017,2017-12-02,opendatasus
2258,SP,352850,MAIRIPORĂ,04/12/2017,2017-12-04,opendatasus
2259,SP,352850,MAIRIPORĂ,05/12/2017,2017-12-05,opendatasus
2260,SP,352850,MAIRIPORĂ,06/12/2017,2017-12-06,opendatasus
2261,SP,352850,MAIRIPORĂ,07/12/2017,2017-12-07,opendatasus
2262,SP,352850,MAIRIPORĂ,08/12/2017,2017-12-08,opendatasus
2263,SP,352850,MAIRIPORĂ,09/12/2017,2017-12-09,opendatasus
2264,SP,352850,MAIRIPORĂ,10/12/2017,2017-12-10,opendatasus
2265,SP,352850,MAIRIPORĂ,12/12/2017,2017-12-12,opendatasus
2266,SP,352850,MAIRIPORĂ,13/12/2017,2017-12-13,opendatasus
2267,SP,352850,MAIRIPORĂ,14/12/2017,2017-12-14,opendatasus
2268,SP,352850,MAIRIPORĂ,17/12/2017,2017-12-17,opendatasus
2269,SP,352850,MAIRIPORĂ,19/12/2017,2017-12-19,opendatasus
2270,SP,352850,MAIRIPORĂ,20/12/2017,2017-12-20,opendatasus
2271,SP,352850,MAIRIPORĂ,21/12/2017,2017-12-21,opendatasus
2272,SP,352850,MAIRIPORĂ,23/12/2017,2017-12-23,opendatasus
2273,SP,352850,MAIRIPORĂ,24/12/2017,2017-12-24,opendatasus
2274,SP,352850,MAIRIPORĂ,25/12/2017,2017-12-25,opendatasus
2275,SP,352850,MAIRIPORĂ,26/12/2017,2017-12-26,opendatasus
2276,SP,352850,MAIRIPORĂ,27/12/2017,2017-12-27,opendatasus
2277,SP,352850,MAIRIPORĂ,28/12/2017,2017-12-28,opendatasus
2278,SP,352850,MAIRIPORĂ,29/12/2017,2017-12-29,opendatasus
2279,SP,352850,MAIRIPORĂ,30/12/2017,2017-12-30,opendatasus
2280,SP,352850,MAIRIPORĂ,31/12/2017,2017-12-31,opendatasus
2281,SP,352850,MAIRIPORĂ,01/01/2018,2018-01-01,opendatasus
2282,SP,352850,MAIRIPORĂ,02/01/2018,2018-01-02,opendatasus
2283,SP,352850,MAIRIPORĂ,03/01/2018,2018-01-03,opendatasus
2284,SP,352850,MAIRIPORĂ,04/01/2018,2018-01-04,opendatasus
2285,SP,352850,MAIRIPORĂ,05/01/2018,2018-01-05,opendatasus
2286,SP,352850,MAIRIPORĂ,06/01/2018,2018-01-06,opendatasus
2287,SP,352850,MAIRIPORĂ,07/01/2018,2018-01-07,opendatasus
2288,SP,352850,MAIRIPORĂ,08/01/2018,2018-01-08,opendatasus
2289,SP,352850,MAIRIPORĂ,09/01/2018,2018-01-09,opendatasus
2290,SP,352850,MAIRIPORĂ,10/01/2018,2018-01-10,opendatasus
2291,SP,352850,MAIRIPORĂ,11/01/2018,2018-01-11,opendatasus
2292,SP,352850,MAIRIPORĂ,13/01/2018,2018-01-13,opendatasus
2293,SP,352850,MAIRIPORĂ,14/01/2018,2018-01-14,opendatasus
2294,SP,352850,MAIRIPORĂ,15/01/2018,2018-01-15,opendatasus
2295,SP,352850,MAIRIPORĂ,16/01/2018,2018-01-16,opendatasus
2296,SP,352850,MAIRIPORĂ,17/01/2018,2018-01-17,opendatasus
2297,SP,352850,MAIRIPORĂ,18/01/2018,2018-01-18,opendatasus
2298,SP,352850,MAIRIPORĂ,19/01/2018,2018-01-19,opendatasus
2299,SP,352850,MAIRIPORĂ,20/01/2018,2018-01-20,opendatasus
2300,SP,352850,MAIRIPORĂ,21/01/2018,2018-01-21,opendatasus
2301,SP,352850,MAIRIPORĂ,22/01/2018,2018-01-22,opendatasus
2302,SP,352850,MAIRIPORĂ,23/01/2018,2018-01-23,opendatasus
2303,SP,352850,MAIRIPORĂ,24/01/2018,2018-01-24,opendatasus
2304,SP,352850,MAIRIPORĂ,25/01/2018,2018-01-25,opendatasus
2305,SP,352850,MAIRIPORĂ,26/01/2018,2018-01-26,opendatasus
2306,SP,352850,MAIRIPORĂ,27/01/2018,2018-01-27,opendatasus
2307,SP,352850,MAIRIPORĂ,28/01/2018,2018-01-28,opendatasus
2308,SP,352850,MAIRIPORĂ,29/01/2018,2018-01-29,opendatasus
2309,SP,352850,MAIRIPORĂ,30/01/2018,2018-01-30,opendatasus
2310,SP,352850,MAIRIPORĂ,31/01/2018,2018-01-31,opendatasus
2311,SP,352850,MAIRIPORĂ,01/02/2018,2018-02-01,opendatasus
2312,SP,352850,MAIRIPORĂ,04/02/2018,2018-02-04,opendatasus
2313,SP,352850,MAIRIPORĂ,09/02/2018,2018-02-09,opendatasus
2314,SP,352850,MAIRIPORĂ,10/02/2018,2018-02-10,opendatasus
2315,SP,352850,MAIRIPORĂ,13/02/2018,2018-02-13,opendatasus
2316,SP,352850,MAIRIPORĂ,14/02/2018,2018-02-14,opendatasus
2317,SP,352850,MAIRIPORĂ,15/02/2018,2018-02-15,opendatasus
2318,SP,352850,MAIRIPORĂ,16/02/2018,2018-02-16,opendatasus
2319,SP,352850,MAIRIPORĂ,17/02/2018,2018-02-17,opendatasus
2320,SP,352850,MAIRIPORĂ,20/02/2018,2018-02-20,opendatasus
2321,SP,352850,MAIRIPORĂ,23/02/2018,2018-02-23,opendatasus
2322,SP,352850,MAIRIPORĂ,27/02/2018,2018-02-27,opendatasus
2323,SP,352850,MAIRIPORĂ,28/02/2018,2018-02-28,opendatasus
2324,SP,352850,MAIRIPORĂ,01/03/2018,2018-03-01,opendatasus
2325,SP,352850,MAIRIPORĂ,03/03/2018,2018-03-03,opendatasus
2326,SP,352850,MAIRIPORĂ,04/03/2018,2018-03-04,opendatasus
2327,SP,352850,MAIRIPORĂ,05/03/2018,2018-03-05,opendatasus
2328,SP,352850,MAIRIPORĂ,06/03/2018,2018-03-06,opendatasus
2329,SP,352850,MAIRIPORĂ,07/03/2018,2018-03-07,opendatasus
2330,SP,352850,MAIRIPORĂ,09/03/2018,2018-03-09,opendatasus
2331,SP,352850,MAIRIPORĂ,14/03/2018,2018-03-14,opendatasus
2332,SP,352850,MAIRIPORĂ,08/04/2018,2018-04-08,opendatasus
2333,SP,352885,MARAPOAMA,25/11/2016,2016-11-25,opendatasus
2334,SP,352885,MARAPOAMA,28/12/2016,2016-12-28,opendatasus
2335,SP,352990,MIRACATU,15/02/2018,2018-02-15,opendatasus
2336,SP,352990,MIRACATU,20/02/2018,2018-02-20,opendatasus
2337,SP,352990,MIRACATU,23/02/2018,2018-02-23,opendatasus
2338,SP,352990,MIRACATU,03/03/2018,2018-03-03,opendatasus
2339,SP,352990,MIRACATU,04/03/2018,2018-03-04,opendatasus
2340,SP,352990,MIRACATU,10/03/2018,2018-03-10,opendatasus
2341,SP,352990,MIRACATU,17/03/2018,2018-03-17,opendatasus
2342,SP,353050,MOCOCA,30/01/2017,2017-01-30,opendatasus
2343,SP,353080,MOGI MIRIM,24/02/2018,2018-02-24,opendatasus
2344,SP,353120,MONTE ALEGRE DO SUL,09/03/2017,2017-03-09,opendatasus
2345,SP,353120,MONTE ALEGRE DO SUL,13/03/2017,2017-03-13,opendatasus
2346,SP,353120,MONTE ALEGRE DO SUL,16/03/2017,2017-03-16,opendatasus
2347,SP,353120,MONTE ALEGRE DO SUL,17/03/2017,2017-03-17,opendatasus
2348,SP,353120,MONTE ALEGRE DO SUL,18/03/2017,2017-03-18,opendatasus
2349,SP,353120,MONTE ALEGRE DO SUL,22/03/2017,2017-03-22,opendatasus
2350,SP,353120,MONTE ALEGRE DO SUL,23/03/2017,2017-03-23,opendatasus
2351,SP,353120,MONTE ALEGRE DO SUL,27/03/2017,2017-03-27,opendatasus
2352,SP,353120,MONTE ALEGRE DO SUL,28/03/2017,2017-03-28,opendatasus
2353,SP,353120,MONTE ALEGRE DO SUL,05/04/2017,2017-04-05,opendatasus
2354,SP,353120,MONTE ALEGRE DO SUL,06/04/2017,2017-04-06,opendatasus
2355,SP,353120,MONTE ALEGRE DO SUL,06/05/2017,2017-05-06,opendatasus
2356,SP,353120,MONTE ALEGRE DO SUL,16/02/2018,2018-02-16,opendatasus
2357,SP,353120,MONTE ALEGRE DO SUL,01/03/2018,2018-03-01,opendatasus
2358,SP,353130,MONTE ALTO,28/10/2016,2016-10-28,opendatasus
2359,SP,353170,MONTEIRO LOBATO,14/03/2018,2018-03-14,opendatasus
2360,SP,353170,MONTEIRO LOBATO,16/03/2018,2018-03-16,opendatasus
2361,SP,353170,MONTEIRO LOBATO,20/03/2018,2018-03-20,opendatasus
2362,SP,353170,MONTEIRO LOBATO,21/03/2018,2018-03-21,opendatasus
2363,SP,353170,MONTEIRO LOBATO,28/03/2018,2018-03-28,opendatasus
2364,SP,353170,MONTEIRO LOBATO,31/03/2018,2018-03-31,opendatasus
2365,SP,353170,MONTEIRO LOBATO,02/04/2018,2018-04-02,opendatasus
2366,SP,353170,MONTEIRO LOBATO,08/04/2018,2018-04-08,opendatasus
2367,SP,353170,MONTEIRO LOBATO,09/04/2018,2018-04-09,opendatasus
2368,SP,353170,MONTEIRO LOBATO,11/04/2018,2018-04-11,opendatasus
2369,SP,353190,MORRO AGUDO,22/11/2016,2016-11-22,opendatasus
2370,SP,353200,MORUNGABA,28/10/2017,2017-10-28,opendatasus
2371,SP,353200,MORUNGABA,01/03/2018,2018-03-01,opendatasus
2372,SP,353230,NATIVIDADE DA SERRA,09/02/2018,2018-02-09,opendatasus
2373,SP,353240,NAZARÉ PAULISTA,25/10/2017,2017-10-25,opendatasus
2374,SP,353240,NAZARÉ PAULISTA,10/11/2017,2017-11-10,opendatasus
2375,SP,353240,NAZARÉ PAULISTA,13/11/2017,2017-11-13,opendatasus
2376,SP,353240,NAZARÉ PAULISTA,24/11/2017,2017-11-24,opendatasus
2377,SP,353240,NAZARÉ PAULISTA,09/12/2017,2017-12-09,opendatasus
2378,SP,353240,NAZARÉ PAULISTA,27/12/2017,2017-12-27,opendatasus
2379,SP,353240,NAZARÉ PAULISTA,02/01/2018,2018-01-02,opendatasus
2380,SP,353240,NAZARÉ PAULISTA,04/01/2018,2018-01-04,opendatasus
2381,SP,353240,NAZARÉ PAULISTA,07/01/2018,2018-01-07,opendatasus
2382,SP,353240,NAZARÉ PAULISTA,14/01/2018,2018-01-14,opendatasus
2383,SP,353240,NAZARÉ PAULISTA,17/01/2018,2018-01-17,opendatasus
2384,SP,353240,NAZARÉ PAULISTA,19/01/2018,2018-01-19,opendatasus
2385,SP,353240,NAZARÉ PAULISTA,20/01/2018,2018-01-20,opendatasus
2386,SP,353240,NAZARÉ PAULISTA,25/01/2018,2018-01-25,opendatasus
2387,SP,353240,NAZARÉ PAULISTA,26/01/2018,2018-01-26,opendatasus
2388,SP,353240,NAZARÉ PAULISTA,28/01/2018,2018-01-28,opendatasus
2389,SP,353240,NAZARÉ PAULISTA,03/02/2018,2018-02-03,opendatasus
2390,SP,353240,NAZARÉ PAULISTA,06/02/2018,2018-02-06,opendatasus
2391,SP,353240,NAZARÉ PAULISTA,09/02/2018,2018-02-09,opendatasus
2392,SP,353240,NAZARÉ PAULISTA,13/02/2018,2018-02-13,opendatasus
2393,SP,353240,NAZARÉ PAULISTA,14/02/2018,2018-02-14,opendatasus
2394,SP,353240,NAZARÉ PAULISTA,24/02/2018,2018-02-24,opendatasus
2395,SP,353240,NAZARÉ PAULISTA,04/03/2018,2018-03-04,opendatasus
2396,SP,353240,NAZARÉ PAULISTA,06/03/2018,2018-03-06,opendatasus
2397,SP,353240,NAZARÉ PAULISTA,10/03/2018,2018-03-10,opendatasus
2398,SP,353240,NAZARÉ PAULISTA,23/03/2018,2018-03-23,opendatasus
2399,SP,353240,NAZARÉ PAULISTA,25/03/2018,2018-03-25,opendatasus
2400,SP,353240,NAZARÉ PAULISTA,28/03/2018,2018-03-28,opendatasus
2401,SP,353240,NAZARÉ PAULISTA,26/04/2018,2018-04-26,opendatasus
2402,SP,353620,PARIQUERA-AÇU,11/01/2019,2019-01-11,opendatasus
2403,SP,353620,PARIQUERA-AÇU,22/01/2019,2019-01-22,opendatasus
2404,SP,353620,PARIQUERA-AÇU,09/02/2019,2019-02-09,opendatasus
2405,SP,353620,PARIQUERA-AÇU,17/02/2019,2019-02-17,opendatasus
2406,SP,353620,PARIQUERA-AÇU,18/02/2019,2019-02-18,opendatasus
2407,SP,353620,PARIQUERA-AÇU,27/02/2019,2019-02-27,opendatasus
2408,SP,353620,PARIQUERA-AÇU,09/03/2019,2019-03-09,opendatasus
2409,SP,353620,PARIQUERA-AÇU,03/05/2019,2019-05-03,opendatasus
2410,SP,353680,PEDRA BELA,03/05/2017,2017-05-03,opendatasus
2411,SP,353720,PEDRO DE TOLEDO,15/02/2018,2018-02-15,opendatasus
2412,SP,353720,PEDRO DE TOLEDO,09/03/2018,2018-03-09,opendatasus
2413,SP,353760,PERUÍBE,15/03/2018,2018-03-15,opendatasus
2414,SP,353760,PERUÍBE,19/03/2018,2018-03-19,opendatasus
2415,SP,353780,PIEDADE,11/12/2017,2017-12-11,opendatasus
2416,SP,353780,PIEDADE,14/12/2017,2017-12-14,opendatasus
2417,SP,353780,PIEDADE,07/01/2018,2018-01-07,opendatasus
2418,SP,353780,PIEDADE,12/01/2018,2018-01-12,opendatasus
2419,SP,353780,PIEDADE,20/01/2018,2018-01-20,opendatasus
2420,SP,353780,PIEDADE,25/01/2018,2018-01-25,opendatasus
2421,SP,353780,PIEDADE,31/01/2018,2018-01-31,opendatasus
2422,SP,353780,PIEDADE,08/02/2018,2018-02-08,opendatasus
2423,SP,353780,PIEDADE,24/02/2018,2018-02-24,opendatasus
2424,SP,353780,PIEDADE,05/03/2018,2018-03-05,opendatasus
2425,SP,353780,PIEDADE,06/03/2018,2018-03-06,opendatasus
2426,SP,353790,PILAR DO SUL,31/01/2018,2018-01-31,opendatasus
2427,SP,353790,PILAR DO SUL,19/02/2018,2018-02-19,opendatasus
2428,SP,353790,PILAR DO SUL,25/02/2018,2018-02-25,opendatasus
2429,SP,353790,PILAR DO SUL,10/03/2018,2018-03-10,opendatasus
2430,SP,353790,PILAR DO SUL,19/03/2018,2018-03-19,opendatasus
2431,SP,353800,PINDAMONHANGABA,17/03/2018,2018-03-17,opendatasus
2432,SP,353810,PINDORAMA,13/10/2016,2016-10-13,opendatasus
2433,SP,353810,PINDORAMA,07/11/2016,2016-11-07,opendatasus
2434,SP,353820,PINHALZINHO,25/03/2017,2017-03-25,opendatasus
2435,SP,353820,PINHALZINHO,02/04/2017,2017-04-02,opendatasus
2436,SP,353820,PINHALZINHO,04/04/2017,2017-04-04,opendatasus
2437,SP,353820,PINHALZINHO,07/04/2017,2017-04-07,opendatasus
2438,SP,353820,PINHALZINHO,10/04/2017,2017-04-10,opendatasus
2439,SP,353820,PINHALZINHO,16/04/2017,2017-04-16,opendatasus
2440,SP,353820,PINHALZINHO,17/04/2017,2017-04-17,opendatasus
2441,SP,353820,PINHALZINHO,19/04/2017,2017-04-19,opendatasus
2442,SP,353820,PINHALZINHO,27/04/2017,2017-04-27,opendatasus
2443,SP,353820,PINHALZINHO,09/05/2017,2017-05-09,opendatasus
2444,SP,353820,PINHALZINHO,10/03/2018,2018-03-10,opendatasus
2445,SP,353860,PIRACAIA,28/04/2017,2017-04-28,opendatasus
2446,SP,353860,PIRACAIA,03/10/2017,2017-10-03,opendatasus
2447,SP,353860,PIRACAIA,11/10/2017,2017-10-11,opendatasus
2448,SP,353860,PIRACAIA,16/10/2017,2017-10-16,opendatasus
2449,SP,353860,PIRACAIA,24/10/2017,2017-10-24,opendatasus
2450,SP,353860,PIRACAIA,26/10/2017,2017-10-26,opendatasus
2451,SP,353860,PIRACAIA,28/10/2017,2017-10-28,opendatasus
2452,SP,353860,PIRACAIA,29/10/2017,2017-10-29,opendatasus
2453,SP,353860,PIRACAIA,08/01/2018,2018-01-08,opendatasus
2454,SP,353860,PIRACAIA,08/02/2018,2018-02-08,opendatasus
2455,SP,353860,PIRACAIA,12/02/2018,2018-02-12,opendatasus
2456,SP,353860,PIRACAIA,26/02/2018,2018-02-26,opendatasus
2457,SP,353860,PIRACAIA,04/03/2018,2018-03-04,opendatasus
2458,SP,353860,PIRACAIA,05/03/2018,2018-03-05,opendatasus
2459,SP,353860,PIRACAIA,06/03/2018,2018-03-06,opendatasus
2460,SP,353860,PIRACAIA,13/03/2018,2018-03-13,opendatasus
2461,SP,353860,PIRACAIA,02/04/2018,2018-04-02,opendatasus
2462,SP,353870,PIRACICABA,28/12/2017,2017-12-28,opendatasus
2463,SP,353870,PIRACICABA,18/01/2018,2018-01-18,opendatasus
2464,SP,353980,POÁ,17/01/2018,2018-01-17,opendatasus
2465,SP,354060,PORTO FELIZ,18/01/2018,2018-01-18,opendatasus
2466,SP,354080,POTIRENDABA,07/10/2016,2016-10-07,opendatasus
2467,SP,354260,REGISTRO,07/01/2019,2019-01-07,opendatasus
2468,SP,354260,REGISTRO,21/01/2019,2019-01-21,opendatasus
2469,SP,354260,REGISTRO,14/02/2019,2019-02-14,opendatasus
2470,SP,354280,RIBEIRA,23/02/2019,2019-02-23,opendatasus
2471,SP,354300,RIBEIRĂO BRANCO,21/03/2019,2019-03-21,opendatasus
2472,SP,354340,RIBEIRĂO PRETO,18/12/2016,2016-12-18,opendatasus
2473,SP,354340,RIBEIRĂO PRETO,21/01/2017,2017-01-21,opendatasus
2474,SP,354340,RIBEIRĂO PRETO,23/01/2017,2017-01-23,opendatasus
2475,SP,354530,SALTO DE PIRAPORA,23/01/2018,2018-01-23,opendatasus
2476,SP,354530,SALTO DE PIRAPORA,16/02/2018,2018-02-16,opendatasus
2477,SP,354640,SANTA CRUZ DO RIO PARDO,19/01/2017,2017-01-19,opendatasus
2478,SP,354680,SANTA ISABEL,20/01/2018,2018-01-20,opendatasus
2479,SP,354680,SANTA ISABEL,25/01/2018,2018-01-25,opendatasus
2480,SP,354680,SANTA ISABEL,12/02/2018,2018-02-12,opendatasus
2481,SP,354680,SANTA ISABEL,13/02/2018,2018-02-13,opendatasus
2482,SP,354680,SANTA ISABEL,15/02/2018,2018-02-15,opendatasus
2483,SP,354680,SANTA ISABEL,18/02/2018,2018-02-18,opendatasus
2484,SP,354680,SANTA ISABEL,19/02/2018,2018-02-19,opendatasus
2485,SP,354680,SANTA ISABEL,21/02/2018,2018-02-21,opendatasus
2486,SP,354680,SANTA ISABEL,26/02/2018,2018-02-26,opendatasus
2487,SP,354680,SANTA ISABEL,04/03/2018,2018-03-04,opendatasus
2488,SP,354680,SANTA ISABEL,09/03/2018,2018-03-09,opendatasus
2489,SP,354680,SANTA ISABEL,20/03/2018,2018-03-20,opendatasus
2490,SP,354690,SANTA LÚCIA,31/12/2016,2016-12-31,opendatasus
2491,SP,354750,SANTA RITA DO PASSA QUATRO,08/05/2018,2018-05-08,opendatasus
2492,SP,354780,SANTO ANDRÉ,22/01/2018,2018-01-22,opendatasus
2493,SP,354860,SĂO BENTO DO SAPUCAÍ,16/02/2018,2018-02-16,opendatasus
2494,SP,354860,SĂO BENTO DO SAPUCAÍ,23/03/2018,2018-03-23,opendatasus
2495,SP,354870,SĂO BERNARDO DO CAMPO,26/01/2018,2018-01-26,opendatasus
2496,SP,354870,SĂO BERNARDO DO CAMPO,21/02/2018,2018-02-21,opendatasus
2497,SP,354880,SĂO CAETANO DO SUL,31/01/2018,2018-01-31,opendatasus
2498,SP,354880,SĂO CAETANO DO SUL,28/03/2018,2018-03-28,opendatasus
2499,SP,354910,SĂO JOĂO DA BOA VISTA,19/04/2017,2017-04-19,opendatasus
2500,SP,354910,SĂO JOĂO DA BOA VISTA,31/01/2018,2018-01-31,opendatasus
2501,SP,354910,SĂO JOĂO DA BOA VISTA,25/04/2023,2023-04-25,opendatasus
2502,SP,354980,SĂO JOSÉ DO RIO PRETO,25/08/2016,2016-08-25,opendatasus
2503,SP,354980,SĂO JOSÉ DO RIO PRETO,23/01/2017,2017-01-23,opendatasus
2504,SP,354980,SĂO JOSÉ DO RIO PRETO,29/01/2018,2018-01-29,opendatasus
2505,SP,354980,SĂO JOSÉ DO RIO PRETO,18/03/2018,2018-03-18,opendatasus
2506,SP,354980,SĂO JOSÉ DO RIO PRETO,24/09/2020,2020-09-24,opendatasus
2507,SP,354990,SĂO JOSÉ DOS CAMPOS,31/01/2018,2018-01-31,opendatasus
2508,SP,354990,SĂO JOSÉ DOS CAMPOS,09/02/2018,2018-02-09,opendatasus
2509,SP,354990,SĂO JOSÉ DOS CAMPOS,14/02/2018,2018-02-14,opendatasus
2510,SP,354990,SĂO JOSÉ DOS CAMPOS,15/02/2018,2018-02-15,opendatasus
2511,SP,354990,SĂO JOSÉ DOS CAMPOS,26/02/2018,2018-02-26,opendatasus
2512,SP,354990,SĂO JOSÉ DOS CAMPOS,28/02/2018,2018-02-28,opendatasus
2513,SP,354990,SĂO JOSÉ DOS CAMPOS,02/03/2018,2018-03-02,opendatasus
2514,SP,354990,SĂO JOSÉ DOS CAMPOS,06/03/2018,2018-03-06,opendatasus
2515,SP,354990,SĂO JOSÉ DOS CAMPOS,09/03/2018,2018-03-09,opendatasus
2516,SP,354990,SĂO JOSÉ DOS CAMPOS,10/03/2018,2018-03-10,opendatasus
2517,SP,354990,SĂO JOSÉ DOS CAMPOS,26/03/2018,2018-03-26,opendatasus
2518,SP,354990,SĂO JOSÉ DOS CAMPOS,04/05/2018,2018-05-04,opendatasus
2519,SP,354995,SĂO LOURENÇO DA SERRA,03/01/2018,2018-01-03,opendatasus
2520,SP,354995,SĂO LOURENÇO DA SERRA,10/01/2018,2018-01-10,opendatasus
2521,SP,354995,SĂO LOURENÇO DA SERRA,22/01/2018,2018-01-22,opendatasus
2522,SP,354995,SĂO LOURENÇO DA SERRA,05/03/2018,2018-03-05,opendatasus
2523,SP,355020,SĂO MIGUEL ARCANJO,05/02/2018,2018-02-05,opendatasus
2524,SP,355020,SĂO MIGUEL ARCANJO,10/02/2018,2018-02-10,opendatasus
2525,SP,355020,SĂO MIGUEL ARCANJO,25/03/2018,2018-03-25,opendatasus
2526,SP,355020,SĂO MIGUEL ARCANJO,13/05/2018,2018-05-13,opendatasus
2527,SP,355020,SĂO MIGUEL ARCANJO,16/05/2018,2018-05-16,opendatasus
2528,SP,355030,SĂO PAULO,04/10/2017,2017-10-04,opendatasus
2529,SP,355030,SĂO PAULO,06/10/2017,2017-10-06,opendatasus
2530,SP,355030,SĂO PAULO,11/10/2017,2017-10-11,opendatasus
2531,SP,355030,SĂO PAULO,16/10/2017,2017-10-16,opendatasus
2532,SP,355030,SĂO PAULO,17/10/2017,2017-10-17,opendatasus
2533,SP,355030,SĂO PAULO,03/12/2017,2017-12-03,opendatasus
2534,SP,355030,SĂO PAULO,05/12/2017,2017-12-05,opendatasus
2535,SP,355030,SĂO PAULO,06/12/2017,2017-12-06,opendatasus
2536,SP,355030,SĂO PAULO,07/12/2017,2017-12-07,opendatasus
2537,SP,355030,SĂO PAULO,10/12/2017,2017-12-10,opendatasus
2538,SP,355030,SĂO PAULO,11/12/2017,2017-12-11,opendatasus
2539,SP,355030,SĂO PAULO,13/12/2017,2017-12-13,opendatasus
2540,SP,355030,SĂO PAULO,14/12/2017,2017-12-14,opendatasus
2541,SP,355030,SĂO PAULO,16/12/2017,2017-12-16,opendatasus
2542,SP,355030,SĂO PAULO,17/12/2017,2017-12-17,opendatasus
2543,SP,355030,SĂO PAULO,18/12/2017,2017-12-18,opendatasus
2544,SP,355030,SĂO PAULO,19/12/2017,2017-12-19,opendatasus
2545,SP,355030,SĂO PAULO,20/12/2017,2017-12-20,opendatasus
2546,SP,355030,SĂO PAULO,21/12/2017,2017-12-21,opendatasus
2547,SP,355030,SĂO PAULO,22/12/2017,2017-12-22,opendatasus
2548,SP,355030,SĂO PAULO,23/12/2017,2017-12-23,opendatasus
2549,SP,355030,SĂO PAULO,25/12/2017,2017-12-25,opendatasus
2550,SP,355030,SĂO PAULO,26/12/2017,2017-12-26,opendatasus
2551,SP,355030,SĂO PAULO,27/12/2017,2017-12-27,opendatasus
2552,SP,355030,SĂO PAULO,28/12/2017,2017-12-28,opendatasus
2553,SP,355030,SĂO PAULO,29/12/2017,2017-12-29,opendatasus
2554,SP,355030,SĂO PAULO,30/12/2017,2017-12-30,opendatasus
2555,SP,355030,SĂO PAULO,31/12/2017,2017-12-31,opendatasus
2556,SP,355030,SĂO PAULO,02/01/2018,2018-01-02,opendatasus
2557,SP,355030,SĂO PAULO,03/01/2018,2018-01-03,opendatasus
2558,SP,355030,SĂO PAULO,04/01/2018,2018-01-04,opendatasus
2559,SP,355030,SĂO PAULO,08/01/2018,2018-01-08,opendatasus
2560,SP,355030,SĂO PAULO,09/01/2018,2018-01-09,opendatasus
2561,SP,355030,SĂO PAULO,11/01/2018,2018-01-11,opendatasus
2562,SP,355030,SĂO PAULO,12/01/2018,2018-01-12,opendatasus
2563,SP,355030,SĂO PAULO,14/01/2018,2018-01-14,opendatasus
2564,SP,355030,SĂO PAULO,15/01/2018,2018-01-15,opendatasus
2565,SP,355030,SĂO PAULO,16/01/2018,2018-01-16,opendatasus
2566,SP,355030,SĂO PAULO,17/01/2018,2018-01-17,opendatasus
2567,SP,355030,SĂO PAULO,18/01/2018,2018-01-18,opendatasus
2568,SP,355030,SĂO PAULO,19/01/2018,2018-01-19,opendatasus
2569,SP,355030,SĂO PAULO,20/01/2018,2018-01-20,opendatasus
2570,SP,355030,SĂO PAULO,21/01/2018,2018-01-21,opendatasus
2571,SP,355030,SĂO PAULO,23/01/2018,2018-01-23,opendatasus
2572,SP,355030,SĂO PAULO,24/01/2018,2018-01-24,opendatasus
2573,SP,355030,SĂO PAULO,25/01/2018,2018-01-25,opendatasus
2574,SP,355030,SĂO PAULO,26/01/2018,2018-01-26,opendatasus
2575,SP,355030,SĂO PAULO,27/01/2018,2018-01-27,opendatasus
2576,SP,355030,SĂO PAULO,28/01/2018,2018-01-28,opendatasus
2577,SP,355030,SĂO PAULO,29/01/2018,2018-01-29,opendatasus
2578,SP,355030,SĂO PAULO,30/01/2018,2018-01-30,opendatasus
2579,SP,355030,SĂO PAULO,01/02/2018,2018-02-01,opendatasus
2580,SP,355030,SĂO PAULO,02/02/2018,2018-02-02,opendatasus
2581,SP,355030,SĂO PAULO,04/02/2018,2018-02-04,opendatasus
2582,SP,355030,SĂO PAULO,05/02/2018,2018-02-05,opendatasus
2583,SP,355030,SĂO PAULO,10/02/2018,2018-02-10,opendatasus
2584,SP,355030,SĂO PAULO,13/02/2018,2018-02-13,opendatasus
2585,SP,355030,SĂO PAULO,15/02/2018,2018-02-15,opendatasus
2586,SP,355030,SĂO PAULO,18/02/2018,2018-02-18,opendatasus
2587,SP,355030,SĂO PAULO,19/02/2018,2018-02-19,opendatasus
2588,SP,355030,SĂO PAULO,22/02/2018,2018-02-22,opendatasus
2589,SP,355030,SĂO PAULO,01/03/2018,2018-03-01,opendatasus
2590,SP,355030,SĂO PAULO,02/03/2018,2018-03-02,opendatasus
2591,SP,355030,SĂO PAULO,03/03/2018,2018-03-03,opendatasus
2592,SP,355030,SĂO PAULO,07/03/2018,2018-03-07,opendatasus
2593,SP,355030,SĂO PAULO,08/03/2018,2018-03-08,opendatasus
2594,SP,355030,SĂO PAULO,12/03/2018,2018-03-12,opendatasus
2595,SP,355030,SĂO PAULO,13/03/2018,2018-03-13,opendatasus
2596,SP,355030,SĂO PAULO,14/03/2018,2018-03-14,opendatasus
2597,SP,355030,SĂO PAULO,20/03/2018,2018-03-20,opendatasus
2598,SP,355030,SĂO PAULO,25/03/2018,2018-03-25,opendatasus
2599,SP,355030,SĂO PAULO,27/03/2018,2018-03-27,opendatasus
2600,SP,355030,SĂO PAULO,09/04/2018,2018-04-09,opendatasus
2601,SP,355030,SĂO PAULO,10/04/2018,2018-04-10,opendatasus
2602,SP,355030,SĂO PAULO,14/04/2018,2018-04-14,opendatasus
2603,SP,355030,SĂO PAULO,15/04/2018,2018-04-15,opendatasus
2604,SP,355030,SĂO PAULO,17/04/2018,2018-04-17,opendatasus
2605,SP,355030,SĂO PAULO,22/04/2018,2018-04-22,opendatasus
2606,SP,355030,SĂO PAULO,04/05/2018,2018-05-04,opendatasus
2607,SP,355030,SĂO PAULO,18/05/2018,2018-05-18,opendatasus
2608,SP,355030,SĂO PAULO,25/05/2018,2018-05-25,opendatasus
2609,SP,355030,SĂO PAULO,08/06/2018,2018-06-08,opendatasus
2610,SP,355030,SĂO PAULO,11/06/2018,2018-06-11,opendatasus
2611,SP,355030,SĂO PAULO,12/09/2018,2018-09-12,opendatasus
2612,SP,355030,SĂO PAULO,23/11/2018,2018-11-23,opendatasus
2613,SP,355060,SĂO ROQUE,01/02/2017,2017-02-01,opendatasus
2614,SP,355060,SĂO ROQUE,31/10/2017,2017-10-31,opendatasus
2615,SP,355060,SĂO ROQUE,07/11/2017,2017-11-07,opendatasus
2616,SP,355060,SĂO ROQUE,14/11/2017,2017-11-14,opendatasus
2617,SP,355060,SĂO ROQUE,22/11/2017,2017-11-22,opendatasus
2618,SP,355060,SĂO ROQUE,28/11/2017,2017-11-28,opendatasus
2619,SP,355060,SĂO ROQUE,29/11/2017,2017-11-29,opendatasus
2620,SP,355060,SĂO ROQUE,05/12/2017,2017-12-05,opendatasus
2621,SP,355060,SĂO ROQUE,08/12/2017,2017-12-08,opendatasus
2622,SP,355060,SĂO ROQUE,12/12/2017,2017-12-12,opendatasus
2623,SP,355060,SĂO ROQUE,15/12/2017,2017-12-15,opendatasus
2624,SP,355060,SĂO ROQUE,19/12/2017,2017-12-19,opendatasus
2625,SP,355060,SĂO ROQUE,10/01/2018,2018-01-10,opendatasus
2626,SP,355060,SĂO ROQUE,14/01/2018,2018-01-14,opendatasus
2627,SP,355060,SĂO ROQUE,18/01/2018,2018-01-18,opendatasus
2628,SP,355060,SĂO ROQUE,18/02/2018,2018-02-18,opendatasus
2629,SP,355070,SĂO SEBASTIĂO,03/03/2018,2018-03-03,opendatasus
2630,SP,355070,SĂO SEBASTIĂO,01/04/2018,2018-04-01,opendatasus
2631,SP,355070,SĂO SEBASTIĂO,11/04/2018,2018-04-11,opendatasus
2632,SP,355070,SĂO SEBASTIĂO,14/04/2018,2018-04-14,opendatasus
2633,SP,355070,SĂO SEBASTIĂO,16/04/2018,2018-04-16,opendatasus
2634,SP,355070,SĂO SEBASTIĂO,17/04/2018,2018-04-17,opendatasus
2635,SP,355070,SĂO SEBASTIĂO,27/04/2018,2018-04-27,opendatasus
2636,SP,355070,SĂO SEBASTIĂO,30/04/2018,2018-04-30,opendatasus
2637,SP,355070,SĂO SEBASTIĂO,03/05/2018,2018-05-03,opendatasus
2638,SP,355070,SĂO SEBASTIĂO,05/06/2018,2018-06-05,opendatasus
2639,SP,355080,SĂO SEBASTIĂO DA GRAMA,16/02/2023,2023-02-16,opendatasus
2640,SP,355080,SĂO SEBASTIĂO DA GRAMA,18/02/2023,2023-02-18,opendatasus
2641,SP,355100,SĂO VICENTE,07/02/2018,2018-02-07,opendatasus
2642,SP,355110,SARAPUÍ,29/01/2018,2018-01-29,opendatasus
2643,SP,355110,SARAPUÍ,09/02/2018,2018-02-09,opendatasus
2644,SP,355110,SARAPUÍ,14/02/2018,2018-02-14,opendatasus
2645,SP,355110,SARAPUÍ,15/02/2018,2018-02-15,opendatasus
2646,SP,355110,SARAPUÍ,26/02/2018,2018-02-26,opendatasus
2647,SP,355110,SARAPUÍ,01/03/2018,2018-03-01,opendatasus
2648,SP,355110,SARAPUÍ,09/03/2018,2018-03-09,opendatasus
2649,SP,355110,SARAPUÍ,10/03/2018,2018-03-10,opendatasus
2650,SP,355160,SERRA NEGRA,10/01/2019,2019-01-10,opendatasus
2651,SP,355160,SERRA NEGRA,25/07/2019,2019-07-25,opendatasus
2652,SP,355180,SETE BARRAS,22/01/2019,2019-01-22,opendatasus
2653,SP,355180,SETE BARRAS,28/03/2019,2019-03-28,opendatasus
2654,SP,355190,SEVERÍNIA,28/10/2016,2016-10-28,opendatasus
2655,SP,355190,SEVERÍNIA,03/11/2016,2016-11-03,opendatasus
2656,SP,355200,SILVEIRAS,19/03/2018,2018-03-19,opendatasus
2657,SP,355210,SOCORRO,16/03/2017,2017-03-16,opendatasus
2658,SP,355210,SOCORRO,05/11/2017,2017-11-05,opendatasus
2659,SP,355220,SOROCABA,12/12/2017,2017-12-12,opendatasus
2660,SP,355250,SUZANO,13/03/2018,2018-03-13,opendatasus
2661,SP,355260,TABAPUĂ,12/12/2016,2016-12-12,opendatasus
2662,SP,355330,TAMBAÚ,20/02/2018,2018-02-20,opendatasus
2663,SP,355330,TAMBAÚ,26/03/2018,2018-03-26,opendatasus
2664,SP,355330,TAMBAÚ,04/04/2018,2018-04-04,opendatasus
2665,SP,355330,TAMBAÚ,01/05/2018,2018-05-01,opendatasus
2666,SP,355350,TAPIRAÍ,22/01/2018,2018-01-22,opendatasus
2667,SP,355350,TAPIRAÍ,25/01/2018,2018-01-25,opendatasus
2668,SP,355350,TAPIRAÍ,29/01/2018,2018-01-29,opendatasus
2669,SP,355350,TAPIRAÍ,31/01/2018,2018-01-31,opendatasus
2670,SP,355350,TAPIRAÍ,08/03/2018,2018-03-08,opendatasus
2671,SP,355385,TAQUARIVAÍ,25/06/2019,2019-06-25,opendatasus
2672,SP,355410,TAUBATÉ,29/12/2017,2017-12-29,opendatasus
2673,SP,355410,TAUBATÉ,21/03/2018,2018-03-21,opendatasus
2674,SP,355410,TAUBATÉ,25/03/2018,2018-03-25,opendatasus
2675,SP,355410,TAUBATÉ,09/04/2018,2018-04-09,opendatasus
2676,SP,355410,TAUBATÉ,01/05/2018,2018-05-01,opendatasus
2677,SP,355480,TREMEMBÉ,01/04/2018,2018-04-01,opendatasus
2678,SP,355495,TUIUTI,17/03/2017,2017-03-17,opendatasus
2679,SP,355495,TUIUTI,31/03/2017,2017-03-31,opendatasus
2680,SP,355495,TUIUTI,03/04/2017,2017-04-03,opendatasus
2681,SP,355495,TUIUTI,04/04/2017,2017-04-04,opendatasus
2682,SP,355495,TUIUTI,06/04/2017,2017-04-06,opendatasus
2683,SP,355495,TUIUTI,14/04/2017,2017-04-14,opendatasus
2684,SP,355495,TUIUTI,17/04/2017,2017-04-17,opendatasus
2685,SP,355495,TUIUTI,04/07/2017,2017-07-04,opendatasus
2686,SP,355495,TUIUTI,26/09/2017,2017-09-26,opendatasus
2687,SP,355540,UBATUBA,24/03/2018,2018-03-24,opendatasus
2688,SP,355540,UBATUBA,26/03/2018,2018-03-26,opendatasus
2689,SP,355540,UBATUBA,27/03/2018,2018-03-27,opendatasus
2690,SP,355540,UBATUBA,30/03/2018,2018-03-30,opendatasus
2691,SP,355540,UBATUBA,01/04/2018,2018-04-01,opendatasus
2692,SP,355540,UBATUBA,04/04/2018,2018-04-04,opendatasus
2693,SP,355540,UBATUBA,05/04/2018,2018-04-05,opendatasus
2694,SP,355540,UBATUBA,06/04/2018,2018-04-06,opendatasus
2695,SP,355540,UBATUBA,11/04/2018,2018-04-11,opendatasus
2696,SP,355540,UBATUBA,12/04/2018,2018-04-12,opendatasus
2697,SP,355620,VALINHOS,27/01/2018,2018-01-27,opendatasus
2698,SP,355620,VALINHOS,01/02/2018,2018-02-01,opendatasus
2699,SP,355620,VALINHOS,03/02/2018,2018-02-03,opendatasus
2700,SP,355620,VALINHOS,04/02/2018,2018-02-04,opendatasus
2701,SP,355620,VALINHOS,06/02/2018,2018-02-06,opendatasus
2702,SP,355620,VALINHOS,24/02/2018,2018-02-24,opendatasus
2703,SP,355620,VALINHOS,13/03/2018,2018-03-13,opendatasus
2704,SP,355620,VALINHOS,23/03/2018,2018-03-23,opendatasus
2705,SP,355640,VARGEM GRANDE DO SUL,27/12/2022,2022-12-27,opendatasus
2706,SP,355645,VARGEM GRANDE PAULISTA,21/12/2017,2017-12-21,opendatasus
2707,SP,355650,VÁRZEA PAULISTA,23/01/2018,2018-01-23,opendatasus
2708,SP,355650,VÁRZEA PAULISTA,06/03/2018,2018-03-06,opendatasus
2709,SP,355670,VINHEDO,27/04/2017,2017-04-27,opendatasus
2710,SP,355670,VINHEDO,29/04/2017,2017-04-29,opendatasus
2711,SP,355670,VINHEDO,13/05/2017,2017-05-13,opendatasus
2712,SP,355670,VINHEDO,17/05/2017,2017-05-17,opendatasus
2713,SP,355670,VINHEDO,22/05/2017,2017-05-22,opendatasus
2714,SP,355670,VINHEDO,10/06/2017,2017-06-10,opendatasus
2715,SP,355670,VINHEDO,11/06/2017,2017-06-11,opendatasus
2716,SP,355670,VINHEDO,14/06/2017,2017-06-14,opendatasus
2717,SP,355670,VINHEDO,21/06/2017,2017-06-21,opendatasus
2718,SP,355670,VINHEDO,16/08/2017,2017-08-16,opendatasus
2719,SP,355700,VOTORANTIM,02/01/2018,2018-01-02,opendatasus
2720,PR,410020,ADRIANÓPOLIS,22/01/2019,2019-01-22,opendatasus
2721,PR,410020,ADRIANÓPOLIS,31/01/2019,2019-01-31,opendatasus
2722,PR,410030,AGUDOS DO SUL,18/02/2020,2020-02-18,opendatasus
2723,PR,410030,AGUDOS DO SUL,19/02/2020,2020-02-19,opendatasus
2724,PR,410120,ANTONINA,22/01/2019,2019-01-22,opendatasus
2725,PR,410120,ANTONINA,18/02/2019,2019-02-18,opendatasus
2726,PR,410120,ANTONINA,09/03/2019,2019-03-09,opendatasus
2727,PR,410130,ANTÔNIO OLINTO,07/01/2020,2020-01-07,opendatasus
2728,PR,410130,ANTÔNIO OLINTO,10/01/2020,2020-01-10,opendatasus
2729,PR,410130,ANTÔNIO OLINTO,15/01/2020,2020-01-15,opendatasus
2730,PR,410130,ANTÔNIO OLINTO,16/01/2020,2020-01-16,opendatasus
2731,PR,410130,ANTÔNIO OLINTO,20/01/2020,2020-01-20,opendatasus
2732,PR,410130,ANTÔNIO OLINTO,21/01/2020,2020-01-21,opendatasus
2733,PR,410130,ANTÔNIO OLINTO,22/01/2020,2020-01-22,opendatasus
2734,PR,410130,ANTÔNIO OLINTO,23/01/2020,2020-01-23,opendatasus
2735,PR,410130,ANTÔNIO OLINTO,29/01/2020,2020-01-29,opendatasus
2736,PR,410130,ANTÔNIO OLINTO,03/02/2020,2020-02-03,opendatasus
2737,PR,410130,ANTÔNIO OLINTO,05/02/2020,2020-02-05,opendatasus
2738,PR,410130,ANTÔNIO OLINTO,06/02/2020,2020-02-06,opendatasus
2739,PR,410130,ANTÔNIO OLINTO,17/02/2020,2020-02-17,opendatasus
2740,PR,410130,ANTÔNIO OLINTO,18/02/2020,2020-02-18,opendatasus
2741,PR,410130,ANTÔNIO OLINTO,24/02/2020,2020-02-24,opendatasus
2742,PR,410130,ANTÔNIO OLINTO,05/03/2020,2020-03-05,opendatasus
2743,PR,410130,ANTÔNIO OLINTO,12/03/2020,2020-03-12,opendatasus
2744,PR,410180,ARAUCÁRIA,15/01/2020,2020-01-15,opendatasus
2745,PR,410180,ARAUCÁRIA,27/01/2020,2020-01-27,opendatasus
2746,PR,410180,ARAUCÁRIA,28/01/2020,2020-01-28,opendatasus
2747,PR,410180,ARAUCÁRIA,01/02/2020,2020-02-01,opendatasus
2748,PR,410180,ARAUCÁRIA,02/02/2020,2020-02-02,opendatasus
2749,PR,410180,ARAUCÁRIA,03/02/2020,2020-02-03,opendatasus
2750,PR,410180,ARAUCÁRIA,14/02/2020,2020-02-14,opendatasus
2751,PR,410180,ARAUCÁRIA,17/02/2020,2020-02-17,opendatasus
2752,PR,410180,ARAUCÁRIA,04/03/2020,2020-03-04,opendatasus
2753,PR,410180,ARAUCÁRIA,09/03/2020,2020-03-09,opendatasus
2754,PR,410180,ARAUCÁRIA,11/03/2020,2020-03-11,opendatasus
2755,PR,410180,ARAUCÁRIA,29/03/2020,2020-03-29,opendatasus
2756,PR,410230,BALSA NOVA,01/05/2019,2019-05-01,opendatasus
2757,PR,410230,BALSA NOVA,14/06/2019,2019-06-14,opendatasus
2758,PR,410230,BALSA NOVA,22/11/2019,2019-11-22,opendatasus
2759,PR,410230,BALSA NOVA,07/01/2020,2020-01-07,opendatasus
2760,PR,410230,BALSA NOVA,24/01/2020,2020-01-24,opendatasus
2761,PR,410230,BALSA NOVA,01/02/2020,2020-02-01,opendatasus
2762,PR,410230,BALSA NOVA,10/02/2020,2020-02-10,opendatasus
2763,PR,410230,BALSA NOVA,13/02/2020,2020-02-13,opendatasus
2764,PR,410230,BALSA NOVA,18/02/2020,2020-02-18,opendatasus
2765,PR,410230,BALSA NOVA,26/02/2020,2020-02-26,opendatasus
2766,PR,410230,BALSA NOVA,27/02/2020,2020-02-27,opendatasus
2767,PR,410230,BALSA NOVA,02/03/2020,2020-03-02,opendatasus
2768,PR,410230,BALSA NOVA,09/03/2020,2020-03-09,opendatasus
2769,PR,410290,BITURUNA,11/02/2020,2020-02-11,opendatasus
2770,PR,410290,BITURUNA,27/02/2020,2020-02-27,opendatasus
2771,PR,410290,BITURUNA,11/04/2020,2020-04-11,opendatasus
2772,PR,410290,BITURUNA,03/05/2020,2020-05-03,opendatasus
2773,PR,410304,BOA VENTURA DE SĂO ROQUE,20/01/2020,2020-01-20,opendatasus
2774,PR,410395,CAMPINA DO SIMĂO,09/01/2020,2020-01-09,opendatasus
2775,PR,410395,CAMPINA DO SIMĂO,29/01/2020,2020-01-29,opendatasus
2776,PR,410410,CAMPO DO TENENTE,23/01/2020,2020-01-23,opendatasus
2777,PR,410420,CAMPO LARGO,15/04/2019,2019-04-15,opendatasus
2778,PR,410420,CAMPO LARGO,17/04/2019,2019-04-17,opendatasus
2779,PR,410420,CAMPO LARGO,13/01/2020,2020-01-13,opendatasus
2780,PR,410420,CAMPO LARGO,28/02/2020,2020-02-28,opendatasus
2781,PR,410440,CÂNDIDO DE ABREU,06/01/2020,2020-01-06,opendatasus
2782,PR,410465,CARAMBEÍ,17/04/2019,2019-04-17,opendatasus
2783,PR,410465,CARAMBEÍ,23/04/2019,2019-04-23,opendatasus
2784,PR,410465,CARAMBEÍ,26/04/2019,2019-04-26,opendatasus
2785,PR,410465,CARAMBEÍ,30/04/2019,2019-04-30,opendatasus
2786,PR,410465,CARAMBEÍ,24/05/2019,2019-05-24,opendatasus
2787,PR,410490,CASTRO,21/03/2019,2019-03-21,opendatasus
2788,PR,410490,CASTRO,22/03/2019,2019-03-22,opendatasus
2789,PR,410490,CASTRO,25/03/2019,2019-03-25,opendatasus
2790,PR,410490,CASTRO,26/03/2019,2019-03-26,opendatasus
2791,PR,410490,CASTRO,28/03/2019,2019-03-28,opendatasus
2792,PR,410490,CASTRO,02/04/2019,2019-04-02,opendatasus
2793,PR,410490,CASTRO,03/04/2019,2019-04-03,opendatasus
2794,PR,410490,CASTRO,04/04/2019,2019-04-04,opendatasus
2795,PR,410490,CASTRO,05/04/2019,2019-04-05,opendatasus
2796,PR,410490,CASTRO,11/04/2019,2019-04-11,opendatasus
2797,PR,410490,CASTRO,15/04/2019,2019-04-15,opendatasus
2798,PR,410490,CASTRO,16/04/2019,2019-04-16,opendatasus
2799,PR,410490,CASTRO,23/04/2019,2019-04-23,opendatasus
2800,PR,410490,CASTRO,02/05/2019,2019-05-02,opendatasus
2801,PR,410490,CASTRO,06/05/2019,2019-05-06,opendatasus
2802,PR,410490,CASTRO,14/05/2019,2019-05-14,opendatasus
2803,PR,410490,CASTRO,17/05/2019,2019-05-17,opendatasus
2804,PR,410490,CASTRO,29/05/2019,2019-05-29,opendatasus
2805,PR,410490,CASTRO,26/09/2019,2019-09-26,opendatasus
2806,PR,410490,CASTRO,31/10/2019,2019-10-31,opendatasus
2807,PR,410490,CASTRO,01/11/2019,2019-11-01,opendatasus
2808,PR,410490,CASTRO,04/11/2019,2019-11-04,opendatasus
2809,PR,410490,CASTRO,06/11/2019,2019-11-06,opendatasus
2810,PR,410490,CASTRO,10/11/2019,2019-11-10,opendatasus
2811,PR,410490,CASTRO,13/11/2019,2019-11-13,opendatasus
2812,PR,410490,CASTRO,14/11/2019,2019-11-14,opendatasus
2813,PR,410490,CASTRO,26/12/2019,2019-12-26,opendatasus
2814,PR,410570,CLEVELÂNDIA,17/11/2020,2020-11-17,opendatasus
2815,PR,410620,CONTENDA,17/01/2020,2020-01-17,opendatasus
2816,PR,410620,CONTENDA,31/01/2020,2020-01-31,opendatasus
2817,PR,410620,CONTENDA,03/02/2020,2020-02-03,opendatasus
2818,PR,410620,CONTENDA,06/02/2020,2020-02-06,opendatasus
2819,PR,410620,CONTENDA,11/02/2020,2020-02-11,opendatasus
2820,PR,410620,CONTENDA,14/02/2020,2020-02-14,opendatasus
2821,PR,410620,CONTENDA,27/02/2020,2020-02-27,opendatasus
2822,PR,410645,CORONEL DOMINGOS SOARES,06/11/2020,2020-11-06,opendatasus
2823,PR,410680,CRUZ MACHADO,01/02/2020,2020-02-01,opendatasus
2824,PR,410680,CRUZ MACHADO,29/02/2020,2020-02-29,opendatasus
2825,PR,410680,CRUZ MACHADO,02/03/2020,2020-03-02,opendatasus
2826,PR,410680,CRUZ MACHADO,16/03/2020,2020-03-16,opendatasus
2827,PR,410680,CRUZ MACHADO,17/03/2020,2020-03-17,opendatasus
2828,PR,410680,CRUZ MACHADO,30/03/2020,2020-03-30,opendatasus
2829,PR,410680,CRUZ MACHADO,06/04/2020,2020-04-06,opendatasus
2830,PR,410680,CRUZ MACHADO,11/04/2020,2020-04-11,opendatasus
2831,PR,410680,CRUZ MACHADO,14/04/2020,2020-04-14,opendatasus
2832,PR,410680,CRUZ MACHADO,20/04/2020,2020-04-20,opendatasus
2833,PR,410680,CRUZ MACHADO,13/11/2020,2020-11-13,opendatasus
2834,PR,410680,CRUZ MACHADO,28/12/2020,2020-12-28,opendatasus
2835,PR,410773,FERNANDES PINHEIRO,26/08/2022,2022-08-26,opendatasus
2836,PR,410930,GUARANIAÇU,14/02/2020,2020-02-14,opendatasus
2837,PR,410940,GUARAPUAVA,27/01/2020,2020-01-27,opendatasus
2838,PR,410940,GUARAPUAVA,03/02/2020,2020-02-03,opendatasus
2839,PR,410950,GUARAQUEÇABA,24/01/2019,2019-01-24,opendatasus
2840,PR,410950,GUARAQUEÇABA,28/01/2019,2019-01-28,opendatasus
2841,PR,410960,GUARATUBA,03/03/2019,2019-03-03,opendatasus
2842,PR,410965,HONÓRIO SERPA,19/11/2020,2020-11-19,opendatasus
2843,PR,411010,IMBITUVA,03/12/2019,2019-12-03,opendatasus
2844,PR,411050,IPIRANGA,04/04/2019,2019-04-04,opendatasus
2845,PR,411050,IPIRANGA,26/11/2019,2019-11-26,opendatasus
2846,PR,411050,IPIRANGA,28/11/2019,2019-11-28,opendatasus
2847,PR,411200,JAGUARIAÍVA,31/03/2019,2019-03-31,opendatasus
2848,PR,411200,JAGUARIAÍVA,09/04/2019,2019-04-09,opendatasus
2849,PR,411200,JAGUARIAÍVA,12/04/2019,2019-04-12,opendatasus
2850,PR,411200,JAGUARIAÍVA,15/04/2019,2019-04-15,opendatasus
2851,PR,411200,JAGUARIAÍVA,25/04/2019,2019-04-25,opendatasus
2852,PR,411200,JAGUARIAÍVA,02/05/2019,2019-05-02,opendatasus
2853,PR,411200,JAGUARIAÍVA,14/05/2019,2019-05-14,opendatasus
2854,PR,411200,JAGUARIAÍVA,02/03/2020,2020-03-02,opendatasus
2855,PR,411320,LAPA,02/01/2020,2020-01-02,opendatasus
2856,PR,411320,LAPA,07/01/2020,2020-01-07,opendatasus
2857,PR,411320,LAPA,09/01/2020,2020-01-09,opendatasus
2858,PR,411320,LAPA,15/01/2020,2020-01-15,opendatasus
2859,PR,411320,LAPA,27/01/2020,2020-01-27,opendatasus
2860,PR,411320,LAPA,07/02/2020,2020-02-07,opendatasus
2861,PR,411390,MALLET,06/01/2020,2020-01-06,opendatasus
2862,PR,411390,MALLET,08/01/2020,2020-01-08,opendatasus
2863,PR,411390,MALLET,12/01/2020,2020-01-12,opendatasus
2864,PR,411390,MALLET,13/01/2020,2020-01-13,opendatasus
2865,PR,411390,MALLET,15/01/2020,2020-01-15,opendatasus
2866,PR,411390,MALLET,16/01/2020,2020-01-16,opendatasus
2867,PR,411390,MALLET,21/01/2020,2020-01-21,opendatasus
2868,PR,411390,MALLET,23/01/2020,2020-01-23,opendatasus
2869,PR,411390,MALLET,24/01/2020,2020-01-24,opendatasus
2870,PR,411390,MALLET,25/01/2020,2020-01-25,opendatasus
2871,PR,411390,MALLET,27/01/2020,2020-01-27,opendatasus
2872,PR,411390,MALLET,28/01/2020,2020-01-28,opendatasus
2873,PR,411390,MALLET,29/01/2020,2020-01-29,opendatasus
2874,PR,411390,MALLET,31/01/2020,2020-01-31,opendatasus
2875,PR,411390,MALLET,05/02/2020,2020-02-05,opendatasus
2876,PR,411390,MALLET,11/02/2020,2020-02-11,opendatasus
2877,PR,411390,MALLET,12/02/2020,2020-02-12,opendatasus
2878,PR,411390,MALLET,14/02/2020,2020-02-14,opendatasus
2879,PR,411390,MALLET,19/02/2020,2020-02-19,opendatasus
2880,PR,411390,MALLET,28/02/2020,2020-02-28,opendatasus
2881,PR,411430,MANDIRITUBA,03/12/2019,2019-12-03,opendatasus
2882,PR,411430,MANDIRITUBA,09/03/2020,2020-03-09,opendatasus
2883,PR,411440,MANGUEIRINHA,30/04/2020,2020-04-30,opendatasus
2884,PR,411440,MANGUEIRINHA,16/11/2020,2020-11-16,opendatasus
2885,PR,411620,MORRETES,18/02/2019,2019-02-18,opendatasus
2886,PR,411620,MORRETES,27/02/2019,2019-02-27,opendatasus
2887,PR,411620,MORRETES,11/03/2019,2019-03-11,opendatasus
2888,PR,411760,PALMAS,18/11/2020,2020-11-18,opendatasus
2889,PR,411760,PALMAS,30/11/2020,2020-11-30,opendatasus
2890,PR,411760,PALMAS,09/12/2020,2020-12-09,opendatasus
2891,PR,411770,PALMEIRA,05/12/2019,2019-12-05,opendatasus
2892,PR,411820,PARANAGUÁ,29/01/2019,2019-01-29,opendatasus
2893,PR,411820,PARANAGUÁ,01/03/2019,2019-03-01,opendatasus
2894,PR,411860,PAULA FREITAS,19/02/2020,2020-02-19,opendatasus
2895,PR,411860,PAULA FREITAS,07/03/2020,2020-03-07,opendatasus
2896,PR,411860,PAULA FREITAS,19/03/2020,2020-03-19,opendatasus
2897,PR,411860,PAULA FREITAS,09/04/2020,2020-04-09,opendatasus
2898,PR,411870,PAULO FRONTIN,20/01/2020,2020-01-20,opendatasus
2899,PR,411870,PAULO FRONTIN,06/02/2020,2020-02-06,opendatasus
2900,PR,411870,PAULO FRONTIN,09/02/2020,2020-02-09,opendatasus
2901,PR,411870,PAULO FRONTIN,12/02/2020,2020-02-12,opendatasus
2902,PR,411870,PAULO FRONTIN,13/02/2020,2020-02-13,opendatasus
2903,PR,411870,PAULO FRONTIN,17/02/2020,2020-02-17,opendatasus
2904,PR,411910,PIĘN,15/01/2020,2020-01-15,opendatasus
2905,PR,411910,PIĘN,25/01/2020,2020-01-25,opendatasus
2906,PR,411910,PIĘN,28/01/2020,2020-01-28,opendatasus
2907,PR,411910,PIĘN,31/01/2020,2020-01-31,opendatasus
2908,PR,411910,PIĘN,03/02/2020,2020-02-03,opendatasus
2909,PR,411910,PIĘN,06/02/2020,2020-02-06,opendatasus
2910,PR,411910,PIĘN,07/02/2020,2020-02-07,opendatasus
2911,PR,411910,PIĘN,11/02/2020,2020-02-11,opendatasus
2912,PR,411910,PIĘN,06/03/2020,2020-03-06,opendatasus
2913,PR,411910,PIĘN,01/04/2020,2020-04-01,opendatasus
2914,PR,411930,PINHĂO,15/02/2020,2020-02-15,opendatasus
2915,PR,411940,PIRAÍ DO SUL,15/05/2019,2019-05-15,opendatasus
2916,PR,411940,PIRAÍ DO SUL,13/06/2019,2019-06-13,opendatasus
2917,PR,411940,PIRAÍ DO SUL,17/06/2019,2019-06-17,opendatasus
2918,PR,411940,PIRAÍ DO SUL,18/06/2019,2019-06-18,opendatasus
2919,PR,411940,PIRAÍ DO SUL,10/11/2019,2019-11-10,opendatasus
2920,PR,411940,PIRAÍ DO SUL,06/12/2019,2019-12-06,opendatasus
2921,PR,411960,PITANGA,20/01/2020,2020-01-20,opendatasus
2922,PR,411960,PITANGA,24/01/2020,2020-01-24,opendatasus
2923,PR,411960,PITANGA,03/02/2020,2020-02-03,opendatasus
2924,PR,411990,PONTA GROSSA,07/05/2019,2019-05-07,opendatasus
2925,PR,411990,PONTA GROSSA,01/11/2019,2019-11-01,opendatasus
2926,PR,411990,PONTA GROSSA,20/11/2019,2019-11-20,opendatasus
2927,PR,411990,PONTA GROSSA,22/11/2019,2019-11-22,opendatasus
2928,PR,411990,PONTA GROSSA,03/12/2019,2019-12-03,opendatasus
2929,PR,412030,PORTO VITÓRIA,07/04/2020,2020-04-07,opendatasus
2930,PR,412030,PORTO VITÓRIA,27/04/2020,2020-04-27,opendatasus
2931,PR,412060,PRUDENTÓPOLIS,26/11/2019,2019-11-26,opendatasus
2932,PR,412060,PRUDENTÓPOLIS,30/12/2019,2019-12-30,opendatasus
2933,PR,412080,QUATRO BARRAS,25/04/2019,2019-04-25,opendatasus
2934,PR,412080,QUATRO BARRAS,06/01/2020,2020-01-06,opendatasus
2935,PR,412120,QUITANDINHA,25/01/2020,2020-01-25,opendatasus
2936,PR,412120,QUITANDINHA,26/01/2020,2020-01-26,opendatasus
2937,PR,412120,QUITANDINHA,15/02/2020,2020-02-15,opendatasus
2938,PR,412120,QUITANDINHA,26/02/2020,2020-02-26,opendatasus
2939,PR,412120,QUITANDINHA,27/02/2020,2020-02-27,opendatasus
2940,PR,412200,RIO AZUL,06/01/2020,2020-01-06,opendatasus
2941,PR,412200,RIO AZUL,18/01/2020,2020-01-18,opendatasus
2942,PR,412200,RIO AZUL,19/01/2020,2020-01-19,opendatasus
2943,PR,412200,RIO AZUL,25/01/2020,2020-01-25,opendatasus
2944,PR,412200,RIO AZUL,31/01/2020,2020-01-31,opendatasus
2945,PR,412230,RIO NEGRO,04/01/2020,2020-01-04,opendatasus
2946,PR,412230,RIO NEGRO,26/01/2020,2020-01-26,opendatasus
2947,PR,412385,SANTA MARIA DO OESTE,25/01/2020,2020-01-25,opendatasus
2948,PR,412510,SĂO JOĂO DO TRIUNFO,26/11/2019,2019-11-26,opendatasus
2949,PR,412510,SĂO JOĂO DO TRIUNFO,26/12/2019,2019-12-26,opendatasus
2950,PR,412510,SĂO JOĂO DO TRIUNFO,17/01/2020,2020-01-17,opendatasus
2951,PR,412510,SĂO JOĂO DO TRIUNFO,20/01/2020,2020-01-20,opendatasus
2952,PR,412510,SĂO JOĂO DO TRIUNFO,21/01/2020,2020-01-21,opendatasus
2953,PR,412550,SĂO JOSÉ DOS PINHAIS,17/02/2019,2019-02-17,opendatasus
2954,PR,412550,SĂO JOSÉ DOS PINHAIS,08/03/2019,2019-03-08,opendatasus
2955,PR,412550,SĂO JOSÉ DOS PINHAIS,19/03/2019,2019-03-19,opendatasus
2956,PR,412550,SĂO JOSÉ DOS PINHAIS,22/03/2019,2019-03-22,opendatasus
2957,PR,412550,SĂO JOSÉ DOS PINHAIS,23/03/2019,2019-03-23,opendatasus
2958,PR,412550,SĂO JOSÉ DOS PINHAIS,24/03/2019,2019-03-24,opendatasus
2959,PR,412550,SĂO JOSÉ DOS PINHAIS,27/03/2019,2019-03-27,opendatasus
2960,PR,412550,SĂO JOSÉ DOS PINHAIS,29/03/2019,2019-03-29,opendatasus
2961,PR,412550,SĂO JOSÉ DOS PINHAIS,04/04/2019,2019-04-04,opendatasus
2962,PR,412550,SĂO JOSÉ DOS PINHAIS,10/04/2019,2019-04-10,opendatasus
2963,PR,412550,SĂO JOSÉ DOS PINHAIS,12/04/2019,2019-04-12,opendatasus
2964,PR,412550,SĂO JOSÉ DOS PINHAIS,26/04/2019,2019-04-26,opendatasus
2965,PR,412550,SĂO JOSÉ DOS PINHAIS,29/04/2019,2019-04-29,opendatasus
2966,PR,412550,SĂO JOSÉ DOS PINHAIS,10/05/2019,2019-05-10,opendatasus
2967,PR,412550,SĂO JOSÉ DOS PINHAIS,20/05/2019,2019-05-20,opendatasus
2968,PR,412550,SĂO JOSÉ DOS PINHAIS,21/05/2019,2019-05-21,opendatasus
2969,PR,412550,SĂO JOSÉ DOS PINHAIS,29/12/2019,2019-12-29,opendatasus
2970,PR,412550,SĂO JOSÉ DOS PINHAIS,05/01/2020,2020-01-05,opendatasus
2971,PR,412550,SĂO JOSÉ DOS PINHAIS,21/02/2020,2020-02-21,opendatasus
2972,PR,412560,SĂO MATEUS DO SUL,26/12/2019,2019-12-26,opendatasus
2973,PR,412560,SĂO MATEUS DO SUL,08/01/2020,2020-01-08,opendatasus
2974,PR,412560,SĂO MATEUS DO SUL,10/01/2020,2020-01-10,opendatasus
2975,PR,412560,SĂO MATEUS DO SUL,14/01/2020,2020-01-14,opendatasus
2976,PR,412560,SĂO MATEUS DO SUL,18/01/2020,2020-01-18,opendatasus
2977,PR,412560,SĂO MATEUS DO SUL,20/01/2020,2020-01-20,opendatasus
2978,PR,412560,SĂO MATEUS DO SUL,25/01/2020,2020-01-25,opendatasus
2979,PR,412560,SĂO MATEUS DO SUL,27/01/2020,2020-01-27,opendatasus
2980,PR,412560,SĂO MATEUS DO SUL,29/01/2020,2020-01-29,opendatasus
2981,PR,412560,SĂO MATEUS DO SUL,01/02/2020,2020-02-01,opendatasus
2982,PR,412560,SĂO MATEUS DO SUL,06/02/2020,2020-02-06,opendatasus
2983,PR,412560,SĂO MATEUS DO SUL,07/02/2020,2020-02-07,opendatasus
2984,PR,412560,SĂO MATEUS DO SUL,09/02/2020,2020-02-09,opendatasus
2985,PR,412560,SĂO MATEUS DO SUL,10/02/2020,2020-02-10,opendatasus
2986,PR,412560,SĂO MATEUS DO SUL,12/02/2020,2020-02-12,opendatasus
2987,PR,412560,SĂO MATEUS DO SUL,13/02/2020,2020-02-13,opendatasus
2988,PR,412560,SĂO MATEUS DO SUL,15/02/2020,2020-02-15,opendatasus
2989,PR,412560,SĂO MATEUS DO SUL,16/02/2020,2020-02-16,opendatasus
2990,PR,412560,SĂO MATEUS DO SUL,17/02/2020,2020-02-17,opendatasus
2991,PR,412560,SĂO MATEUS DO SUL,21/02/2020,2020-02-21,opendatasus
2992,PR,412560,SĂO MATEUS DO SUL,28/02/2020,2020-02-28,opendatasus
2993,PR,412560,SĂO MATEUS DO SUL,29/02/2020,2020-02-29,opendatasus
2994,PR,412560,SĂO MATEUS DO SUL,04/04/2020,2020-04-04,opendatasus
2995,PR,412620,SAPOPEMA,01/12/2019,2019-12-01,opendatasus
2996,PR,412700,TEIXEIRA SOARES,20/11/2019,2019-11-20,opendatasus
2997,PR,412700,TEIXEIRA SOARES,04/12/2019,2019-12-04,opendatasus
2998,PR,412750,TIBAGI,18/05/2019,2019-05-18,opendatasus
2999,PR,412750,TIBAGI,20/05/2019,2019-05-20,opendatasus
3000,PR,412750,TIBAGI,13/06/2019,2019-06-13,opendatasus
3001,PR,412796,TURVO,09/01/2020,2020-01-09,opendatasus
3002,PR,412796,TURVO,20/01/2020,2020-01-20,opendatasus
3003,PR,412796,TURVO,21/01/2020,2020-01-21,opendatasus
3004,PR,412796,TURVO,23/01/2020,2020-01-23,opendatasus
3005,PR,412796,TURVO,24/01/2020,2020-01-24,opendatasus
3006,PR,412796,TURVO,28/01/2020,2020-01-28,opendatasus
3007,PR,412796,TURVO,29/01/2020,2020-01-29,opendatasus
3008,PR,412796,TURVO,31/01/2020,2020-01-31,opendatasus
3009,PR,412820,UNIĂO DA VITÓRIA,10/02/2020,2020-02-10,opendatasus
3010,PR,412820,UNIĂO DA VITÓRIA,04/03/2020,2020-03-04,opendatasus
3011,PR,412820,UNIĂO DA VITÓRIA,15/03/2020,2020-03-15,opendatasus
3012,PR,412820,UNIĂO DA VITÓRIA,02/04/2020,2020-04-02,opendatasus
3013,PR,412820,UNIĂO DA VITÓRIA,30/04/2020,2020-04-30,opendatasus
3014,SC,420020,AGROLÂNDIA,14/12/2020,2020-12-14,opendatasus
3015,SC,420020,AGROLÂNDIA,18/12/2020,2020-12-18,opendatasus
3016,SC,420060,ÁGUAS MORNAS,10/02/2021,2021-02-10,opendatasus
3017,SC,420060,ÁGUAS MORNAS,19/03/2021,2021-03-19,opendatasus
3018,SC,420100,ANITA GARIBALDI,19/01/2021,2021-01-19,opendatasus
3019,SC,420110,ANITÁPOLIS,20/03/2021,2021-03-20,opendatasus
3020,SC,420125,APIÚNA,07/04/2020,2020-04-07,opendatasus
3021,SC,420125,APIÚNA,13/04/2020,2020-04-13,opendatasus
3022,SC,420125,APIÚNA,14/04/2020,2020-04-14,opendatasus
3023,SC,420125,APIÚNA,20/04/2020,2020-04-20,opendatasus
3024,SC,420125,APIÚNA,29/04/2020,2020-04-29,opendatasus
3025,SC,420190,AURORA,27/04/2020,2020-04-27,opendatasus
3026,SC,420220,BENEDITO NOVO,25/01/2020,2020-01-25,opendatasus
3027,SC,420220,BENEDITO NOVO,28/01/2020,2020-01-28,opendatasus
3028,SC,420240,BLUMENAU,07/01/2020,2020-01-07,opendatasus
3029,SC,420240,BLUMENAU,15/01/2020,2020-01-15,opendatasus
3030,SC,420240,BLUMENAU,17/01/2020,2020-01-17,opendatasus
3031,SC,420240,BLUMENAU,18/01/2020,2020-01-18,opendatasus
3032,SC,420240,BLUMENAU,20/01/2020,2020-01-20,opendatasus
3033,SC,420240,BLUMENAU,21/01/2020,2020-01-21,opendatasus
3034,SC,420240,BLUMENAU,22/01/2020,2020-01-22,opendatasus
3035,SC,420240,BLUMENAU,28/01/2020,2020-01-28,opendatasus
3036,SC,420240,BLUMENAU,29/01/2020,2020-01-29,opendatasus
3037,SC,420240,BLUMENAU,30/01/2020,2020-01-30,opendatasus
3038,SC,420240,BLUMENAU,31/01/2020,2020-01-31,opendatasus
3039,SC,420240,BLUMENAU,01/02/2020,2020-02-01,opendatasus
3040,SC,420240,BLUMENAU,02/02/2020,2020-02-02,opendatasus
3041,SC,420240,BLUMENAU,03/02/2020,2020-02-03,opendatasus
3042,SC,420240,BLUMENAU,05/02/2020,2020-02-05,opendatasus
3043,SC,420240,BLUMENAU,10/02/2020,2020-02-10,opendatasus
3044,SC,420240,BLUMENAU,18/02/2020,2020-02-18,opendatasus
3045,SC,420240,BLUMENAU,23/02/2020,2020-02-23,opendatasus
3046,SC,420240,BLUMENAU,26/02/2020,2020-02-26,opendatasus
3047,SC,420240,BLUMENAU,28/02/2020,2020-02-28,opendatasus
3048,SC,420240,BLUMENAU,04/03/2020,2020-03-04,opendatasus
3049,SC,420240,BLUMENAU,05/03/2020,2020-03-05,opendatasus
3050,SC,420240,BLUMENAU,07/03/2020,2020-03-07,opendatasus
3051,SC,420240,BLUMENAU,20/03/2020,2020-03-20,opendatasus
3052,SC,420240,BLUMENAU,03/04/2020,2020-04-03,opendatasus
3053,SC,420240,BLUMENAU,08/04/2020,2020-04-08,opendatasus
3054,SC,420240,BLUMENAU,10/04/2020,2020-04-10,opendatasus
3055,SC,420240,BLUMENAU,15/04/2020,2020-04-15,opendatasus
3056,SC,420240,BLUMENAU,27/05/2021,2021-05-27,opendatasus
3057,SC,420243,BOCAINA DO SUL,12/01/2021,2021-01-12,opendatasus
3058,SC,420280,BRAÇO DO NORTE,06/03/2021,2021-03-06,opendatasus
3059,SC,420285,BRAÇO DO TROMBUDO,19/12/2020,2020-12-19,opendatasus
3060,SC,420285,BRAÇO DO TROMBUDO,24/12/2020,2020-12-24,opendatasus
3061,SC,420285,BRAÇO DO TROMBUDO,26/12/2020,2020-12-26,opendatasus
3062,SC,420320,CAMBORIÚ,26/02/2020,2020-02-26,opendatasus
3063,SC,420325,CAPĂO ALTO,13/02/2021,2021-02-13,opendatasus
3064,SC,420325,CAPĂO ALTO,06/03/2021,2021-03-06,opendatasus
3065,SC,420325,CAPĂO ALTO,15/03/2021,2021-03-15,opendatasus
3066,SC,420325,CAPĂO ALTO,16/03/2021,2021-03-16,opendatasus
3067,SC,420330,CAMPO ALEGRE,17/01/2020,2020-01-17,opendatasus
3068,SC,420330,CAMPO ALEGRE,21/01/2020,2020-01-21,opendatasus
3069,SC,420330,CAMPO ALEGRE,23/01/2020,2020-01-23,opendatasus
3070,SC,420330,CAMPO ALEGRE,24/01/2020,2020-01-24,opendatasus
3071,SC,420330,CAMPO ALEGRE,27/01/2020,2020-01-27,opendatasus
3072,SC,420330,CAMPO ALEGRE,28/01/2020,2020-01-28,opendatasus
3073,SC,420330,CAMPO ALEGRE,29/01/2020,2020-01-29,opendatasus
3074,SC,420330,CAMPO ALEGRE,30/01/2020,2020-01-30,opendatasus
3075,SC,420330,CAMPO ALEGRE,31/01/2020,2020-01-31,opendatasus
3076,SC,420330,CAMPO ALEGRE,01/02/2020,2020-02-01,opendatasus
3077,SC,420340,CAMPO BELO DO SUL,15/02/2021,2021-02-15,opendatasus
3078,SC,420340,CAMPO BELO DO SUL,17/02/2021,2021-02-17,opendatasus
3079,SC,420340,CAMPO BELO DO SUL,20/02/2021,2021-02-20,opendatasus
3080,SC,420340,CAMPO BELO DO SUL,25/02/2021,2021-02-25,opendatasus
3081,SC,420340,CAMPO BELO DO SUL,11/03/2021,2021-03-11,opendatasus
3082,SC,420417,CERRO NEGRO,10/02/2021,2021-02-10,opendatasus
3083,SC,420455,CORREIA PINTO,26/02/2021,2021-02-26,opendatasus
3084,SC,420455,CORREIA PINTO,12/03/2021,2021-03-12,opendatasus
3085,SC,420480,CURITIBANOS,03/02/2021,2021-02-03,opendatasus
3086,SC,420510,DONA EMMA,10/11/2020,2020-11-10,opendatasus
3087,SC,420515,DOUTOR PEDRINHO,03/03/2020,2020-03-03,opendatasus
3088,SC,420580,GARUVA,20/03/2019,2019-03-20,opendatasus
3089,SC,420590,GASPAR,27/01/2020,2020-01-27,opendatasus
3090,SC,420690,IBIRAMA,31/03/2020,2020-03-31,opendatasus
3091,SC,420750,INDAIAL,31/05/2019,2019-05-31,opendatasus
3092,SC,420750,INDAIAL,26/01/2020,2020-01-26,opendatasus
3093,SC,420750,INDAIAL,17/02/2020,2020-02-17,opendatasus
3094,SC,420750,INDAIAL,22/02/2020,2020-02-22,opendatasus
3095,SC,420750,INDAIAL,24/02/2020,2020-02-24,opendatasus
3096,SC,420750,INDAIAL,04/03/2020,2020-03-04,opendatasus
3097,SC,420750,INDAIAL,11/03/2020,2020-03-11,opendatasus
3098,SC,420750,INDAIAL,02/05/2020,2020-05-02,opendatasus
3099,SC,420810,ITAIÓPOLIS,23/06/2019,2019-06-23,opendatasus
3100,SC,420820,ITAJAÍ,03/02/2020,2020-02-03,opendatasus
3101,SC,420890,JARAGUÁ DO SUL,21/06/2019,2019-06-21,opendatasus
3102,SC,420890,JARAGUÁ DO SUL,31/12/2019,2019-12-31,opendatasus
3103,SC,420890,JARAGUÁ DO SUL,15/01/2020,2020-01-15,opendatasus
3104,SC,420890,JARAGUÁ DO SUL,24/01/2020,2020-01-24,opendatasus
3105,SC,420910,JOINVILLE,06/03/2019,2019-03-06,opendatasus
3106,SC,420910,JOINVILLE,04/05/2019,2019-05-04,opendatasus
3107,SC,420910,JOINVILLE,14/07/2019,2019-07-14,opendatasus
3108,SC,420930,LAGES,22/02/2021,2021-02-22,opendatasus
3109,SC,420930,LAGES,28/04/2021,2021-04-28,opendatasus
3110,SC,421000,LUIZ ALVES,04/02/2020,2020-02-04,opendatasus
3111,SC,421010,MAFRA,24/01/2020,2020-01-24,opendatasus
3112,SC,421010,MAFRA,27/01/2020,2020-01-27,opendatasus
3113,SC,421010,MAFRA,12/01/2021,2021-01-12,opendatasus
3114,SC,421060,MASSARANDUBA,28/01/2020,2020-01-28,opendatasus
3115,SC,421205,PALMEIRA,19/01/2021,2021-01-19,opendatasus
3116,SC,421205,PALMEIRA,24/01/2021,2021-01-24,opendatasus
3117,SC,421227,PASSOS MAIA,16/12/2020,2020-12-16,opendatasus
3118,SC,421230,PAULO LOPES,17/05/2021,2021-05-17,opendatasus
3119,SC,421240,PEDRAS GRANDES,24/11/2021,2021-11-24,opendatasus
3120,SC,421320,POMERODE,13/01/2020,2020-01-13,opendatasus
3121,SC,421320,POMERODE,17/01/2020,2020-01-17,opendatasus
3122,SC,421320,POMERODE,18/01/2020,2020-01-18,opendatasus
3123,SC,421320,POMERODE,21/01/2020,2020-01-21,opendatasus
3124,SC,421320,POMERODE,25/01/2020,2020-01-25,opendatasus
3125,SC,421320,POMERODE,30/01/2020,2020-01-30,opendatasus
3126,SC,421320,POMERODE,31/01/2020,2020-01-31,opendatasus
3127,SC,421320,POMERODE,13/02/2020,2020-02-13,opendatasus
3128,SC,421320,POMERODE,18/02/2020,2020-02-18,opendatasus
3129,SC,421320,POMERODE,29/02/2020,2020-02-29,opendatasus
3130,SC,421330,PONTE ALTA,13/02/2021,2021-02-13,opendatasus
3131,SC,421400,PRESIDENTE GETÚLIO,19/10/2020,2020-10-19,opendatasus
3132,SC,421490,RIO FORTUNA,20/02/2021,2021-02-20,opendatasus
3133,SC,421490,RIO FORTUNA,26/02/2021,2021-02-26,opendatasus
3134,SC,421490,RIO FORTUNA,03/03/2021,2021-03-03,opendatasus
3135,SC,421490,RIO FORTUNA,16/03/2021,2021-03-16,opendatasus
3136,SC,421500,RIO NEGRINHO,16/01/2020,2020-01-16,opendatasus
3137,SC,421500,RIO NEGRINHO,02/02/2020,2020-02-02,opendatasus
3138,SC,421560,SANTA ROSA DE LIMA,22/02/2021,2021-02-22,opendatasus
3139,SC,421560,SANTA ROSA DE LIMA,23/02/2021,2021-02-23,opendatasus
3140,SC,421560,SANTA ROSA DE LIMA,05/03/2021,2021-03-05,opendatasus
3141,SC,421575,SĂO BERNARDINO,22/12/2020,2020-12-22,opendatasus
3142,SC,421580,SĂO BENTO DO SUL,10/12/2019,2019-12-10,opendatasus
3143,SC,421580,SĂO BENTO DO SUL,13/01/2020,2020-01-13,opendatasus
3144,SC,421580,SĂO BENTO DO SUL,16/01/2020,2020-01-16,opendatasus
3145,SC,421580,SĂO BENTO DO SUL,17/01/2020,2020-01-17,opendatasus
3146,SC,421580,SĂO BENTO DO SUL,27/01/2020,2020-01-27,opendatasus
3147,SC,421605,SĂO CRISTOVĂO DO SUL,10/02/2021,2021-02-10,opendatasus
3148,SC,421680,SĂO JOSÉ DO CERRITO,10/02/2021,2021-02-10,opendatasus
3149,SC,421680,SĂO JOSÉ DO CERRITO,15/02/2021,2021-02-15,opendatasus
3150,SC,421680,SĂO JOSÉ DO CERRITO,19/02/2021,2021-02-19,opendatasus
3151,SC,421680,SĂO JOSÉ DO CERRITO,22/02/2021,2021-02-22,opendatasus
3152,SC,421680,SĂO JOSÉ DO CERRITO,01/03/2021,2021-03-01,opendatasus
3153,SC,421680,SĂO JOSÉ DO CERRITO,03/03/2021,2021-03-03,opendatasus
3154,SC,421680,SĂO JOSÉ DO CERRITO,09/03/2021,2021-03-09,opendatasus
3155,SC,421680,SĂO JOSÉ DO CERRITO,12/03/2021,2021-03-12,opendatasus
3156,SC,421690,SĂO LOURENÇO DO OESTE,17/12/2020,2020-12-17,opendatasus
3157,SC,421710,SĂO MARTINHO,16/02/2021,2021-02-16,opendatasus
3158,SC,421710,SĂO MARTINHO,25/03/2021,2021-03-25,opendatasus
3159,SC,421710,SĂO MARTINHO,06/04/2021,2021-04-06,opendatasus
3160,SC,421780,TAIÓ,06/01/2021,2021-01-06,opendatasus
3161,SC,421820,TIMBÓ,19/01/2020,2020-01-19,opendatasus
3162,SC,421900,URUSSANGA,22/04/2021,2021-04-22,opendatasus
3163,SC,421900,URUSSANGA,18/05/2021,2021-05-18,opendatasus
3164,SC,421900,URUSSANGA,12/07/2021,2021-07-12,opendatasus
3165,SC,421940,WITMARSUM,07/11/2020,2020-11-07,opendatasus
3166,RS,430066,ANDRÉ DA ROCHA,19/02/2021,2021-02-19,opendatasus
3167,RS,430066,ANDRÉ DA ROCHA,31/03/2021,2021-03-31,opendatasus
3168,RS,430080,ANTÔNIO PRADO,09/03/2021,2021-03-09,opendatasus
3169,RS,430080,ANTÔNIO PRADO,19/04/2021,2021-04-19,opendatasus
3170,RS,430180,BARRACĂO,22/02/2021,2021-02-22,opendatasus
3171,RS,430190,BARRA DO RIBEIRO,08/04/2021,2021-04-08,opendatasus
3172,RS,430230,BOM JESUS,19/03/2021,2021-03-19,opendatasus
3173,RS,430230,BOM JESUS,26/03/2021,2021-03-26,opendatasus
3174,RS,430367,CAMPESTRE DA SERRA,08/04/2021,2021-04-08,opendatasus
3175,RS,430440,CANELA,06/03/2021,2021-03-06,opendatasus
3176,RS,430462,CAPĂO BONITO DO SUL,09/02/2021,2021-02-09,opendatasus
3177,RS,430462,CAPĂO BONITO DO SUL,11/03/2021,2021-03-11,opendatasus
3178,RS,430510,CAXIAS DO SUL,04/04/2021,2021-04-04,opendatasus
3179,RS,430510,CAXIAS DO SUL,05/04/2021,2021-04-05,opendatasus
3180,RS,430510,CAXIAS DO SUL,09/04/2021,2021-04-09,opendatasus
3181,RS,430510,CAXIAS DO SUL,27/04/2021,2021-04-27,opendatasus
3182,RS,430510,CAXIAS DO SUL,03/05/2021,2021-05-03,opendatasus
3183,RS,430510,CAXIAS DO SUL,11/05/2021,2021-05-11,opendatasus
3184,RS,430517,CERRO GRANDE DO SUL,16/04/2021,2021-04-16,opendatasus
3185,RS,430535,CHARQUEADAS,13/05/2021,2021-05-13,opendatasus
3186,RS,430550,CIRÍACO,06/04/2021,2021-04-06,opendatasus
3187,RS,430740,ESMERALDA,19/02/2021,2021-02-19,opendatasus
3188,RS,430740,ESMERALDA,25/02/2021,2021-02-25,opendatasus
3189,RS,430740,ESMERALDA,07/03/2021,2021-03-07,opendatasus
3190,RS,430790,FARROUPILHA,25/02/2021,2021-02-25,opendatasus
3191,RS,430820,FLORES DA CUNHA,03/05/2021,2021-05-03,opendatasus
3192,RS,430925,GUABIJU,27/04/2021,2021-04-27,opendatasus
3193,RS,431043,IPĘ,08/03/2021,2021-03-08,opendatasus
3194,RS,431043,IPĘ,27/03/2021,2021-03-27,opendatasus
3195,RS,431112,JAQUIRANA,11/04/2021,2021-04-11,opendatasus
3196,RS,431112,JAQUIRANA,03/05/2021,2021-05-03,opendatasus
3197,RS,431130,LAGOA VERMELHA,19/02/2021,2021-02-19,opendatasus
3198,RS,431130,LAGOA VERMELHA,21/03/2021,2021-03-21,opendatasus
3199,RS,431175,MANOEL VIANA,07/06/2021,2021-06-07,opendatasus
3200,RS,431247,MORRO REUTER,05/10/2021,2021-10-05,opendatasus
3201,RS,431261,MUITOS CAPŐES,20/02/2021,2021-02-20,opendatasus
3202,RS,431261,MUITOS CAPŐES,08/03/2021,2021-03-08,opendatasus
3203,RS,431261,MUITOS CAPŐES,22/04/2021,2021-04-22,opendatasus
3204,RS,431306,NOVA HARTZ,19/05/2021,2021-05-19,opendatasus
3205,RS,431320,NOVA PETRÓPOLIS,01/05/2021,2021-05-01,opendatasus
3206,RS,431446,PINHAL DA SERRA,05/01/2021,2021-01-05,opendatasus
3207,RS,431446,PINHAL DA SERRA,05/02/2021,2021-02-05,opendatasus
3208,RS,431446,PINHAL DA SERRA,09/02/2021,2021-02-09,opendatasus
3209,RS,431446,PINHAL DA SERRA,11/02/2021,2021-02-11,opendatasus
3210,RS,431490,PORTO ALEGRE,16/02/2021,2021-02-16,opendatasus
3211,RS,431490,PORTO ALEGRE,22/04/2021,2021-04-22,opendatasus
3212,RS,431490,PORTO ALEGRE,23/04/2021,2021-04-23,opendatasus
3213,RS,431490,PORTO ALEGRE,12/05/2021,2021-05-12,opendatasus
3214,RS,431490,PORTO ALEGRE,16/11/2023,2023-11-16,opendatasus
3215,RS,431600,ROLANTE,19/04/2021,2021-04-19,opendatasus
3216,RS,431680,SANTA CRUZ DO SUL,29/03/2021,2021-03-29,opendatasus
3217,RS,431770,SANTO ANTÔNIO DAS MISSŐES,01/06/2023,2023-06-01,opendatasus
3218,RS,431770,SANTO ANTÔNIO DAS MISSŐES,06/10/2023,2023-10-06,opendatasus
3219,RS,431800,SĂO BORJA,11/10/2023,2023-10-11,opendatasus
3220,RS,431820,SĂO FRANCISCO DE PAULA,06/03/2021,2021-03-06,opendatasus
3221,RS,431900,SĂO MARCOS,11/04/2021,2021-04-11,opendatasus
3222,RS,431900,SĂO MARCOS,13/04/2021,2021-04-13,opendatasus
3223,RS,431900,SĂO MARCOS,14/04/2021,2021-04-14,opendatasus
3224,RS,431900,SĂO MARCOS,23/04/2021,2021-04-23,opendatasus
3225,RS,431900,SĂO MARCOS,30/04/2021,2021-04-30,opendatasus
3226,RS,432250,VACARIA,23/02/2021,2021-02-23,opendatasus
3227,RS,432250,VACARIA,24/02/2021,2021-02-24,opendatasus
3228,RS,432250,VACARIA,03/03/2021,2021-03-03,opendatasus
3229,RS,432250,VACARIA,07/03/2021,2021-03-07,opendatasus
3230,RS,432260,VENÂNCIO AIRES,20/04/2021,2021-04-20,opendatasus
3231,RS,432300,VIAMĂO,21/04/2021,2021-04-21,opendatasus
3232,MS,500220,BONITO,23/03/2015,2015-03-23,opendatasus
3233,MT,510180,BARRA DO GARÇAS,10/05/2017,2017-05-10,opendatasus
3234,MT,510340,CUIABÁ,08/02/2017,2017-02-08,opendatasus
3235,MT,510340,CUIABÁ,08/03/2017,2017-03-08,opendatasus
3236,MT,510340,CUIABÁ,17/08/2017,2017-08-17,opendatasus
3237,MT,510340,CUIABÁ,16/08/2018,2018-08-16,opendatasus
3238,MT,510340,CUIABÁ,05/12/2018,2018-12-05,opendatasus
3239,MT,510340,CUIABÁ,27/02/2019,2019-02-27,opendatasus
3240,MT,510340,CUIABÁ,15/03/2019,2019-03-15,opendatasus
3241,MT,510729,SĂO JOSÉ DO POVO,01/03/2017,2017-03-01,opendatasus
3242,GO,520005,ABADIA DE GOIÁS,01/10/2020,2020-10-01,opendatasus
3243,GO,520030,ALEXÂNIA,14/05/2015,2015-05-14,opendatasus
3244,GO,520060,ALTO PARAÍSO DE GOIÁS,28/01/2015,2015-01-28,opendatasus
3245,GO,520060,ALTO PARAÍSO DE GOIÁS,04/10/2016,2016-10-04,opendatasus
3246,GO,520090,AMORINÓPOLIS,30/03/2017,2017-03-30,opendatasus
3247,GO,520140,APARECIDA DE GOIÂNIA,28/04/2016,2016-04-28,opendatasus
3248,GO,520180,ARAGOIÂNIA,06/10/2020,2020-10-06,opendatasus
3249,GO,520340,BOM JARDIM DE GOIÁS,11/02/2017,2017-02-11,opendatasus
3250,GO,520660,CUMARI,22/12/2015,2015-12-22,opendatasus
3251,GO,520860,GOIANÉSIA,02/03/2017,2017-03-02,opendatasus
3252,GO,520870,GOIÂNIA,22/09/2015,2015-09-22,opendatasus
3253,GO,520870,GOIÂNIA,19/10/2015,2015-10-19,opendatasus
3254,GO,520870,GOIÂNIA,16/12/2015,2015-12-16,opendatasus
3255,GO,520870,GOIÂNIA,09/04/2016,2016-04-09,opendatasus
3256,GO,520870,GOIÂNIA,28/04/2016,2016-04-28,opendatasus
3257,GO,520870,GOIÂNIA,28/09/2016,2016-09-28,opendatasus
3258,GO,520870,GOIÂNIA,03/10/2016,2016-10-03,opendatasus
3259,GO,520870,GOIÂNIA,22/11/2016,2016-11-22,opendatasus
3260,GO,520870,GOIÂNIA,12/02/2017,2017-02-12,opendatasus
3261,GO,520870,GOIÂNIA,27/02/2017,2017-02-27,opendatasus
3262,GO,520870,GOIÂNIA,07/03/2017,2017-03-07,opendatasus
3263,GO,520870,GOIÂNIA,26/09/2020,2020-09-26,opendatasus
3264,GO,520870,GOIÂNIA,31/10/2020,2020-10-31,opendatasus
3265,GO,520870,GOIÂNIA,22/12/2020,2020-12-22,opendatasus
3266,GO,520880,GOIANIRA,24/03/2017,2017-03-24,opendatasus
3267,GO,521170,JANDAIA,19/01/2016,2016-01-19,opendatasus
3268,GO,521180,JARAGUÁ,06/02/2017,2017-02-06,opendatasus
3269,GO,521220,JUSSARA,12/01/2021,2021-01-12,opendatasus
3270,GO,521250,LUZIÂNIA,07/10/2015,2015-10-07,opendatasus
3271,GO,521250,LUZIÂNIA,14/04/2016,2016-04-14,opendatasus
3272,GO,521250,LUZIÂNIA,21/10/2020,2020-10-21,opendatasus
3273,GO,521250,LUZIÂNIA,08/12/2020,2020-12-08,opendatasus
3274,GO,521460,NIQUELÂNDIA,30/01/2015,2015-01-30,opendatasus
3275,GO,521483,NOVA CRIXÁS,19/04/2017,2017-04-19,opendatasus
3276,GO,521520,NOVO BRASIL,17/08/2015,2015-08-17,opendatasus
3277,GO,521540,OURO VERDE DE GOIÁS,09/09/2015,2015-09-09,opendatasus
3278,GO,522010,SĂO LUÍS DE MONTES BELOS,18/03/2016,2016-03-18,opendatasus
3279,GO,522020,SĂO MIGUEL DO ARAGUAIA,06/05/2015,2015-05-06,opendatasus
3280,GO,522045,SENADOR CANEDO,04/01/2016,2016-01-04,opendatasus
3281,GO,522060,SILVÂNIA,06/10/2016,2016-10-06,opendatasus
3282,DF,530010,BRASÍLIA,25/06/2015,2015-06-25,opendatasus
3283,DF,530010,BRASÍLIA,10/07/2015,2015-07-10,opendatasus
3284,DF,530010,BRASÍLIA,06/10/2015,2015-10-06,opendatasus
3285,DF,530010,BRASÍLIA,09/10/2015,2015-10-09,opendatasus
3286,DF,530010,BRASÍLIA,18/01/2016,2016-01-18,opendatasus
3287,DF,530010,BRASÍLIA,06/02/2016,2016-02-06,opendatasus
3288,DF,530010,BRASÍLIA,09/05/2016,2016-05-09,opendatasus
3289,DF,530010,BRASÍLIA,01/09/2016,2016-09-01,opendatasus
3290,DF,530010,BRASÍLIA,06/12/2016,2016-12-06,opendatasus
3291,DF,530010,BRASÍLIA,09/12/2016,2016-12-09,opendatasus
3292,DF,530010,BRASÍLIA,06/02/2017,2017-02-06,opendatasus
3293,DF,530010,BRASÍLIA,11/11/2017,2017-11-11,opendatasus
3294,DF,530010,BRASÍLIA,26/08/2020,2020-08-26,opendatasus
3295,DF,530010,BRASÍLIA,07/09/2020,2020-09-07,opendatasus
3296,DF,530010,BRASÍLIA,08/10/2020,2020-10-08,opendatasus
3297,DF,530010,BRASÍLIA,17/10/2020,2020-10-17,opendatasus
3298,DF,530010,BRASÍLIA,23/10/2020,2020-10-23,opendatasus
3299,DF,530010,BRASÍLIA,26/10/2020,2020-10-26,opendatasus
3300,DF,530010,BRASÍLIA,03/12/2020,2020-12-03,opendatasus
3301,AM,130353,PRESIDENTE FIGUEIREDO,05/02/2024,2024-02-05,opendatasus (atualizacao em 2025)
3302,AM,130010,ANORI,07/03/2024,2024-03-07,opendatasus (atualizacao em 2025)
3303,MG,314340,MONTE SIÃO,23/03/2024,2024-03-23,opendatasus (atualizacao em 2025)
3304,SP,355160,SERRA NEGRA,01/04/2024,2024-04-01,opendatasus (atualizacao em 2025)
3305,PA,521520,NOVO BRASIL,20/03/2024,2024-03-20,opendatasus (atualizacao em 2025)
3306,MG,311050,CAMANDUCAIA,19/12/2024,2024-12-19,opendatasus (atualizacao em 2025)
3307,SP,352550,JOANÓPOLIS,26/12/2024,2024-12-26,opendatasus (atualizacao em 2025)
3308,SP,355210,SOCORRO,23/12/2024,2024-12-23,opendatasus (atualizacao em 2025)
3309,MG,310910,BUENO BRANDÃO,30/03/2024,2024-03-30,opendatasus (atualizacao em 2025)
3310,MG,315920,SANTA RITA DE CALDAS,13/05/2024,2024-05-13,opendatasus (atualizacao em 2025)
3311,MG,310620,BELO HORIZONTE,25/06/2024,2024-06-25,opendatasus (atualizacao em 2025)
3312,MG,312510,EXTREMA,24/06/2024,2024-06-24,opendatasus (atualizacao em 2025)
3313,RR,140005,ALTO ALEGRE,16/08/2024,2024-08-16,opendatasus (atualizacao em 2025)
3314,SP,350760,BRAGANÇA PAULISTA,23/09/2024,2024-09-23,opendatasus (atualizacao em 2025)
3315,SP,353680,PEDRA BELA,17/09/2024,2024-09-17,opendatasus (atualizacao em 2025)
3316,MG,313150,IPUIÚNA,21/10/2024,2024-10-21,opendatasus (atualizacao em 2025)
3317,TO,172100,PALMAS,02/12/2024,2024-12-02,opendatasus (atualizacao em 2025)
3318,TO,172100,PALMAS,04/12/2024,2024-12-04,opendatasus (atualizacao em 2025)
3319,SP,354340,RIBEIRÃO PRETO,25/12/2024,2024-12-25,opendatasus (atualizacao em 2025)
3320,SP,354340,RIBEIRÃO PRETO,31/12/2024,2024-12-31,opendatasus (atualizacao em 2025)
3321,SP,353820,PINHALZINHO,20/12/2024,2024-12-20,opendatasus (atualizacao em 2025)
3322,SP,354340,RIBEIRÃO PRETO,30/12/2024,2024-12-30,opendatasus (atualizacao em 2025)
3323,SP,354340,RIBEIRÃO PRETO,20/12/2024,2024-12-20,opendatasus (atualizacao em 2025)
